Movie,Production Year,Watchtime,Rating,Metascore,Genres,Description,Votes,Director
Sixteen Candles,1984,93,7.0,61,"Comedy,Romance","A girl's ""sweet"" sixteenth birthday becomes anything but special, as she suffers from every embarrassment possible.","114,155",Director:John Hughes
Forgetting Sarah Marshall,2008,111,7.1,67,"Comedy,Drama,Romance","Devastated Peter takes a Hawaiian vacation in order to deal with the recent break-up with his TV star girlfriend, Sarah. Little does he know, Sarah's traveling to the same resort as her ex - and she's bringing along her new boyfriend.","280,550",Director:Nicholas Stoller
Shakespeare & Hathaway - Private Investigators,2018– ,45,7.6,0,"Comedy,Crime,Drama",An oddball couple of private detectives named Luella Shakespeare and Frank Hathaway investigate crime in Stratford-upon-Avon.,"4,017",
Return to Mayberry,1986 TV Movie,95,6.9,0,"Comedy,Romance","After being away for awhile, Andy Taylor returns home to Mayberry to visit Opie, now an expectant father. While there, he ends up helping Barney Fife mount a campaign for Sheriff.",993,Director:Bob Sweeney
White Collar,2009–2014,40,8.3,0,"Comedy,Crime,Drama","A white-collar criminal agrees to help the FBI catch other white-collar criminals using his expertise as an art and securities thief, counterfeiter, and conman.","128,624",
Mrs. Harris Goes to Paris,2022,92,0,0,"Comedy,Drama","A widowed cleaning lady in 1950s London falls madly in love with a couture Dior dress, and decides that she must have one of her own.",0,Director:Anthony Fabian
Snatch,2000,104,8.3,55,"Comedy,Crime","Unscrupulous boxing promoters, violent bookmakers, a Russian gangster, incompetent amateur robbers and supposedly Jewish jewelers fight to track down a priceless stolen diamond.","836,398",Director:Guy Ritchie
Aşk ve Canavarlar,I 2020,109,6.9,63,"Action,Adventure,Comedy","Seven years after he survived the monster apocalypse, lovably hapless Joel leaves his cozy underground bunker behind on a quest to reunite with his ex.","120,922",Director:Michael Matthews
Singin' in the Rain,1952,103,8.3,99,"Comedy,Musical,Romance",A silent film star falls for a chorus girl just as he and his delusionally jealous screen partner are trying to make the difficult transition to talking pictures in 1920s Hollywood.,"236,994","Directors:Stanley Donen, Gene Kelly"
American Dad!,2005– ,22,7.4,0,"Animation,Comedy","The random escapades of Stan Smith, a conservative C.I.A. Agent dealing with family life, and keeping America safe, all in the most absurd way possible.","124,884",
The Professor,2018,90,6.7,37,"Comedy,Drama",A college professor lives his life with reckless abandon after being diagnosed with a terminal illness.,"30,851",Director:Wayne Roberts
Dodgeball: A True Underdog Story,2004,92,6.7,55,"Comedy,Sport",A group of misfits enter a Las Vegas dodgeball tournament in order to save their cherished local gym from the onslaught of a corporate health fitness chain.,"244,644",Director:Rawson Marshall Thurber
The Gringo Papi,2022 Video,25,1.1,0,"Short,Comedy",The Gringo Papi: A stand-up comedy show written and attempted by Brendan Schaub produced by Thiccc Boy Studios.,"2,949",Director:Casey Geraghty
The Breakfast Club,1985,97,7.8,66,"Comedy,Drama",Five high school students meet in Saturday detention and discover how they have a lot more in common than they thought.,"385,926",Director:John Hughes
Bodies Bodies Bodies,2022,95,6.4,82,"Comedy,Horror,Thriller","When a group of rich 20-somethings plan a hurricane party at a remote family mansion, a party game turns deadly in this fresh and funny look at backstabbing, fake friends, and one party gone very, very wrong.",100,Director:Halina Reijn
Kelly's Heroes,1970,144,7.6,50,"Adventure,Comedy,War",A group of U.S. soldiers sneaks across enemy lines to get their hands on a secret stash of Nazi treasure.,"49,008",Director:Brian G. Hutton
Life & Beth,2022– ,30,6.5,0,"Comedy,Drama","After an unexpected incident, Beth starts having flashbacks to her teen self and learns how she became who she is and who she wants to become.","4,379",
Married with Children,1987–1997,22,8.1,0,Comedy,"With a pay check that is lower than what the local beggar is earning, and with a wife and two children whose only interest is to rob him of his last cents, shoe-salesman Al Bundy is lucky ...                See full summary »","102,238",
Idiocracy,2006,84,6.5,66,"Adventure,Comedy,Sci-Fi","Private Joe Bauers, a decisively average American, is selected as a guinea pig for a top-secret hibernation program but is forgotten, awakening to a future so incredibly moronic he's easily the most intelligent person alive.","159,344",Director:Mike Judge
Mythic Quest: Raven's Banquet,2020– ,30,7.7,0,Comedy,The owner of a successful video game design company and his troubled staff struggle to keep their hit game 'Mythic Quest' on top.,"21,358",
Pitch Perfect 2,2015,115,6.4,63,"Comedy,Music","After a humiliating command performance at The Kennedy Center, the Barden Bellas enter an international competition that no American group has ever won in order to regain their status and right to perform.","154,222",Director:Elizabeth Banks
Baywatch,2017,116,5.5,37,"Action,Comedy,Crime","Devoted lifeguard Mitch Buchannon butts heads with a brash new recruit, as they uncover a criminal plot that threatens the future of the bay.","181,848",Director:Seth Gordon
Ant-Man,2015,117,7.3,64,"Action,Adventure,Comedy","Armed with a super-suit with the astonishing ability to shrink in scale but increase in strength, cat burglar Scott Lang must embrace his inner hero and help his mentor, Dr. Hank Pym, pull off a plan that will save the world.","641,282",Director:Peyton Reed
Full House,1987–1995,22,6.7,0,"Comedy,Drama,Family",A widowed broadcaster raises his three daughters with assistance from his rock'n'roll brother-in-law and his madcap best friend.,"57,884",
Amphibia,2019–2022,23,8.1,0,"Animation,Action,Adventure","Ordinary Anne Boonchuy, 13, finds a music box that sends her to Amphibia, a world full of frogs, toads, and giant insects. With help from Sprig, she must adjust to life in Amphibia and discover the first true friendship in her life.","4,679",
Shining Vale,2022– ,29,6.8,0,"Comedy,Fantasy,Horror","A family moves to a small town into a house in which terrible atrocities have taken place. But no one seems to notice except for Pat, who's convinced she's either depressed or possessed - turns out, the symptoms are exactly the same.","2,322",
Everybody Loves Raymond,1996–2005,22,7.2,0,Comedy,The comical everyday life of sports columnist Ray Barone and his dysfunctional family.,"69,512",
Grown Ups,I 2010,102,5.9,30,Comedy,"After their high school basketball coach passes away, five good friends and former teammates reunite for a Fourth of July holiday weekend.","247,247",Director:Dennis Dugan
Mortdecai,2015,107,5.5,27,"Action,Adventure,Comedy","Juggling angry Russians, the British Mi5, and an international terrorist, debonair art dealer and part-time rogue Charlie Mortdecai races to recover a stolen painting rumored to contain a code that leads to lost gold.","71,869",Director:David Koepp
Four Weddings and a Funeral,1994,117,7.1,81,"Comedy,Drama,Romance","Over the course of five social occasions, a committed bachelor must consider the notion that he may have discovered love.","150,451",Director:Mike Newell
Human Resources,2022– ,30,7.2,0,"Animation,Comedy,Romance",A workplace comedy set in the world of the monsters from Big Mouth.,"4,770",
Hunter x Hunter,2011–2014,24,9.0,0,"Animation,Action,Adventure","Gon Freecss aspires to become a Hunter, an exceptional being capable of greatness. With his friends and his potential, he seeks for his father who left him when he was younger.","87,886",
Almost Famous,2000,122,7.9,90,"Adventure,Comedy,Drama",A high-school boy in the early 1970s is given the chance to write a story for Rolling Stone magazine about an up-and-coming rock band as he accompanies them on their concert tour.,"272,088",Director:Cameron Crowe
Pretty Woman,1990,119,7.1,51,"Comedy,Romance","A man in a legal but hurtful business needs an escort for some social events, and hires a beautiful prostitute he meets... only to fall in love.","316,057",Director:Garry Marshall
A través de mi ventana,2022,116,5.4,0,"Comedy,Drama,Romance","Raquel's longtime crush on her next-door neighbor turns into something more when he starts developing feelings for her, despite his family's objections.","7,911",Director:Marçal Forés
Dead Poets Society,1989,128,8.1,79,"Comedy,Drama",Maverick teacher John Keating uses poetry to embolden his boarding school students to new heights of self-expression.,"471,795",Director:Peter Weir
The Woman in the House Across the Street from the Girl in the Window,2022,208,6.3,0,"Comedy,Crime,Drama","When a handsome neighbor moves in across the street, Anna, a heartbroken woman for whom every day is the same, starts to see a light at the end of the tunnel; that is, until she witnesses a gruesome murder. Or did she?","39,766",
Little Miss Sunshine,2006,101,7.8,80,"Comedy,Drama",A family determined to get their young daughter into the finals of a beauty pageant take a cross-country trip in their VW bus.,"470,138","Directors:Jonathan Dayton, Valerie Faris"
Love Life,2020– ,35,7.5,0,"Comedy,Romance",Anna Kendrick stars in a fresh take on a romantic comedy anthology series about the journey from first love to lasting love.,"13,837",
Emma.,2020,124,6.7,71,"Comedy,Drama,Romance","In 1800s England, a well meaning but selfish young woman meddles in the love lives of her friends.","49,038",Director:Autumn de Wilde
The Big Short,2015,130,7.8,81,"Biography,Comedy,Drama","In 2006-2007 a group of investors bet against the US mortgage market. In their research, they discover how flawed and corrupt the market is.","415,667",Director:Adam McKay
What We Do in the Shadows,2014,86,7.6,76,"Comedy,Horror","Viago, Deacon, and Vladislav are vampires who are struggling with the mundane aspects of modern life, like paying rent, keeping up with the chore wheel, trying to get into nightclubs, and overcoming flatmate conflicts.","177,990","Directors:Jemaine Clement, Taika Waititi"
Silicon Valley,2014–2019,28,8.5,0,Comedy,"Follows the struggle of Richard Hendricks, a Silicon Valley engineer trying to build his own company called Pied Piper.","143,980",
Into the Woods,2014,125,5.9,69,"Adventure,Comedy,Drama",A witch tasks a childless baker and his wife with procuring magical items from classic fairy tales to reverse the curse put on their family tree.,"139,752",Director:Rob Marshall
The Duke,2020,95,6.9,74,"Biography,Comedy,Drama","In 1961, Kempton Bunton, a 60 year old taxi driver, steals Goya's portrait of the Duke of Wellington from the National Gallery in London.","4,410",Director:Roger Michell
Green Book,2018,130,8.2,69,"Biography,Comedy,Drama",A working-class Italian-American bouncer becomes the driver of an African-American classical pianist on a tour of venues through the 1960s American South.,"463,622",Director:Peter Farrelly
Chuck,2007–2012,43,8.2,0,"Action,Comedy,Drama","When a twenty-something computer geek inadvertently downloads critical government secrets into his brain, the C.I.A. and the N.S.A. assign two agents to protect him and exploit such knowledge, turning his life upside down.","135,889",
Scott Pilgrim vs. the World,2010,112,7.5,69,"Action,Comedy,Fantasy","In a magically realistic version of Toronto, a young man must defeat his new girlfriend's seven evil exes one by one in order to win her heart.","415,556",Director:Edgar Wright
Big Mouth,2017– ,30,7.9,0,"Animation,Comedy,Romance",Teenage friends find their lives upended by the wonders and horrors of puberty.,"74,670",
Ash vs Evil Dead,2015–2018,30,8.4,0,"Action,Comedy,Fantasy","Ash has spent the last thirty years avoiding responsibility, maturity, and the terrors of the Evil Dead until a Deadite plague threatens to destroy all of mankind and Ash becomes mankind's only hope.","71,016",
King of the Hill,1997–2010,30,7.4,0,"Animation,Comedy,Drama","A straight-laced propane salesman in Arlen, Texas tries to deal with the wacky antics of his family and friends, while also trying to keep his son in line.","51,207",
You've Got Mail,1998,119,6.7,57,"Comedy,Drama,Romance","Book superstore magnate, Joe Fox and independent book shop owner, Kathleen Kelly fall in love in the anonymity of the Internet both blissfully unaware that he's trying to put her out of business.","209,602",Director:Nora Ephron
The IT Crowd,2006–2013,25,8.5,0,Comedy,"The comedic misadventures of Roy, Moss and their grifting supervisor Jen, a rag-tag team of IT support workers at a large corporation headed by a hotheaded yuppie.","147,594",
Zootopia,2016,108,8.0,78,"Animation,Adventure,Comedy","In a city of anthropomorphic animals, a rookie bunny cop and a cynical con artist fox must work together to uncover a conspiracy.","481,497","Directors:Byron Howard, Rich Moore, Jared Bush"
Unplugging,2022,94,4.1,0,"Comedy,Romance","To revive their marriage and reconnect, a couple takes a self-prescribed digital detox weekend to a remote mountain town. What starts as a perfect weekend getaway without technology quickly spirals out of control.",197,Director:Debra Neil-Fisher
The Hangover,2009,100,7.7,73,Comedy,"Three buddies wake up from a bachelor party in Las Vegas, with no memory of the previous night and the bachelor missing. They make their way around the city in order to find their friend before his wedding.","767,067",Director:Todd Phillips
Love Classified,2022 TV Movie,90,6.3,0,"Comedy,Family,Romance","Hardin portrays romance novelist Emilia, described as a whirlwind who blows back into the lives of her adult children, Taylor (McNamara) and Zach (Lloyd-Jones), under the pretense of a book...                See full summary »",726,Director:Stacey N. Harding
The Proposal,I 2009,108,6.7,48,"Comedy,Drama,Romance",A pushy boss forces her young assistant to marry her in order to keep her visa status in the U.S. and avoid deportation to Canada.,"321,106",Director:Anne Fletcher
Fast Times at Ridgemont High,1982,90,7.1,61,"Comedy,Drama","A group of Southern California high school students are enjoying their most important subjects: sex, drugs, and rock n' roll.","103,372",Director:Amy Heckerling
Booksmart,2019,102,7.1,84,Comedy,"On the eve of their high-school graduation, two academic superstars and best friends realize they should have worked less and played more. Determined not to fall short of their peers, the girls try to cram four years of fun into one night.","113,716",Director:Olivia Wilde
Last Man Standing,2011–2021,30,7.5,0,Comedy,A married father of three tries to maintain his manliness in a world increasingly dominated by women.,"33,502",
La La Land,2016,128,8.0,94,"Comedy,Drama,Music","While navigating their careers in Los Angeles, a pianist and an actress fall in love while attempting to reconcile their aspirations for the future.","564,895",Director:Damien Chazelle
The Lobster,2015,119,7.1,82,"Comedy,Drama,Romance","In a dystopian near future, single people, according to the laws of The City, are taken to The Hotel, where they are obliged to find a romantic partner in forty-five days or are transformed into beasts and sent off into The Woods.","247,986",Director:Yorgos Lanthimos
Sonic Prime,2022– ,22,0,0,"Animation,Action,Adventure",Sonic in a high-octane adventure where the fate of a strange new multiverse rests in his gloved hands.,0,
Jane the Virgin,2014–2019,60,7.9,0,Comedy,"A young, devout Catholic woman discovers that she was accidentally artificially inseminated.","47,764",
10 Things I Hate About You,1999,97,7.3,70,"Comedy,Drama,Romance","A pretty, popular teenager can't go out on a date until her ill-tempered older sister does.","329,515",Director:Gil Junger
Ferris Bueller's Day Off,1986,103,7.8,61,Comedy,"A high school wise guy is determined to have a day off from school, despite what the Principal thinks of that.","348,035",Director:John Hughes
Ginny & Georgia,2021– ,0,7.4,0,"Comedy,Drama","Ginny Miller, an angsty fifteen-year-old, often feels more mature than her thirty-year-old mother, the irresistible and dynamic Georgia Miller.","44,565",
The Afterparty,2022– ,35,7.2,0,"Comedy,Crime,Mystery","When a high school reunion's afterparty ends in a death, everyone is a suspect. A detective grills the former classmates one by one, uncovering potential motives as each tells their version of the story - culminating in the shocking truth.","8,988",
Pitch Perfect 3,2017,93,5.8,40,"Comedy,Music","Following their win at the world championship, the now separated Bellas reunite for one last singing competition at an overseas USO tour, but face a group who uses both instruments and voices.","62,894",Director:Trish Sie
About Time,I 2013,123,7.8,55,"Comedy,Drama,Fantasy","At the age of 21, Tim discovers he can travel in time and change what happens and has happened in his own life. His decision to make his world a better place by getting a girlfriend turns out not to be as easy as you might think.","337,328",Director:Richard Curtis
Welcome to Flatch,2022– ,23,5.9,0,Comedy,"A documentary film crew follows a group of young adults and their current concerns, in their small town. The crew focus is the daily lives of cousins Kelly and Shrub Mallet and their idiosyncratic surroundings.","1,111",
Jumanji: Welcome to the Jungle,2017,119,6.9,58,"Action,Adventure,Comedy","Four teenagers are sucked into a magical video game, and the only way they can escape is to work together to finish the game.","365,066",Director:Jake Kasdan
Ratatouille,2007,111,8.1,96,"Animation,Adventure,Comedy",A rat who can cook makes an unusual alliance with a young kitchen worker at a famous Paris restaurant.,"702,829","Directors:Brad Bird, Jan Pinkava"
Doc Martin,2004–2022,46,8.4,0,"Comedy,Drama,Romance","The trials and tribulations of Dr. Martin Ellingham (Martin Clunes), a socially challenged doctor who moves from London to the picturesque village of Port Wenn in Cornwall.","15,462",
Porky's,1981,94,6.2,40,Comedy,"In 1954, a group of Florida high-school guys try to help their buddy lose his virginity, which leads them to seek revenge on a sleazy nightclub owner and his redneck sheriff brother for harassing them.","42,325",Director:Bob Clark
Shrek,2001,90,7.9,84,"Animation,Adventure,Comedy","A mean lord exiles fairytale creatures to the swamp of a grumpy ogre, who must go on a quest and rescue a princess for the lord in order to get his land back.","659,440","Directors:Andrew Adamson, Vicky Jenson"
Adventure Time,2010–2018,11,8.6,0,"Animation,Action,Adventure","A 12-year-old boy and his best friend, wise 28-year-old dog with magical powers, go on a series of surreal adventures with each other in a remote future.","89,955",
Californication,2007–2014,28,8.3,0,"Comedy,Drama","A writer tries to juggle his career, his relationship with his daughter and his ex-girlfriend, as well as his appetite for beautiful women.","178,810",
Smokin' Aces,2006,109,6.6,45,"Action,Comedy,Crime","When a Las Vegas performer-turned-snitch named Buddy Israel decides to turn state's evidence and testify against the mob, it seems that a whole lot of people would like to make sure he's no longer breathing.","144,338",Director:Joe Carnahan
Hogan's Heroes,1965–1971,25,7.8,0,"Comedy,War",The inmates of a German World War II prisoner of war camp conduct an espionage and sabotage campaign right under the noses of their warders.,"10,214",
Easter Sunday,2022,0,0,0,Comedy,"Set around a family gathering to celebrate Easter Sunday, the comedy will be based on Jo Koy's life experiences and stand-up comedy.",0,Director:Jay Chandrasekhar
Luca,2021,95,7.4,71,"Animation,Adventure,Comedy","On the Italian Riviera, an unlikely but strong friendship grows between a human being and a sea monster disguised as a human.","149,164",Director:Enrico Casarosa
Black Clover,2017–2021,24,8.3,0,"Animation,Action,Adventure","Asta and Yuno were abandoned together at the same church and have been inseparable since. As children, they promised that they would compete against each other to see who would become the next Emperor Magus.","19,982",
The King of Queens,1998–2007,22,7.4,0,Comedy,"Delivery man Doug Heffernan has a good life: He has a pretty wife (Carrie), a big television, and friends with which to watch it. Then Carrie's goofy and annoying father Arthur moves in with them.","81,263",
"Love, Victor",2020–2022,30,8.1,0,"Comedy,Drama,Romance","Victor is a new student at Creekwood High School on his own journey of self-discovery, facing challenges at home, adjusting to a new city, and struggling with his sexual orientation.","14,436",
The Bob's Burgers Movie,2022,102,0,0,"Animation,Adventure,Comedy","The Belchers try to save the restaurant from closing as a sinkhole forms in front of it, while the kids try to solve a mystery that could save their family's restaurant.",0,"Directors:Loren Bouchard, Bernard Derriman"
Cemetery Junction,2010,95,6.8,0,"Comedy,Drama",A 1970s-set comedy centered on three young working class friends in a dreary suburb of Reading.,"22,576","Directors:Ricky Gervais, Stephen Merchant"
The Parent Trap,1998,128,6.6,64,"Adventure,Comedy,Drama","Identical twins Annie and Hallie, separated at birth and each raised by one of their biological parents, later discover each other for the first time at summer camp and make a plan to bring their wayward parents back together.","133,825",Director:Nancy Meyers
The Legend of Vox Machina,2022– ,30,8.4,0,"Animation,Action,Adventure","In a desperate attempt to pay off a mounting bar tab, a band of misfits end up on a quest to save the realm of Exandria from dark, magical forces.","19,060",
Notting Hill,1999,124,7.2,68,"Comedy,Drama,Romance",The life of a simple bookshop owner changes when he meets the most famous film star in the world.,"302,688",Director:Roger Michell
Casual,2015–2018,25,7.5,0,"Comedy,Drama","A comedy series about a bachelor brother and his newly divorced sister living under one roof again. Together, they coach each other through the crazy world of dating while raising her teenage daughter.","8,423",
The Nanny,1993–1999,22,7.0,0,"Comedy,Family,Romance","After being fired from her job and dumped by her boyfriend, a cosmetics saleswoman becomes the nanny to the three children of a rich English widower. As time passes, the two fall for each other.","42,730",
Coyote Ugly,2000,100,5.7,27,"Comedy,Drama,Music","Aspiring songwriter Violet Sanford, after getting a job at a women-run NYC bar that teases its male patrons, comes out of her shell.","113,272",Director:David McNally
I Want You Back,2022,116,6.6,62,"Comedy,Romance",Newly dumped thirty-somethings Peter and Emma team up to sabotage their exes' new relationships and win them back for good.,"14,586",Director:Jason Orley
Good Omens,2019–2022,328,8.0,0,"Comedy,Fantasy","A tale of the bungling of Armageddon features an angel, a demon, an eleven-year-old Antichrist, and a doom-saying witch.","72,667",
Why Women Kill,2019– ,50,8.3,0,"Comedy,Crime,Drama","An anthology series that follows three women in different decades all living in the same house, as they deal with infidelity and betrayals in their marriages.","22,081",
Vicky Cristina Barcelona,2008,96,7.1,70,"Comedy,Drama,Romance","Two friends on a summer holiday in Spain become enamored with the same painter, unaware that his ex-wife, with whom he has a tempestuous relationship, is about to re-enter the picture.","253,130",Director:Woody Allen
Love & Other Drugs,2010,112,6.7,55,"Comedy,Drama,Romance","In 1990s Pittsburgh, a medicine peddler starts a relationship with a young woman suffering from Parkinson's disease.","199,798",Director:Edward Zwick
Ready or Not,I 2019,95,6.8,64,"Action,Comedy,Horror",A bride's wedding night takes a sinister turn when her eccentric new in-laws force her to take part in a terrifying game.,"140,852","Directors:Matt Bettinelli-Olpin, Tyler Gillett"
Kingsman: The Golden Circle,2017,141,6.7,44,"Action,Adventure,Comedy","After the Kingsman's headquarters are destroyed and the world is held hostage, an allied spy organisation in the United States is discovered. These two elite secret organisations must band together to defeat a common enemy.","317,417",Director:Matthew Vaughn
Emergency!,1972–1979,60,7.8,0,"Action,Adventure,Comedy","The crew of Los Angeles County Fire Department Station 51, particularly the paramedic team, and Rampart Hospital respond to emergencies in their operating area.","4,724",
Dix pour cent,2015–2020,52,8.3,0,"Comedy,Drama",French serial about the lives and jobs of people working at a talent agency.,"13,707",
Night Court,1984–1992,30,7.7,0,Comedy,An eccentric fun-loving judge presides over an urban night court and all the silliness going on there.,"13,688",
Sweet Home Alabama,2002,108,6.2,45,"Comedy,Romance",A young woman who has reinvented herself as a New York City socialite must return home to Alabama to obtain a divorce from her husband after seven years of separation.,"111,714",Director:Andy Tennant
The Ranch,2016–2020,30,7.4,0,"Comedy,Drama,Western",The son of a Colorado rancher returns home from a semi-pro football career to run the family business.,"37,892",
Mr. Mayor,2021– ,22,6.3,0,Comedy,A wealthy businessman becomes the mayor of Los Angeles.,"4,085",
Veep,2012–2019,28,8.3,0,Comedy,Former Senator Selina Meyer finds that being Vice President of the United States is nothing like she hoped and everything that everyone ever warned her about.,"53,289",
Just Go with It,2011,117,6.4,33,"Comedy,Romance","On a weekend trip to Hawaii, a plastic surgeon convinces his loyal assistant to pose as his soon-to-be-divorced wife in order to cover up a careless lie he told to his much-younger girlfriend.","239,383",Director:Dennis Dugan
