Movie,Production Year,Watchtime,Rating,Metascore,Genres,Description,Votes,Director
I Love That for You,2022– ,30,7.2,0,Comedy,A woman overcomes childhood leukemia to achieve her dream of becoming an on-air host at a home shopping network.,301,
The Orville,2017– ,44,8.0,0,"Adventure,Comedy,Drama",An exploratory ship from Earth faces intergalactic challenges 400 years in the future.,"69,082",
The Goldbergs,2013– ,22,8.1,0,Comedy,"This ABC show takes place in Jenkintown, Pennsylvania in the 1980s and follows the lives of a family named The Goldbergs.","36,504",
The Owl House,2020– ,22,8.1,0,"Animation,Action,Adventure","Accidentally sent to the world of the Boiling Isles before a trip to summer camp, a teenage human named Luz longs to become a witch, with the rebellious Eda and pint-sized demon King at her aid.","9,029",
Amor de madre,2022,110,5.8,0,Comedy,"A young man is stood up at the altar. His overprotective mother decides to join him is what would have been his honeymoon, so as not to waste the trip. He ails while his mum enjoys the trip of her life.","1,521",Director:Paco Caballero
BoJack Horseman,2014–2020,25,8.8,0,"Animation,Comedy,Drama","BoJack Horseman was the star of the hit television show ""Horsin' Around"" in the '80s and '90s, but now he's washed up, living in Hollywood, complaining about everything, and wearing colorful sweaters.","143,603",
Only Murders in the Building,2021– ,30,8.1,0,"Comedy,Crime,Drama",Three strangers who share an obsession with true crime suddenly find themselves caught up in one.,"66,696",
"Love, Death & Robots",2019– ,15,8.4,0,"Animation,Short,Action","A collection of animated short stories that span various genres including science fiction, fantasy, horror and comedy.","135,461",
Young Rock,2021– ,0,7.9,0,Comedy,A look at the formative years of superstar Dwayne 'The Rock' Johnson as he grows up through life.,"16,118",
Deadpool,2016,108,8.0,65,"Action,Adventure,Comedy","A wisecracking mercenary gets experimented on and becomes immortal but ugly, and sets out to track down the man who ruined his looks.","996,141",Director:Tim Miller
The Goonies,1985,114,7.7,62,"Adventure,Comedy,Family",A group of young misfits called The Goonies discover an ancient map and set out on an adventure to find a legendary pirate's long-lost treasure.,"265,047",Director:Richard Donner
Grease,1978,110,7.2,70,"Comedy,Musical,Romance","Good girl Sandy Olsson and greaser Danny Zuko fell in love over the summer. When they unexpectedly discover they're now in the same high school, will they be able to rekindle their romance?","263,676",Director:Randal Kleiser
Psych,2006–2014,44,8.4,0,"Comedy,Crime,Mystery","A novice sleuth is hired by the Police after he cons them into thinking he has psychic powers which help solve crimes. With the assistance of his reluctant best friend, the duo take on a series of complicated cases.","95,095",
Operation Fortune: Ruse de guerre,2022,114,7.4,0,"Action,Comedy,Thriller",Special agent Orson Fortune and his team of operatives recruit one of Hollywood's biggest movie stars to help them on an undercover mission when the sale of a deadly new weapons technology threatens to disrupt the world order.,227,Director:Guy Ritchie
Chip 'n' Dale: Rescue Rangers,2022,0,0,0,"Animation,Adventure,Comedy","A live-action film featuring animated version of Disney's chipmunks, Chip and Dale.",0,Director:Akiva Schaffer
Call Me Kat,2021– ,21,5.0,0,Comedy,A 39-year-old woman decides to use the money her parents had been saving for her wedding to open a cat-themed cafe.,"5,764",
Better Things,2016–2022,22,7.8,0,"Comedy,Drama",An actress raises her three daughters while juggling the pressures of working in Hollywood and being a single parent.,"15,115",
Jackass Forever,2022,96,7.0,74,"Documentary,Action,Comedy","After 11 years, the Jackass crew is back for another crusade.","32,736",Director:Jeff Tremaine
Sen Çal Kapimi,2020–2021,120,7.1,0,"Comedy,Romance","Due to circumstances, Serkan and Eda will have to pretend to be engaged. Comedy begins. And romance?","8,958",
The White Lotus,2021–2022,60,7.6,0,"Comedy,Drama","Set in a tropical resort, it follows the exploits of various guests and employees over the span of a week.","57,257",
The Great,2020– ,45,8.2,0,"Biography,Comedy,Drama","A royal woman living in rural Russia during the 18th century is forced to choose between her own personal happiness and the future of Russia, when she marries an Emperor.","38,974",
The Good Place,2016–2020,22,8.2,0,"Comedy,Drama,Fantasy",Four people and their otherworldly frienemy struggle in the afterlife to define what it means to be good.,"148,593",
Spider-Man: Into the Spider-Verse,2018,117,8.4,87,"Animation,Action,Adventure","Teen Miles Morales becomes the Spider-Man of his universe, and must join with five spider-powered individuals from other dimensions to stop a threat for all realities.","489,277","Directors:Bob Persichetti, Peter Ramsey, Rodney Rothman"
Crazy Rich Asians,2018,120,6.9,74,"Comedy,Drama,Romance","This contemporary romantic comedy, based on a global bestseller, follows native New Yorker Rachel Chu to Singapore to meet her boyfriend's family.","166,209",Director:Jon M. Chu
M*A*S*H,1972–1983,25,8.4,0,"Comedy,Drama,War",The staff of an Army hospital in the Korean War find that laughter is the best way to deal with their situation.,"55,936",
Senior Year,2022,111,0,0,"Comedy,Drama","A cheerleading stunt gone wrong landed her in a 20-year coma. Now she's 37, newly awake and ready to live out her high school dream: becoming prom queen.",0,Director:Alex Hardcastle
Monk,2002–2009,44,8.0,0,"Comedy,Crime,Drama","The series follows Adrian Monk, a brilliant former San Francisco detective, who now consults the police as a private consultant who battles with an obsessive-compulsive disorder.","73,379",
Sex/Life,2021– ,45,5.4,0,"Comedy,Drama,Romance",A suburban mother of two takes a fantasy-charged trip down memory lane that sets her very married present on a collision course with her wild-child past.,"19,679",
Revenge of the Nerds,1984,90,6.6,44,Comedy,"At Adams College, a group of bullied outcasts and misfits resolve to fight back for their peace and self-respect.","53,219",Director:Jeff Kanew
Red Notice,2021,118,6.3,37,"Action,Comedy,Thriller",An Interpol agent tracks the world's most wanted art thief.,"255,406",Director:Rawson Marshall Thurber
The O.C.,2003–2007,44,7.5,0,"Comedy,Drama,Romance","A troubled youth becomes embroiled in the lives of a close-knit group of people in the wealthy, upper-class neighborhood of Newport Beach, Orange County, California.","87,658",
Resident Alien,2021– ,44,8.1,0,"Comedy,Drama,Mystery",A crash-landed alien takes on the identity of a small-town Colorado doctor and slowly begins to wrestle with the moral dilemma of his secret mission on Earth.,"35,239",
Inside No. 9,2014– ,30,8.5,0,"Comedy,Crime,Drama","Anthology series which mixes dark humor with genres like crime, horror or drama. The show invites viewers into some very different No.9s, where the ordinary and mundane rub shoulders with the extraordinary and macabre.","16,078",
Letterkenny,2016– ,30,8.7,0,Comedy,"Quick-witted, fast-paced snappy comedy about rural folk getting by in a small town.","21,178",
American Pie,1999,95,7.0,58,Comedy,Four teenage boys enter a pact to lose their virginity by prom night.,"399,281","Directors:Paul Weitz, Chris Weitz"
Killing It,2022– ,0,7.1,0,Comedy,"Class, capitalism and one man's quest to achieve the American dream.","1,381",
Guardians of the Galaxy Vol. 2,2017,136,7.6,67,"Action,Adventure,Comedy","The Guardians struggle to keep together as a team while dealing with their personal family issues, notably Star-Lord's encounter with his father the ambitious celestial being Ego.","649,615",Director:James Gunn
Good Girls,2018–2021,43,7.7,0,"Comedy,Crime,Drama",Three suburban mothers suddenly find themselves in desperate circumstances and decide to stop playing it safe and risk everything to take their power back.,"49,871",
Charlie's Angels,2019,118,4.9,52,"Action,Adventure,Comedy","When a young systems engineer blows the whistle on a dangerous technology, Charlie's Angels are called into action, putting their lives on the line to protect us all.","70,810",Director:Elizabeth Banks
Desperate Housewives,2004–2012,45,7.6,0,"Comedy,Drama,Mystery","Secrets and truths unfold through the lives of female friends in one suburban neighborhood, after the mysterious suicide of a neighbor.","125,944",
Jumanji: The Next Level,2019,123,6.7,58,"Action,Adventure,Comedy","In Jumanji: The Next Level, the gang is back but the game has changed. As they return to rescue one of their own, the players will have to brave parts unknown from arid deserts to snowy mountains, to escape the world's most dangerous game.","238,345",Director:Jake Kasdan
The Truman Show,1998,103,8.2,90,"Comedy,Drama",An insurance salesman discovers his whole life is actually a reality TV show.,"1,035,905",Director:Peter Weir
Beetle Juice,1988,92,7.5,70,"Comedy,Fantasy","The spirits of a deceased couple are harassed by an unbearable family that has moved into their home, and hire a malicious spirit to drive them out.","291,152",Director:Tim Burton
Cheers,1982–1993,22,7.9,0,"Comedy,Drama","The regulars of the Boston bar ""Cheers"" share their experiences and lives with each other while drinking or working at the bar where everybody knows your name.","53,459",
After Life,2019–2022,30,8.5,0,"Comedy,Drama","After Tony's wife dies, his nice-guy persona is altered into an impulsive, devil-may-care attitude; taking his old world by storm.","127,961",
Ghosts,2019– ,30,8.3,0,"Comedy,Fantasy",A group of spirits restlessly squabble in an abandoned country home. A new couple move in and will the ghosts end up being friends with the couple or will they want them out.,"14,276",
The Outlaws,2021– ,0,7.6,0,"Comedy,Crime,Drama",Seven strangers from different walks of life forced together to complete a community payback sentence in Bristol.,"7,530",
Kingsman: The Secret Service,2014,129,7.7,60,"Action,Adventure,Comedy","A spy organisation recruits a promising street kid into the agency's training program, while a global threat emerges from a twisted tech genius.","652,076",Director:Matthew Vaughn
Abbott Elementary,2021– ,22,8.2,0,Comedy,"Follows a group of teachers brought together in one of the worst public schools in the country, simply because they love teaching.","8,002",
Back to the Future,1985,116,8.5,87,"Adventure,Comedy,Sci-Fi","Marty McFly, a 17-year-old high school student, is accidentally sent thirty years into the past in a time-traveling DeLorean invented by his close friend, the eccentric scientist Doc Brown.","1,159,963",Director:Robert Zemeckis
Cry-Baby,1990,85,6.4,63,"Comedy,Musical","In 1950s Baltimore, a bad boy with a heart of gold wins the love of a good girl, whose boyfriend sets out for revenge.","59,419",Director:John Waters
Marry Me,2022,112,6.1,51,"Comedy,Music,Romance","Music superstars Kat Valdez and Bastian are getting married before a global audience of fans. But when Kat learns, seconds before her vows, that Bastian has been unfaithful, she instead decides to marry Charlie, a stranger in the crowd.","21,862",Director:Kat Coiro
The Golden Girls,1985–1992,30,8.1,0,"Comedy,Drama","Four previously married women live together in Miami, sharing their various experiences together and enjoying themselves despite hard times.","40,315",
"Crazy, Stupid, Love.",2011,118,7.4,68,"Comedy,Drama,Romance","A middle-aged husband's life changes dramatically when his wife asks him for a divorce. He seeks to rediscover his manhood with the help of a newfound friend, Jacob, learning to pick up girls at bars.","508,342","Directors:Glenn Ficarra, John Requa"
Rumspringa,II 2022,101,5.2,0,Comedy,"A young Amish man travels to Berlin on a rite of passage to connect with his roots, explore other ways of life, fall in love — and face a big decision.",533,Director:Mira Thiel
Cruella,2021,134,7.3,59,"Adventure,Comedy,Crime",A live-action prequel feature film following a young Cruella de Vil.,"219,961",Director:Craig Gillespie
Space Force,2020–2022,30,6.7,0,Comedy,The people tasked with creating a sixth branch of the armed services: The Space Force.,"62,159",
Jojo Rabbit,2019,108,7.9,58,"Comedy,Drama,War",A young German boy in the Hitler Youth whose hero and imaginary friend is the country's dictator is shocked to discover that his mother is hiding a Jewish girl in their home.,"367,992",Director:Taika Waititi
Ghostbusters,1984,105,7.8,71,"Action,Comedy,Fantasy","Three parapsychologists forced out of their university funding set up shop as a unique ghost removal service in New York City, attracting frightened yet skeptical customers.","404,382",Director:Ivan Reitman
Dazed and Confused,1993,103,7.6,78,Comedy,The adventures of high school and junior high students on the last day of school in May 1976.,"179,708",Director:Richard Linklater
Ms. Marvel,2022– ,0,0,0,"Action,Adventure,Comedy",New Jersey raised Kamala Khan learns she has polymorphous powers.,0,
Entourage,2004–2011,28,8.5,0,"Comedy,Drama",Film star Vince Chase navigates the vapid terrain of Los Angeles with a close circle of friends and his trusty agent.,"166,648",
Deadpool 2,2018,119,7.7,66,"Action,Adventure,Comedy","Foul-mouthed mutant mercenary Wade Wilson (a.k.a. Deadpool) assembles a team of fellow mutant rogues to protect a young boy with supernatural abilities from the brutal, time-traveling cyborg Cable.","553,230",Director:David Leitch
Agatha Raisin,2014– ,60,7.2,0,"Comedy,Crime,Drama",The Cotswolds-based PR guru turned amateur sleuth returns for a series of comedic murder-mysteries based on the books by M.C. Beaton.,"4,746",
The King of Staten Island,2020,136,7.1,67,"Comedy,Drama",Scott has been a case of arrested development since his firefighter dad died. He spends his days smoking weed and dreaming of being a tattoo artist until events force him to grapple with his grief and take his first steps forward in life.,"62,274",Director:Judd Apatow
Saturday Night Live,1975– ,90,8.0,0,"Comedy,Music",A famous guest host stars in parodies and sketches created by the cast of this witty show.,"47,909",
iCarly,2021– ,26,6.5,0,"Comedy,Drama,Romance",A group of best friends creating a webcast while grappling with everyday problems and adventures.,"4,282",
Archer,2009– ,22,8.6,0,"Animation,Action,Comedy",Covert black ops and espionage take a back seat to zany personalities and relationships between secret agents and drones.,"150,744",
Fear and Loathing in Las Vegas,1998,118,7.5,41,"Adventure,Comedy,Drama",An oddball journalist and his psychopathic lawyer travel to Las Vegas for a series of psychedelic escapades.,"276,618",Director:Terry Gilliam
Wonka,2023,0,0,0,"Adventure,Comedy,Family",The story will focus specifically on a young Willy Wonka and how he met the Oompa-Loompas on one of his earliest adventures.,0,Director:Paul King
Dollface,2019–2022,29,7.4,0,Comedy,"After breaking up with her longtime boyfriend, a woman tries to reconnect with the friends she lost during the relationship.","8,734",
"O Brother, Where Art Thou?",2000,107,7.7,69,"Adventure,Comedy,Crime","In the deep south during the 1930s, three escaped convicts search for hidden treasure while a relentless lawman pursues them.","306,557","Directors:Joel Coen, Ethan Coen"
Mom,2013–2021,30,7.3,0,"Comedy,Drama,Romance",A newly sober single mom tries to pull her life together in Napa Valley while dealing with her wayward mother.,"34,253",
Glee,2009–2015,44,6.8,0,"Comedy,Drama,Music",A group of ambitious misfits try to escape the harsh realities of high school by joining a glee club headed by a passionate Spanish teacher.,"145,457",
SpongeBob SquarePants,1999– ,23,8.2,0,"Animation,Comedy,Family","The misadventures of a talking sea sponge who works at a fast food restaurant, attends a boating school, and lives in an underwater pineapple.","94,714",
Dark Shadows,2012,113,6.2,55,"Comedy,Fantasy,Horror","An imprisoned vampire, Barnabas Collins, is set free and returns to his ancestral home, where his dysfunctional descendants are in need of his protection.","262,970",Director:Tim Burton
Swiss Army Man,2016,97,6.9,64,"Comedy,Drama,Fantasy","A hopeless man stranded on a deserted island befriends a dead body, and together they go on a surreal journey to get home.","116,760","Directors:Dan Kwan, Daniel Scheinert"
Clueless,1995,97,6.9,68,"Comedy,Romance","Shallow, rich and socially successful Cher is at the top of her Beverly Hills high school's pecking scale. Seeing herself as a matchmaker, Cher first coaxes two teachers into dating each other.","208,550",Director:Amy Heckerling
Mean Girls,2004,97,7.1,66,Comedy,"Cady Heron is a hit with The Plastics, the A-list girl clique at her new school, until she makes the mistake of falling for Aaron Samuels, the ex-boyfriend of alpha Plastic Regina George.","370,420",Director:Mark Waters
Futurama,1999–2023,22,8.5,0,"Animation,Adventure,Comedy","Philip J. Fry, a pizza delivery boy, is accidentally frozen in 1999 and thawed out on New Year's Eve 2999.","230,375",
Weird Science,1985,94,6.6,46,"Comedy,Romance,Sci-Fi","Two high school nerds use a computer program to literally create the perfect woman, but she turns their lives upside down.","87,305",Director:John Hughes
We're the Millers,2013,110,7.0,44,"Comedy,Crime",A veteran pot dealer creates a fake family as part of his plan to move a huge shipment of weed into the U.S. from Mexico.,"438,855",Director:Rawson Marshall Thurber
Hitman's Wife's Bodyguard,2021,100,6.1,32,"Action,Comedy,Crime","The bodyguard, Michael Bryce, continues his friendship with assassin, Darius Kincaid, as they try to save Darius' wife Sonia.","83,829",Director:Patrick Hughes
Happy Gilmore,1996,92,7.0,31,"Comedy,Sport",A rejected hockey player puts his skills to the golf course to save his grandmother's house.,"217,985",Director:Dennis Dugan
Austin Powers: International Man of Mystery,1997,94,7.0,51,"Adventure,Comedy",A world-class playboy and part-time secret agent from the 1960s emerges after thirty years in a cryogenic state to battle with his nemesis Dr. Evil.,"236,201",Director:Jay Roach
Dead to Me,2019–2022,30,8.0,0,"Comedy,Crime,Drama",A series about a powerful friendship that blossoms between a tightly wound widow and a free spirit with a shocking secret.,"73,291",
Cars,2006,117,7.2,73,"Animation,Adventure,Comedy","A hot-shot race-car named Lightning McQueen gets waylaid in Radiator Springs, where he finds the true meaning of friendship and family.","405,872","Directors:John Lasseter, Joe Ranft"
Fleabag,2016–2019,27,8.7,0,"Comedy,Drama",A comedy series adapted from the award-winning play about a young woman trying to cope with life in London whilst coming to terms with a recent tragedy.,"139,785",
Jungle Cruise,2021,127,6.6,50,"Action,Adventure,Comedy",Based on Disneyland's theme park ride where a small riverboat takes a group of travelers through a jungle filled with dangerous animals and reptiles but with a supernatural element.,"176,811",Director:Jaume Collet-Serra
The Big Lebowski,1998,117,8.1,71,"Comedy,Crime","Ultimate L.A. slacker Jeff ""The Dude"" Lebowski, mistaken for a millionaire of the same name, seeks restitution for a rug ruined by debt collectors, enlisting his bowling buddies for help while trying to find the millionaire's missing wife.","790,240","Directors:Joel Coen, Ethan Coen"
The Sandlot,1993,101,7.8,55,"Comedy,Drama,Family","In the summer of 1962, a new kid in town is taken under the wing of a young baseball prodigy and his rowdy team, resulting in many adventures.","89,009",Director:David Mickey Evans
Emily in Paris,2020– ,30,6.9,0,"Comedy,Drama,Romance",A young American woman from the Midwest is hired by a marketing firm in Paris to provide them with an American perspective on things.,"84,314",
Sing,2016,108,7.1,59,"Animation,Comedy,Family","In a city of humanoid animals, a hustling theater impresario's attempt to save his theater with a singing competition becomes grander than he anticipates even as its finalists find that their lives will never be the same.","162,239","Directors:Garth Jennings, Christophe Lourdelet"
Doom Patrol,2019– ,60,7.8,0,"Action,Adventure,Comedy",The adventures of an idealistic mad scientist and his field team of superpowered outcasts.,"49,786",
Moana,I 2016,107,7.6,81,"Animation,Adventure,Comedy","In Ancient Polynesia, when a terrible curse incurred by the Demigod Maui reaches Moana's island, she answers the Ocean's call to seek out the Demigod to set things right.","320,591","Directors:Ron Clements, John Musker, Don Hall, Chris Williams"
Naruto: Shippûden,2007–2017,24,8.7,0,"Animation,Action,Adventure","Naruto Uzumaki, is a loud, hyperactive, adolescent ninja who constantly searches for approval and recognition, as well as to become Hokage, who is acknowledged as the leader and strongest of all ninja in the village.","115,855",
The Love Boat,1977–1987,60,6.2,0,"Comedy,Drama,Romance","The romantic and comic tales of the passengers and crew of the cruise ship, Pacific Princess.","11,265",
Red Rocket,2021,130,7.2,76,"Comedy,Drama","Mikey Saber is a washed-up porn star who returns to his small Texas hometown, not that anyone really wants him back.","17,559",Director:Sean Baker
Naruto,2002–2007,24,8.4,0,"Animation,Action,Adventure","Naruto Uzumaki, a mischievous adolescent ninja, struggles as he searches for recognition and dreams of becoming the Hokage, the village's leader and strongest ninja.","93,969",
Six Feet Under,2001–2005,60,8.7,0,"Comedy,Drama",A chronicle of the lives of a dysfunctional family who run an independent funeral home in Los Angeles.,"132,072",
The Andy Griffith Show,1960–1968,30,8.4,0,"Comedy,Family","Widower Sheriff Andy Taylor, and his son Opie, live with Andy's Aunt Bee in Mayberry, North Carolina. With virtually no crimes to solve, most of Andy's time is spent philosophizing and calming down his cousin Deputy Barney Fife.","14,596",
Army of Darkness,1992,81,7.4,59,"Comedy,Horror","A sardonic hardware store clerk is accidentally transported to 1300 A.D., where he must retrieve the Necronomicon and battle an army of the dead so he can return home.","174,124",Director:Sam Raimi
Army of Thieves,2021,127,6.4,49,"Action,Comedy,Crime","A prequel, set before the events of Army of the Dead, which focuses on German safecracker Ludwig Dieter leading a group of aspiring thieves on a top secret heist during the early stages of the zombie apocalypse.","71,051",Director:Matthias Schweighöfer
Boy Meets World,1993–2000,23,8.1,0,"Comedy,Drama,Family",An adolescent with two siblings tests his various theories about life as he endures the trials of growing up alongside a good friend.,"42,140",
The Hating Game,2021,102,6.2,0,"Comedy,Romance","Resolving to achieve professional success without compromising her ethics, Lucy embarks on a ruthless game of one-upmanship against cold and efficient nemesis Joshua, a rivalry that is complicated by her growing attraction to him.","11,388",Director:Peter Hutchings
The Grand Budapest Hotel,2014,99,8.1,88,"Adventure,Comedy,Crime","A writer encounters the owner of an aging high-class hotel, who tells him of his early years serving as a lobby boy in the hotel's glorious years under an exceptional concierge.","780,612",Director:Wes Anderson
Girls5eva,2021– ,30,7.1,0,"Comedy,Music",A one-hit-wonder band from the '90s gets a second shot at fame when a young rapper samples their song.,"2,996",
Office Space,1999,89,7.7,68,Comedy,Three company workers who hate their jobs decide to rebel against their greedy boss.,"260,763",Director:Mike Judge
Airplane!,1980,88,7.7,78,Comedy,A man afraid to fly must ensure that a plane lands safely after the pilots become sick.,"233,196","Directors:Jim Abrahams, David Zucker, Jerry Zucker"
The Girl Next Door,2004,109,6.7,47,"Comedy,Drama,Romance",A teenager's dreams come true when a former porn star moves in next door and they fall in love.,"221,362",Director:Luke Greenfield
Hook,1991,142,6.8,52,"Adventure,Comedy,Family","When Captain James Hook kidnaps his children, an adult Peter Pan must return to Neverland and reclaim his youthful spirit in order to challenge his old enemy.","250,136",Director:Steven Spielberg
Guardians of the Galaxy Vol. 3,2023,0,0,0,"Action,Adventure,Comedy",Plot unknown. Third installment of the 'Guardians of the Galaxy' franchise.,0,Director:James Gunn
Dolittle,2020,101,5.6,26,"Adventure,Comedy,Family",A physician who can talk to animals embarks on an adventure to find a legendary island with a young apprentice and a crew of strange pets.,"62,316",Director:Stephen Gaghan
The Neighborhood,I 2018– ,30,6.4,0,Comedy,A friendly guy from the Midwest tries to fit in in a tough L.A. neighborhood.,"7,010",
Love Actually,2003,135,7.6,55,"Comedy,Drama,Romance","Follows the lives of eight very different couples in dealing with their love lives in various loosely interrelated tales all set during a frantic month before Christmas in London, England.","474,401",Director:Richard Curtis
Bachchhan Paandey,2022,147,6.5,0,"Action,Comedy,Crime",A budding director tries to research a merciless gangster for making a film on gangster-ism. But her secret attempts to conduct the research fail when she gets caught for snooping.,"33,442",Director:Farhad Samji
Good Trouble,2019– ,45,7.4,0,"Comedy,Drama,Romance",Callie and Mariana Foster move to Los Angeles and begin their lives as young adults.,"6,621",
30 Rock,2006–2013,22,8.3,0,Comedy,"Liz Lemon, head writer of the sketch comedy show ""TGS with Tracy Jordan"", must deal with an arrogant new boss and a crazy new star, all while trying to run a successful television show without losing her mind.","121,508",
