Movie,Production Year,Watchtime,Rating,Metascore,Genres,Description,Votes,Director
A Business Proposal,2022– ,60,8.2,0,"Comedy,Drama,Romance","In disguise as her friend, Ha-ri shows up to a blind date to scare him away. But plans go awry when he turns out to be her CEO - and makes a proposal.","4,936",
Druk,2020,117,7.7,79,"Comedy,Drama",Four high-school teachers consume alcohol on a daily basis to see how it affects their social and professional lives.,"142,959",Director:Thomas Vinterberg
JoJo no kimyô-na bôken,2012– ,30,8.4,0,"Animation,Action,Adventure","The story of the Joestar family, who are possessed with intense psychic strength, and the adventures each member encounters throughout their lives.","20,170",
Ant-Man and the Wasp: Quantumania,2023,0,0,0,"Action,Adventure,Comedy",The further adventures of Ant-Man and the Wasp.,0,Director:Peyton Reed
Where the Boys Are,1960,99,6.6,63,"Comedy,Drama,Romance","Four very different college girls drive to Fort Lauderdale, Florida for spring break and seek out various adventures and romance for themselves.","2,702",Director:Henry Levin
Fire Island,2022,105,0,0,"Comedy,Romance",A pair of best friends set out to have a legendary week-long summer vacation with the help of cheap rosé and a group of eclectic friends.,0,Director:Andrew Ahn
Blue Mountain State,2010–2011,22,8.3,0,"Comedy,Sport","Three incoming freshmen attending Midwestern college football powerhouse Blue Mountain State must quickly adapt to college life and juggle football, girls, classes and nonstop hazing.","52,874",
Batman,1966–1968,25,7.5,0,"Action,Adventure,Comedy",The Caped Crusader and his young ward battle evildoers in Gotham City.,"21,976",
Raya and the Last Dragon,2021,107,7.3,75,"Animation,Action,Adventure","In a realm known as Kumandra, a re-imagined Earth inhabited by an ancient civilization, a warrior named Raya is determined to find the last dragon.","142,211","Directors:Don Hall, Carlos López Estrada, Paul Briggs, John Ripa"
Weeds,2005–2012,28,7.9,0,"Comedy,Crime,Drama","When a suburban mother turns to dealing marijuana in order to maintain her privileged lifestyle after her husband dies, she finds out just how addicted her entire neighborhood already is.","108,587",
Bill & Ted Face the Music,2020,91,5.9,65,"Adventure,Comedy,Music","Once told they'd save the universe during a time-traveling adventure, 2 would-be rockers from San Dimas, California find themselves as middle-aged dads still trying to crank out a hit song and fulfill their destiny.","44,696",Director:Dean Parisot
Hagane no renkinjutsushi,2009–2012,24,9.1,0,"Animation,Action,Adventure",Two brothers search for a Philosopher's Stone after an attempt to revive their deceased mother goes awry and leaves them in damaged physical forms.,"156,540",
21 Jump Street,2012,109,7.2,69,"Action,Comedy,Crime",A pair of underachieving cops are sent back to a local high school to blend in and bring down a synthetic drug ring.,"546,092","Directors:Phil Lord, Christopher Miller"
Coco,I 2017,105,8.4,81,"Animation,Adventure,Comedy","Aspiring musician Miguel, confronted with his family's ancestral ban on music, enters the Land of the Dead to find his great-great-grandfather, a legendary singer.","476,579","Directors:Lee Unkrich, Adrian Molina"
Spaceballs,1987,96,7.1,46,"Adventure,Comedy,Sci-Fi",A star-pilot for hire and his trusty sidekick must come to the rescue of a princess and save Planet Druidia from the clutches of the evil Spaceballs.,"186,879",Director:Mel Brooks
Aladdin,2019,128,6.9,53,"Adventure,Comedy,Family",A kind-hearted street urchin and a power-hungry Grand Vizier vie for a magic lamp that has the power to make their deepest wishes come true.,"257,268",Director:Guy Ritchie
Dr. Strangelove or: How I Learned to Stop Worrying and Love the Bomb,1964,95,8.4,97,"Comedy,War","An insane American general orders a bombing attack on the Soviet Union, triggering a path to nuclear holocaust that a war room full of politicians and generals frantically tries to stop.","480,110",Director:Stanley Kubrick
And Just Like That...,2021– ,0,5.6,0,"Comedy,Drama,Romance","The series will follow Carrie, Miranda and Charlotte as they navigate the journey from the complicated reality of life and friendship in their 30s to the even more complicated reality of life and friendship in their 50s.","25,676",
Home Team,2022,95,6.0,23,"Comedy,Sport","The story about New Orleans Saints head coach Sean Payton coaching his son's 6th grade football team, when Payton was suspended for the entire 2012 season as a result of his role in the Saints' Bountygate scandal.","16,329","Directors:Charles Kinnane, Daniel Kinnane"
Frozen,I 2013,102,7.4,75,"Animation,Adventure,Comedy","When the newly crowned Queen Elsa accidentally uses her power to turn things into ice to curse her home in infinite winter, her sister Anna teams up with a mountain man, his playful reindeer, and a snowman to change the weather condition.","610,998","Directors:Chris Buck, Jennifer Lee"
Inside Out,I 2015,95,8.2,94,"Animation,Adventure,Comedy","After young Riley is uprooted from her Midwest life and moved to San Francisco, her emotions - Joy, Fear, Anger, Disgust and Sadness - conflict on how best to navigate a new city, house, and school.","687,399","Directors:Pete Docter, Ronnie Del Carmen"
Gravity Falls,2012–2016,23,8.9,0,"Animation,Action,Adventure","Twin siblings Dipper and Mabel Pines spend the summer at their great-uncle's tourist trap in the enigmatic Gravity Falls, Oregon.","97,534",
Girls,2012–2017,28,7.3,0,"Comedy,Drama",A comedy about the experiences of a group of girls in their early 20s.,"70,743",
Legally Blonde,2001,96,6.4,59,"Comedy,Romance","Elle Woods, a fashionable sorority queen, is dumped by her boyfriend. She decides to follow him to law school. While she is there, she figures out that there is more to her than just looks.","210,596",Director:Robert Luketic
Blended,2014,117,6.5,31,"Comedy,Romance","After a bad blind date, a man and woman find themselves stuck together at a resort for families, where their attraction grows as their respective kids benefit from the burgeoning relationship.","130,128",Director:Frank Coraci
Matilda,1996,98,6.9,72,"Comedy,Family,Fantasy","A girl gifted with a keen intellect and psychic powers uses both to deal with her crude, distant family and free her kind teacher from their sadistic headmistress.","146,402",Director:Danny DeVito
Moonshot,2022,104,5.5,58,"Comedy,Romance,Sci-Fi","This romantic comedy with a twist follows two college students as they join forces in order to be reunited with their significant others, embarking on a lively journey that takes them wildly off course.","3,845",Director:Christopher Winterbauer
She-Hulk,2022– ,0,0,0,"Action,Adventure,Comedy",Jennifer Walters acquires Hulk-like qualities.,0,
Evil Dead II,1987,84,7.7,72,"Comedy,Horror",The lone survivor of an onslaught of flesh-possessing spirits holes up in a cabin with a group of strangers while the demons continue their attack.,"160,306",Director:Sam Raimi
Kung Fu Panda 3,2016,95,7.1,66,"Animation,Action,Adventure","Continuing his ""legendary adventures of awesomeness"", Po must face two hugely epic, but different threats: one supernatural and the other a little closer to home.","152,818","Directors:Alessandro Carloni, Jennifer Yuh Nelson"
The Intouchables,2011,112,8.5,57,"Biography,Comedy,Drama","After he becomes a quadriplegic from a paragliding accident, an aristocrat hires a young man from the projects to be his caregiver.","831,308","Directors:Olivier Nakache, Éric Toledano"
Donald Trump's The Art of the Deal: The Movie,2016 TV Movie,50,5.8,75,Comedy,"Funny or Die presents a satirical rendition of Donald Trump's 1987 best selling business book, The Art of the Deal.","4,477",Director:Jeremy Konner
Ant-Man and the Wasp,2018,118,7.0,70,"Action,Adventure,Comedy","As Scott Lang balances being both a superhero and a father, Hope van Dyne and Dr. Hank Pym present an urgent new mission that finds the Ant-Man fighting alongside The Wasp to uncover secrets from their past.","378,663",Director:Peyton Reed
Superbad,2007,113,7.6,76,Comedy,Two co-dependent high school seniors are forced to deal with separation anxiety after their plan to stage a booze-soaked party goes awry.,"562,735",Director:Greg Mottola
Lady Bird,2017,94,7.4,93,"Comedy,Drama","In 2002, an artistically inclined seventeen-year-old girl comes of age in Sacramento, California.","278,617",Director:Greta Gerwig
Men in Black: International,2019,114,5.6,38,"Action,Adventure,Comedy","The Men in Black have always protected the Earth from the scum of the universe. In this new adventure, they tackle their biggest threat to date: a mole in the Men in Black organization.","130,490",Director:F. Gary Gray
La vita è bella,1997,116,8.6,59,"Comedy,Drama,Romance","When an open-minded Jewish waiter and his son become victims of the Holocaust, he uses a perfect mixture of will, humor, and imagination to protect his son from the dangers around their camp.","676,244",Director:Roberto Benigni
Hart of Dixie,2011–2015,60,7.7,0,"Comedy,Drama,Romance","New Yorker and new doctor Zoe Hart accepts an offer from a stranger, Dr. Harley Wilkes, to work in his medical practice in Bluebell, Alabama. She arrives to find that he has died and left half the practice to her in his will.","52,024",
Toy Story,1995,81,8.3,95,"Animation,Adventure,Comedy",A cowboy doll is profoundly threatened and jealous when a new spaceman figure supplants him as top toy in a boy's room.,"963,098",Director:John Lasseter
Scary Movie,2000,88,6.2,48,Comedy,"A year after disposing of the body of a man they accidentally killed, a group of dumb teenagers are stalked by a bumbling serial killer.","254,823",Director:Keenen Ivory Wayans
Borderlands,2022,0,0,0,"Action,Adventure,Comedy",A feature film based on the popular video game set on the abandoned fictional planet of Pandora where people search for a mysterious relic.,0,Director:Eli Roth
Never Have I Ever,2020–2023,30,7.8,0,"Comedy,Drama","The complicated life of a modern-day first generation Indian American teenage girl, inspired by Mindy Kaling's own childhood.","45,341",
Samurai Rabbit: The Usagi Chronicles,2022– ,25,6.5,0,"Animation,Action,Adventure","Teenage Rabbit Samurai Yuichi, a descendant of the great warrior Miyamoto Usagi, embarks on an epic quest to become a true samurai.",193,
GLOW,2017–2019,35,8.0,0,"Comedy,Drama,Sport",A look at the personal and professional lives of a group of women who perform for a wrestling organization in Los Angeles during the 1980s.,"45,284",
Freaks and Geeks,1999–2000,44,8.8,0,"Comedy,Drama",A high school mathlete starts hanging out with a group of burnouts while her younger brother navigates his freshman year.,"139,446",
Blazing Saddles,1974,93,7.7,73,"Comedy,Western","In order to ruin a western town, a corrupt politician appoints a black Sheriff, who promptly becomes his most formidable adversary.","136,610",Director:Mel Brooks
Minions: The Rise of Gru,2022,90,0,0,"Animation,Adventure,Comedy",The untold story of one twelve-year-old's dream to become the world's greatest supervillain.,0,"Directors:Kyle Balda, Brad Ableson, Jonathan del Val"
Here We Go,2020– ,0,6.9,0,Comedy,The Jessops decide to boost family morale by going on a summer holiday - in October.,366,
Old School,2003,88,7.0,54,Comedy,Three friends attempt to recapture their glory days by opening up a fraternity near their alma mater.,"227,564",Director:Todd Phillips
That '80s Show,2002,30,4.8,0,Comedy,That '80s Show is a half-hour ensemble comedy focusing on a group of twenty-somethings finding their way through the '80s in San Diego.,"2,181",
A Simple Favor,2018,117,6.8,67,"Comedy,Crime,Mystery","Stephanie is a single mother with a parenting vlog who befriends Emily, a secretive upper-class woman who has a child at the same elementary school. When Emily goes missing, Stephanie takes it upon herself to investigate.","145,318",Director:Paul Feig
The End of the F***ing World,2017–2019,25,8.1,0,"Adventure,Comedy,Crime","James is 17 and is pretty sure he is a psychopath. Alyssa, also 17, is the cool and moody new girl at school. The pair make a connection and she persuades him to embark on a road trip in search of her real father.","177,894",
Happy Days,1974–1984,30,7.4,0,"Comedy,Family,Music",The Cunningham family live through the 1950s with help and guidance from lovable and almost superhuman greaser Fonzie.,"18,551",
The Hitman's Bodyguard,2017,118,6.9,47,"Action,Comedy,Crime","The world's top bodyguard gets a new client, a hitman who must testify at the International Criminal Court. They must put their differences aside and work together to make it to the trial on time.","225,243",Director:Patrick Hughes
Kaguya-sama wa kokurasetai ~ Tensai tachi no ren'ai zunô sen ~,2019– ,24,8.5,0,"Animation,Comedy,Romance",The proudly privileged top two students of an elite school each makes it their mission to be the first to extract a confession of love from the other.,"10,402",
Taskmaster,2015– ,60,9.0,0,"Comedy,Game-Show","Five comedians are set tasks challenging their creativity and wit. The tasks are supervised by Alex Horne but the Taskmaster, Greg Davies, always has the final word.","10,831",
How We Roll,2022– ,0,5.1,0,Comedy,Follows professional bowler Tom Smallwood's life.,382,
Men in Black,1997,98,7.3,71,"Action,Adventure,Comedy",A police officer joins a secret organization that polices and monitors extraterrestrial interactions on Earth.,"554,105",Director:Barry Sonnenfeld
Hot Fuzz,2007,121,7.8,81,"Action,Comedy,Mystery","A skilled London police officer, after irritating superiors with his embarrassing effectiveness, is transferred to a village where the easygoing officers object to his fervor for regulations, as a string of grisly murders strikes the town.","495,868",Director:Edgar Wright
Scooby-Doo,2002,89,5.2,35,"Adventure,Comedy,Family","After an acrimonious break up, the Mystery Inc. gang are individually brought to an island resort to investigate strange goings on.","110,039",Director:Raja Gosnell
