Movie,Production Year,Watchtime,Rating,Metascore,Genres,Description,Votes,Director
The Mentalist,2008–2015,43,8.1,0,"Crime,Drama,Mystery","A famous ""psychic"" outs himself as a fake, and starts working as a consultant for the California Bureau of Investigation so he can find ""Red John"", the madman who killed his wife and daughter.","179,584",
The Dark Knight,2008,152,9.0,84,"Action,Crime,Drama","When the menace known as the Joker wreaks havoc and chaos on the people of Gotham, Batman must accept one of the greatest psychological and physical tests of his ability to fight injustice.","2,555,367",Director:Christopher Nolan
The Gilded Age,2022– ,81,8.0,0,Drama,"A wide-eyed young scion of a conservative family embarks on a mission to infiltrate the wealthy neighboring clan dominated by ruthless railroad tycoon George Russell, his rakish son, Larry, and his ambitious wife, Bertha.","19,513",
Love,II 2015,135,6.0,51,"Drama,Romance","Murphy is an American living in Paris who enters a highly sexually and emotionally charged relationship with Electra. Unaware of the effect it will have on their relationship, they invite their pretty neighbor into their bed.","56,844",Director:Gaspar Noé
Candy,2022,0,7.3,0,"Biography,Crime,Drama","Candy Montgomery is a 1980s housewife and mother who did everything right - but when the pressure of conformity builds within her, her actions scream for just a bit of freedom. Until someone tells her to shush. With deadly results.",372,
Castle,2009–2016,43,8.1,0,"Comedy,Crime,Drama","After a serial killer imitates the plots of his novels, successful mystery novelist Richard ""Rick"" Castle receives permission from the Mayor of New York City to tag along with an NYPD homicide investigation team for research purposes.","158,701",
Midsomer Murders,1997– ,90,7.9,0,"Crime,Drama,Mystery",A veteran Detective Chief Inspector and his young Sergeant investigate murders around the regional community of Midsomer County.,"31,774",
Star Trek: Discovery,2017– ,60,7.0,0,"Action,Adventure,Drama","Ten years before Kirk, Spock, and the Enterprise, the USS Discovery discovers new worlds and lifeforms as one Starfleet officer learns to understand all things alien.","117,971",
Father Stu,2022,124,6.9,42,"Biography,Drama","Follows the life of Father Stuart Long, a boxer-turned-priest who inspired countless people during his journey from self-destruction to redemption.","2,598",Director:Rosalind Ross
From,2022– ,52,7.6,0,"Drama,Horror,Mystery","Unravel the mystery of a city in middle U.S.A. that imprisons everyone who enters. As the residents struggle to maintain a sense of normalcy and seek a way out, they must also survive the threats of the surrounding forest.","11,801",
Elvis,2022,0,0,0,"Biography,Drama,Music","A look at the life of the legendary rock and roll star, Elvis Presley.",0,Director:Baz Luhrmann
The Royals,2015–2018,42,7.4,0,Drama,Drama about a fictional British royal family in modern-day London.,"12,223",
ER,1994–2009,44,7.8,0,"Drama,Romance","The lives, loves and losses of the doctors and nurses of Chicago's County General Hospital.","58,898",
American Horror Story,2011– ,60,8.0,0,"Drama,Horror,Sci-Fi","An anthology series centering on different characters and locations, including a house with a murderous past, an insane asylum, a witch coven, a freak show circus, a haunted hotel, a possessed farmhouse, a cult, the apocalypse, a slasher summer camp, and a bleak beach town and desert valley.","307,101",
Blue Bloods,2010– ,43,7.7,0,"Crime,Drama,Mystery",Revolves around a family of New York cops.,"38,612",
House M.D.,2004–2012,44,8.7,0,"Drama,Mystery",An antisocial maverick doctor who specializes in diagnostic medicine does whatever it takes to solve puzzling cases that come his way using his crack team of doctors and his wits.,"448,467",
The Essex Serpent,2022– ,0,0,0,Drama,"Follows London widow Cora Seaborne who moves to Essex to investigate reports of a mythical serpent. She forms a bond of science and skepticism with the pastor, but when tragedy strikes, locals accuse her of attracting the creature.",0,
The Shawshank Redemption,1994,142,9.3,81,Drama,"Two imprisoned men bond over a number of years, finding solace and eventual redemption through acts of common decency.","2,584,918",Director:Frank Darabont
Shameless,2011–2021,46,8.6,0,"Comedy,Drama","A scrappy, feisty, fiercely loyal Chicago family makes no apologies.","230,257",
The Witcher,2019– ,60,8.2,0,"Action,Adventure,Drama","Geralt of Rivia, a solitary monster hunter, struggles to find his place in a world where people often prove more wicked than beasts.","465,989",
Les 7 vies de Léa,2022– ,45,7.5,0,"Crime,Drama,Fantasy","Follows a woman who stumbles upon the body of Ismael, a teenager who disappeared thirty years earlier, with the event taking her back to 1991 and seeing her wake up every morning in the body of a different person.","1,214",
Tehran,2020– ,45,7.5,0,"Action,Crime,Drama",A Mossad agent embarks on her first mission as a computer hacker in her home town of Tehran.,"13,787",
True Detective,2014–2019,55,8.9,0,"Crime,Drama,Mystery","Seasonal anthology series in which police investigations unearth the personal and professional secrets of those involved, both within and outside the law.","546,479",
WeCrashed,2022,427,7.3,0,"Biography,Drama","The greed-filled rise and inevitable fall of WeWork, one of the world's most valuable startups, and the narcissists whose chaotic love made it all possible.","7,767",
The Vampire Diaries,2009–2017,43,7.7,0,"Drama,Fantasy,Horror","The lives, loves, dangers and disasters in the town, Mystic Falls, Virginia. Creatures of unspeakable horror lurk beneath this town as a teenage girl is suddenly torn between two vampire brothers.","310,793",
Lost,2004–2010,44,8.4,0,"Adventure,Drama,Fantasy",The survivors of a plane crash are forced to work together in order to survive on a seemingly deserted tropical island.,"536,550",
American Psycho,2000,102,7.6,64,"Crime,Drama,Horror","A wealthy New York City investment banking executive, Patrick Bateman, hides his alternate psychopathic ego from his co-workers and friends as he delves deeper into his violent, hedonistic fantasies.","567,755",Director:Mary Harron
Operation Mincemeat,2021,128,6.8,65,"Drama,War","During WWII, two intelligence officers use a corpse and false papers to outwit German troops.","2,576",Director:John Madden
Élite,2018– ,60,7.4,0,"Crime,Drama,Thriller","When three working-class teenagers begin attending an exclusive private school in Spain, the clash between them and the wealthy students leads to murder.","73,080",
The Marvelous Mrs. Maisel,2017– ,57,8.7,0,"Comedy,Drama","After her husband leaves her, young mother of two Miriam ""Midge"" Maisel discovers that she has a talent for stand-up comedy. Could this be her calling?","108,805",
Midsommar,2019,148,7.1,72,"Drama,Horror,Mystery",A couple travels to Northern Europe to visit a rural hometown's fabled Swedish mid-summer festival. What begins as an idyllic retreat quickly devolves into an increasingly violent and bizarre competition at the hands of a pagan cult.,"286,361",Director:Ari Aster
NCIS: Los Angeles,2009– ,43,6.7,0,"Action,Crime,Drama","The Naval Criminal Investigation Service's Office of Special Projects takes on the undercover work and the hard to crack cases in LA. Key agents are G. Callen and Sam Hanna, streets kids risen through the ranks.","52,777",
The X Files,1993–2018,45,8.6,0,"Crime,Drama,Mystery","Two F.B.I. Agents, Fox Mulder the believer and Dana Scully the skeptic, investigate the strange and unexplained, while hidden forces work to impede their efforts.","217,556",
That '70s Show,1998–2006,22,8.1,0,"Comedy,Drama,Romance","A comedy revolving around a group of teenage friends, their mishaps, and their coming of age, set in 1970s Wisconsin.","165,880",
Magic Mike XXL,2015,115,5.6,60,"Comedy,Drama,Music","Three years after Mike bowed out of the stripper life at the top of his game, he and the remaining Kings of Tampa hit the road to Myrtle Beach to put on one last blow-out performance.","55,600",Director:Gregory Jacobs
Bosch,2014–2021,51,8.5,0,"Crime,Drama",An L.A.P.D. homicide detective works to solve the murder of a thirteen-year-old boy while standing trial in federal court for the murder of a serial killer.,"64,882",
Fargo,2014– ,53,8.9,0,"Crime,Drama,Thriller","Various chronicles of deception, intrigue and murder in and around frozen Minnesota. Yet all of these tales mysteriously lead back one way or another to Fargo, North Dakota.","362,063",
The VVitch: A New-England Folktale,2015,92,6.9,83,"Drama,Fantasy,History","A family in 1630s New England is torn apart by the forces of witchcraft, black magic, and possession.","243,706",Director:Robert Eggers
West Side Story,2021,156,7.2,85,"Crime,Drama,Musical","An adaptation of the 1957 musical, West Side Story explores forbidden love and the rivalry between the Jets and the Sharks, two teenage street gangs of different ethnic backgrounds.","70,607",Director:Steven Spielberg
Lucifer,2016–2021,42,8.1,0,"Crime,Drama,Fantasy",Lucifer Morningstar has decided he's had enough of being the dutiful servant in Hell and decides to spend some time on Earth to better understand humanity. He settles in Los Angeles - the City of Angels.,"308,315",
Don't Look Up,2021,138,7.2,49,"Comedy,Drama,Sci-Fi",Two low-level astronomers must go on a giant media tour to warn mankind of an approaching comet that will destroy planet Earth.,"498,577",Director:Adam McKay
S.W.A.T.,2017– ,43,7.0,0,"Action,Adventure,Crime",Follows a locally born and bred S.W.A.T. sergeant and his team of highly-trained men and women as they solve crimes in Los Angeles.,"21,816",
Billions,2016– ,60,8.4,0,Drama,New money means no mercy as Mike Prince takes the Axe Capital throne. Chuck Rhoades is convinced no one should have that much wealth - or power. As all the players seek out new alliances only one thing's for certain - wealth means war.,"91,294",
Top Boy,2011– ,60,8.4,0,"Crime,Drama,Thriller",Two London drug dealers ply their lucrative trade at a public housing estate in East London.,"22,978",
Riverdale,2017– ,45,6.7,0,"Crime,Drama,Mystery","While navigating the troubled waters of romance, school and family, Archie and his gang become entangled in dark Riverdale mysteries.","139,162",
Vikings: Valhalla,2022– ,51,7.1,0,"Action,Adventure,Drama","Follow-up series to 'Vikings' set 100 years afterward and centering on the adventures of Leif Erikson, Freydis, Harald Hardrada and the Norman King William the Conqueror.","31,357",
Death in Paradise,2011– ,60,7.8,0,"Comedy,Crime,Drama","A UK police DI is transferred to St-Marie to investigate murders on the island, but he hates the sun, sea, and sand. Later series see other English and Irish detectives take over the role.","19,892",
Queen of the South,2016–2021,42,7.9,0,"Action,Crime,Drama",Teresa flees Mexico after her drug-runner boyfriend is murdered. Settling in Dallas she looks to become the country's reigning drug smuggler and to avenge her lover's murder.,"28,527",
Chicago P.D.,2014– ,43,8.1,0,"Action,Crime,Drama","Follows District 21 of the Chicago Police Department, which is made up of two distinctly different groups: the uniformed cops and the Intelligence Unit.","36,431",
Thar,2022,108,6.2,0,"Action,Crime,Drama",A man who moves to a big town to seek a job and to avenge his past.,"2,143",Director:Raj Singh Chaudhary
Cobra Kai,2018– ,30,8.6,0,"Action,Comedy,Drama","Decades after their 1984 All Valley Karate Tournament bout, a middle-aged Daniel LaRusso and Johnny Lawrence find themselves martial-arts rivals again.","163,881",
Sanditon,2019– ,60,7.7,0,"Drama,Romance","About Charlotte Heywood, a spirited and impulsive woman, who moves from her rural home to Sanditon, a fishing village attempting to reinvent itself as a seaside resort.","12,491",
Call the Midwife,2012– ,60,8.5,0,"Drama,History",Chronicles the lives of a group of midwives living in East London in the late-1950s to late-1960s.,"25,660",
Yellowjackets,2021– ,60,7.9,0,"Drama,Horror,Mystery",A wildly talented high school girl soccer team becomes the (un)lucky survivors of a plane crash deep in the Canadian wilderness.,"37,438",
Sex and the City,1998–2004,30,7.2,0,"Comedy,Drama,Romance",Four female New Yorkers gossip about their sex lives (or lack thereof) and find new ways to deal with being a woman in the late 1990s.,"123,196",
Legacies,2018– ,45,7.3,0,"Adventure,Drama,Fantasy","Hope Mikaelson, a tribrid daughter of a Vampire/Werewolf hybrid, makes her way in the world.","28,884",
Fifty Shades of Grey,2015,125,4.1,46,"Drama,Romance,Thriller","Literature student Anastasia Steele's life changes forever when she meets handsome, yet tormented, billionaire Christian Grey.","315,035",Director:Sam Taylor-Johnson
Oppenheimer,2023,0,0,0,"Biography,Drama,History",The story of American scientist J. Robert Oppenheimer and his role in the development of the atomic bomb.,0,Director:Christopher Nolan
Men,2022,100,0,0,"Drama,Horror,Sci-Fi",A young woman goes on a solo vacation to the English countryside following the death of her ex-husband.,0,Director:Alex Garland
Once Upon a Time in... Hollywood,2019,161,7.6,83,"Comedy,Drama",A faded television actor and his stunt double strive to achieve fame and success in the final years of Hollywood's Golden Age in 1969 Los Angeles.,"687,234",Director:Quentin Tarantino
Bones,2005–2017,40,7.8,0,"Comedy,Crime,Drama","Forensic anthropologist Dr. Temperance ""Bones"" Brennan and cocky F.B.I. Special Agent Seeley Booth build a team to investigate murders. Quite often, there isn't more to examine than rotten flesh or mere bones.","154,032",
Murder on the Orient Express,2017,114,6.5,52,"Crime,Drama,Mystery","When a murder occurs on the train on which he's travelling, celebrated detective Hercule Poirot is recruited to solve the case.","247,436",Director:Kenneth Branagh
The Umbrella Academy,2019– ,60,8.0,0,"Action,Adventure,Comedy","A family of former child heroes, now grown apart, must reunite to continue to protect the world.","202,562",
Gentleman Jack,2019– ,60,8.2,0,"Biography,Drama,History","A dramatization of the life of LGBTQ+ trailblazer, voracious learner, and cryptic diarist Anne Lister.","11,925",
Legends of Tomorrow,2016–2022,42,6.8,0,"Action,Adventure,Drama","Time-traveling rogue Rip Hunter must recruit a ragtag team of heroes and villains to help prevent an apocalypse that could impact not only Earth, but all of time.","102,703",
House of Gucci,2021,158,6.6,59,"Crime,Drama","When Patrizia Reggiani, an outsider from humble beginnings, marries into the Gucci family, her unbridled ambition begins to unravel their legacy and triggers a reckless spiral of betrayal, decadence, revenge, and ultimately...murder.","102,542",Director:Ridley Scott
The Godfather: Part II,1974,202,9.0,90,"Crime,Drama","The early life and career of Vito Corleone in 1920s New York City is portrayed, while his son, Michael, expands and tightens his grip on the family crime syndicate.","1,230,047",Director:Francis Ford Coppola
New Amsterdam,2018– ,43,8.0,0,Drama,A new medical director breaks the rules to heal the system at America's oldest public hospital.,"35,623",
Big Sky,2020– ,60,6.8,0,"Crime,Drama,Mystery",A private detective teams up with an ex-cop to solve a kidnapping case in Montana.,"16,745",
The Wolf of Wall Street,2013,180,8.2,75,"Biography,Comedy,Crime","Based on the true story of Jordan Belfort, from his rise to a wealthy stock-broker living the high life to his fall involving crime, corruption and the federal government.","1,340,402",Director:Martin Scorsese
K.G.F: Chapter 1,2018,156,8.2,0,"Action,Crime,Drama","In the 1970s, a gangster goes undercover as a slave to assassinate the owner of a notorious gold mine.","73,545","Directors:Prashanth Neel, Jocky"
Joker,I 2019,122,8.4,59,"Crime,Drama,Thriller",A mentally troubled stand-up comedian embarks on a downward spiral that leads to the creation of an iconic villain.,"1,190,269",Director:Todd Phillips
The Expanse,2015–2022,60,8.5,0,"Drama,Mystery,Sci-Fi","In the 24th century, a group of humans untangle a vast plot which threatens the Solar System's fragile state of detente.","146,680",
Arcane: League of Legends,2021– ,41,9.1,0,"Animation,Action,Adventure","Set in utopian Piltover and the oppressed underground of Zaun, the story follows the origins of two iconic League champions-and the power that will tear them apart.","175,498",
Pieces of Her,2022– ,52,6.3,0,"Crime,Drama,Mystery","When a Saturday afternoon trip to the mall with her mother suddenly explodes into violence, an adrift young woman's conception of her mother is forever changed.","19,602",
A Million Little Things,2018– ,43,7.9,0,"Comedy,Drama,Romance",A group of friends becomes motivated to living fuller lives after the unexpected death of a close friend.,"12,934",
Forrest Gump,1994,142,8.8,82,"Drama,Romance","The presidencies of Kennedy and Johnson, the Vietnam War, the Watergate scandal and other historical events unfold from the perspective of an Alabama man with an IQ of 75, whose only desire is to be reunited with his childhood sweetheart.","1,994,460",Director:Robert Zemeckis
Sons of Anarchy,2008–2014,45,8.6,0,"Crime,Drama,Thriller",A biker struggles to balance being a father and being involved in an outlaw motorcycle club.,"287,911",
The Crown,2016– ,58,8.7,0,"Biography,Drama,History",Follows the political rivalries and romance of Queen Elizabeth II's reign and the events that shaped the second half of the twentieth century.,"190,895",
Nobody,I 2021,92,7.4,64,"Action,Crime,Drama","A docile family man slowly reveals his true character after his house gets burgled by two petty thieves, which, coincidentally, leads him into a bloody war with a Russian crime boss.","223,904",Director:Ilya Naishuller
Interstellar,2014,169,8.6,74,"Adventure,Drama,Sci-Fi",A team of explorers travel through a wormhole in space in an attempt to ensure humanity's survival.,"1,728,659",Director:Christopher Nolan
Daredevil,2015–2018,54,8.6,0,"Action,Crime,Drama","A blind lawyer by day, vigilante by night. Matt Murdock fights the crime of New York as Daredevil.","419,556",
The Thing About Pam,2022,258,7.1,0,"Crime,Drama","Based on the 2011 murder of Betsy Faria that resulted in her husband, Russ' conviction, but he insisted he did not kill her. This brutal crime set off a chain of events that would expose a diabolical scheme deeply involving Pam Hupp.","4,987",
Blade Runner 2049,2017,164,8.0,81,"Action,Drama,Mystery","Young Blade Runner K's discovery of a long-buried secret leads him to track down former Blade Runner Rick Deckard, who's been missing for thirty years.","539,920",Director:Denis Villeneuve
Zachowaj spokój,2022,284,6.1,0,"Crime,Drama,Mystery","When a young man goes missing soon after his friend dies, life in a tight-knit, affluent Warsaw suburb slowly unravels, exposing secrets and lies.","1,531",
Choose or Die,2022,84,4.7,43,"Drama,Horror,Thriller","After firing up a lost 80s survival horror game, a young coder unleashes a hidden curse that tears reality apart, forcing her to make terrifying decisions and face deadly consequences.","14,960",Director:Toby Meakins
Bubble,2022,100,6.5,56,"Animation,Action,Adventure","After bubbles that broke the laws of gravity rained down upon the world. Cut off from the outside world, Tokyo has become a playground for a group of young people who have lost their families.","2,505",Director:Tetsurô Araki
The Resident,2018– ,60,7.8,0,Drama,A group of doctors at Chastain Memorial Hospital face personal and professional challenges on a daily basis.,"25,472",
Star Wars: The Clone Wars,2008–2020,23,8.4,0,"Animation,Action,Adventure",Jedi Knights lead the Grand Army of the Republic against the droid army of the Separatists.,"85,573",
Chicago Med,2015– ,43,7.6,0,Drama,"The city's most highly skilled medical team saves lives, while navigating their unique interpersonal relationships.","24,145",
The Power of the Dog,2021,126,6.9,89,"Drama,Romance,Western","Charismatic rancher Phil Burbank inspires fear and awe in those around him. When his brother brings home a new wife and her son, Phil torments them until he finds himself exposed to the possibility of love.","158,431",Director:Jane Campion
Titanic,1997,194,7.9,75,"Drama,Romance","A seventeen-year-old aristocrat falls in love with a kind but poor artist aboard the luxurious, ill-fated R.M.S. Titanic.","1,133,641",Director:James Cameron
Lightyear,2022,0,0,0,"Animation,Action,Adventure",The story of Buzz Lightyear and his adventures to infinity and beyond.,0,Director:Angus MacLane
Gilmore Girls,2000–2007,44,8.2,0,"Comedy,Drama","A dramedy centering around the relationship between a thirtysomething single mother and her teen daughter living in Stars Hollow, Connecticut.","119,041",
The Lord of the Rings: The Rings of Power,2022– ,0,0,0,"Action,Adventure,Drama","Epic drama set thousands of years before the events of J.R.R. Tolkien's 'The Hobbit' and 'The Lord of the Rings' follows an ensemble cast of characters, both familiar and new, as they confront the long-feared re-emergence of evil to Middle-earth.",0,
Mad Men,2007–2015,47,8.7,0,Drama,"A drama about one of New York's most prestigious ad agencies at the beginning of the 1960s, focusing on one of the firm's most mysterious but extremely talented ad executives, Donald Draper.","231,442",
Ridley Road,2021– ,229,6.7,0,"Drama,Thriller","When Vivien Epstein follows her lover into danger and he is caught between life and death, Vivien finds herself going undercover with the fascists, not only for him but for the sake of her country.","1,923",
Sherlock,2010–2017,88,9.1,0,"Crime,Drama,Mystery",A modern update finds the famous sleuth and his doctor partner solving crime in 21st century London.,"891,719",
Dexter,2006–2013,53,8.7,0,"Crime,Drama,Mystery","He's smart. He's lovable. He's Dexter Morgan, America's favorite serial killer, who spends his days solving crimes and nights committing them. Golden Globe winner Michael C. Hall stars in the hit SHOWTIME Original Series.","711,549",
The Lighthouse,I 2019,109,7.4,83,"Drama,Fantasy,History",Two lighthouse keepers try to maintain their sanity while living on a remote and mysterious New England island in the 1890s.,"200,599",Director:Robert Eggers
The Time Traveler's Wife,2022– ,0,0,0,"Drama,Fantasy,Romance",A couple's relationship is put to the test when time travel is involved. A TV adaptation of Audrey Niffenegger's novel 'The Time Traveler's Wife.',0,
Chernobyl,2019,330,9.4,0,"Drama,History,Thriller","In April 1986, an explosion at the Chernobyl nuclear power plant in the Union of Soviet Socialist Republics becomes one of the world's worst man-made catastrophes.","694,068",
One Tree Hill,2003–2012,60,7.7,0,"Drama,Romance,Sport","Half-brothers Lucas and Nathan Scott trade between kinship and rivalry both on the basketball court and in the hearts of their friends in the small, but not so quiet town of Tree Hill, North Carolina.","78,557",
Raised by Wolves,2020– ,0,7.5,0,"Drama,Fantasy,Sci-Fi",Androids are tasked with raising human children on a mysterious planet.,"74,274",
Life After Life,2022– ,0,7.4,0,Drama,"Ursula Todd dies one night in 1910 before she can draw her first breath. On that same night in 1910, Ursula is born and survives.",646,
Verdens verste menneske,2021,128,7.9,90,"Comedy,Drama,Romance","The chronicles of four years in the life of Julie, a young woman who navigates the troubled waters of her love life and struggles to find her career path, leading her to take a realistic look at who she really is.","41,113",Director:Joachim Trier
Dog,I 2022,101,6.5,61,"Comedy,Drama",Two former Army Rangers are paired against their will on the road trip of a lifetime. Briggs (Channing Tatum) and Lulu (a Belgian Malinois) race down the Pacific Coast to get to a fellow soldier's funeral on time.,"18,115","Directors:Reid Carolin, Channing Tatum"
Batwoman,2019–2022,45,3.3,0,"Action,Adventure,Crime",Batwoman seeks justice for Gotham City.,"42,741",
Heartland,II 2007– ,45,8.4,0,"Drama,Family","A multi-generational saga set in Alberta, Canada and centered on a family getting through life together in both happy and trying times.","15,746",
Killers of the Flower Moon,2022,0,0,0,"Crime,Drama,History",Members of the Osage tribe in the United States are murdered under mysterious circumstances in the 1920s sparking a major F.B.I. investigation involving J. Edgar Hoover.,0,Director:Martin Scorsese
Fight Club,1999,139,8.8,66,Drama,An insomniac office worker and a devil-may-care soap maker form an underground fight club that evolves into much more.,"2,034,843",Director:David Fincher
La casa de papel,2017–2021,70,8.2,0,"Action,Crime,Drama",An unusual group of robbers attempt to carry out the most perfect robbery in Spanish history - stealing 2.4 billion euros from the Royal Mint of Spain.,"455,326",
How It Ends,2018,113,5.0,36,"Action,Drama,Mystery","In the midst of an apocalypse, a man struggles to reach his pregnant wife, who is thousands of miles away.","52,199",Director:David M. Rosenthal
Snowpiercer,2020– ,60,6.9,0,"Action,Drama,Sci-Fi","Seven years after the world has become a frozen wasteland, the remnants of humanity inhabit a perpetually-moving train that circles the globe, where class warfare, social injustice and the politics of survival play out.","51,958",
The French Dispatch,2021,107,7.2,74,"Comedy,Drama,Romance","A love letter to journalists set in an outpost of an American newspaper in a fictional twentieth century French city that brings to life a collection of stories published in ""The French Dispatch Magazine"".","104,683",Director:Wes Anderson
