Movie,Production Year,Watchtime,Rating,Metascore,Genres,Description,Votes,Director
Ozark,2017–2022,60,8.5,0,"Crime,Drama,Thriller","A financial advisor drags his family from Chicago to the Missouri Ozarks, where he must launder money to appease a drug boss.","278,493",
Better Call Saul,2015–2022,46,8.8,0,"Crime,Drama","The trials and tribulations of criminal lawyer Jimmy McGill in the time before he established his strip-mall law office in Albuquerque, New Mexico as Saul Goodman.","405,123",
The Batman,2022,176,8.0,72,"Action,Crime,Drama","When a sadistic serial killer begins murdering key political figures in Gotham, Batman is forced to investigate the city's hidden corruption and question his family's involvement.","457,030",Director:Matt Reeves
The Northman,2022,137,7.8,82,"Action,Adventure,Drama","From visionary director Robert Eggers comes The Northman, an action-filled epic that follows a young Viking prince on his quest to avenge his father's murder.","49,312",Director:Robert Eggers
365 Days: This Day,2022,111,2.5,0,"Drama,Romance",Laura and Massimo are back and stronger than ever. But Massimo's family ties and a mysterious man bidding for Laura's heart complicate the lovers' lives.,"10,905","Directors:Barbara Bialowas, Tomasz Mandes"
365 dni,2020,114,3.3,0,"Drama,Romance","Massimo is a member of the Sicilian Mafia family and Laura is a sales director. She does not expect that on a trip to Sicily trying to save her relationship, Massimo will kidnap her and give her 365 days to fall in love with him.","80,145","Directors:Barbara Bialowas, Tomasz Mandes"
House of the Dragon,2022– ,0,0,0,"Action,Adventure,Drama",The story of the House Targaryen set 200 years before the events of Game of Thrones (2011).,0,
Under the Banner of Heaven,2022,0,7.4,0,"Crime,Drama,Mystery",A devout detective's faith is tested as he investigates a brutal murder seemingly connected to an esteemed Utah family's spiral into LDS fundamentalism and their distrust in the government.,"2,445",
The Staircase,2022,0,7.5,0,"Biography,Crime,Drama","Tells the story of Michael Peterson, a crime novelist accused of killing his wife Kathleen after she is found dead at the bottom of a staircase in their home, and the 16-year judicial battle that followed.","1,515",
Outer Range,2022– ,0,7.3,0,"Drama,Mystery,Thriller",A rancher fighting for his land and family discovers an unfathomable mystery at the edge of Wyoming's wilderness.,"11,815",
The Offer,2022,0,8.4,0,"Biography,Drama",Oscar-winning producer Albert S. Ruddy's never-before-revealed experiences of making The Godfather (1972).,"2,411",
Heartstopper,2022– ,30,8.9,0,"Drama,Romance",Teens Charlie and Nick discover their unlikely friendship might be something more as they navigate school and young love in this coming-of-age series.,"28,720",
Severance,2022– ,55,8.7,0,"Drama,Mystery,Sci-Fi","Mark leads a team of office workers whose memories have been surgically divided between their work and personal lives. When a mysterious colleague appears outside of work, it begins a journey to discover the truth about their jobs.","48,456",
The Rum Diary,2011,119,6.1,56,"Comedy,Drama",American journalist Paul Kemp takes on a freelance job in Puerto Rico for a local newspaper during the 1960s and struggles to find a balance between island culture and the expatriates who live there.,"102,972",Director:Bruce Robinson
Top Gun: Maverick,2022,131,0,0,"Action,Drama","After more than thirty years of service as one of the Navy's top aviators, Pete Mitchell is where he belongs, pushing the envelope as a courageous test pilot and dodging the advancement in rank that would ground him.",0,Director:Joseph Kosinski
Star Trek: Picard,2020– ,46,7.3,0,"Action,Adventure,Drama",Follow-up series to Star Trek: The Next Generation (1987) and Star Trek: Nemesis (2002) that centers on Jean-Luc Picard in the next chapter of his life.,"65,041",
Breaking Bad,2008–2013,49,9.5,0,"Crime,Drama,Thriller",A high school chemistry teacher diagnosed with inoperable lung cancer turns to manufacturing and selling methamphetamine in order to secure his family's future.,"1,727,549",
Anatomy of a Scandal,2022,268,7.0,0,"Drama,Thriller",A sexual consent scandal amongst British privileged elite and the women caught up in its wake.,"16,516",
Game of Thrones,2011–2019,57,9.2,0,"Action,Adventure,Drama","Nine noble families fight for control over the lands of Westeros, while an ancient enemy returns after being dormant for millennia.","1,983,703",
We Own This City,2022,357,7.6,0,"Crime,Drama",Tells the story of the rise and fall of the Baltimore Police Department's Gun Trace Task Force and the corruption surrounding it.,"2,612",
This Is Us,2016–2022,45,8.7,0,"Comedy,Drama,Romance","A heartwarming and emotional story about a unique set of triplets, their struggles and their wonderful parents.","132,883",
Death on the Nile,2022,127,6.3,52,"Crime,Drama,Mystery","While on vacation on the Nile, Hercule Poirot must investigate the murder of a young heiress.","101,688",Director:Kenneth Branagh
Shining Girls,2022– ,0,7.3,0,"Crime,Drama,Mystery","Years after a brutal attack left her in a constantly shifting reality, Kirby Mazrachi learns that a recent murder is linked to her assault. She teams with a veteran reporter to understand her ever-changing present and confront her past.","1,727",
Barry,2018– ,30,8.3,0,"Action,Comedy,Crime",A hit man from the Midwest moves to Los Angeles and gets caught up in the city's theatre arts scene.,"63,639",
Outlander,2014– ,60,8.4,0,"Drama,Fantasy,Romance",An English combat nurse from 1945 is mysteriously swept back in time to 1743.,"152,466",
Tokyo Vice,2022– ,0,8.2,0,"Crime,Drama,Thriller",A Western journalist working for a publication in Tokyo takes on one of the city's most powerful crime bosses.,"10,961",
Bridgerton,2020– ,60,7.3,0,"Drama,Romance","Wealth, lust, and betrayal set against the backdrop of Regency-era England, seen through the eyes of the powerful Bridgerton family.","122,107",
Stranger Things,2016– ,51,8.7,0,"Drama,Fantasy,Horror","When a young boy disappears, his mother, a police chief and his friends must confront terrifying supernatural forces in order to get him back.","989,276",
The Flight Attendant,2020– ,0,7.1,0,"Comedy,Drama,Mystery","A reckless flight attendant with an alcoholism problem wakes up in the wrong hotel, in the wrong bed, with a dead man - and no idea what happened. Unable to piece the night together, she begins to wonder if she could be the killer.","47,289",
Slow Horses,2022– ,0,7.8,0,"Drama,Thriller",Follows a team of British intelligence agents who serve as a dumping ground department of MI5 due to their career-ending mistakes.,"10,114",
Winning Time: The Rise of the Lakers Dynasty,2022– ,59,8.4,0,"Biography,Drama,Sport","The professional and personal lives of the 1980s Los Angeles Lakers, one of sports' most revered and dominant dynasties - a team that defined an era, both on and off the court.","10,659",
The Walking Dead,2010–2022,44,8.2,0,"Drama,Horror,Thriller",Sheriff Deputy Rick Grimes wakes up from a coma to learn the world is in ruins and must lead a group of survivors to stay alive.,"945,203",
Peaky Blinders,2013–2022,60,8.8,0,"Crime,Drama","A gangster family epic set in 1900s England, centering on a gang who sew razor blades in the peaks of their caps, and their fierce boss Tommy Shelby.","485,630",
The Godfather,1972,175,9.2,100,"Crime,Drama",The aging patriarch of an organized crime dynasty in postwar New York City transfers control of his clandestine empire to his reluctant youngest son.,"1,780,433",Director:Francis Ford Coppola
The Last Kingdom,2015–2022,60,8.5,0,"Action,Drama,History","As Alfred the Great defends his kingdom from Norse invaders, Uhtred--born a Saxon but raised by Vikings--seeks to claim his ancestral birthright.","126,510",
Ambulance,2022,136,6.1,55,"Action,Crime,Drama",Two robbers steal an ambulance after their heist goes awry.,"32,778",Director:Michael Bay
Yellowstone,2018– ,60,8.7,0,"Drama,Western",A ranching family in Montana faces off against others encroaching on their land.,"111,179",
Russian Doll,2019– ,30,7.8,0,"Comedy,Drama,Mystery",A cynical young woman in New York City keeps dying and returning to the party that's being thrown in her honor on that same evening. She tries to find a way out of this strange time loop.,"89,007",
Runway 34,2022,145,8.0,0,"Drama,Thriller","Inspired by true incidents, ""Runway 34"" revolves around Captain Vikrant Khanna played by Ajay Devgn, a flying prodigy, whose flight takes a mysterious course after take-off from an international destination.","15,003",Director:Ajay Devgn
Grey's Anatomy,2005– ,41,7.6,0,"Drama,Romance",A drama centered on the personal and professional lives of five surgical interns and their supervisors.,"293,590",
NCIS: Naval Criminal Investigative Service,2003– ,60,7.8,0,"Action,Crime,Drama","The cases of the Naval Criminal Investigative Service's Washington, D.C. Major Case Response Team, led by Special Agent Leroy Jethro Gibbs.","141,033",
K.G.F: Chapter 2,2022,168,8.9,0,"Action,Crime,Drama","In the blood-soaked Kolar Gold Fields, Rocky's name strikes fear into his foes. While his allies look up to him, the government sees him as a threat to law and order. Rocky must battle threats from all sides for unchallenged supremacy.","92,015",Director:Prashanth Neel
Euphoria,2019– ,55,8.4,0,Drama,"A look at life for a group of high school students as they grapple with issues of drugs, sex, and violence.","156,558",
Bosch: Legacy,2022– ,0,9.1,0,"Crime,Drama","Bosch embarks on the next chapter of his career and finds himself working with his one-time enemy, Honey Chandler.","1,786",
The Rookie,2018– ,43,8.0,0,"Crime,Drama","Starting over isn't easy, especially for John Nolan who, after a life-altering incident, is pursuing his dream of joining the LAPD. As their oldest rookie, he's met with skepticism from those who see him as just a walking midlife crisis.","34,900",
Downton Abbey: A New Era,2022,125,7.6,57,"Drama,Romance",Follow-up to the 2019 feature film in which the Crawley family and Downton staff received a royal visit from the King and Queen of Great Britain.,"2,660",Director:Simon Curtis
Dune: Part One,2021,155,8.1,74,"Action,Adventure,Drama",A noble family becomes embroiled in a war for control over the galaxy's most valuable asset while its heir becomes troubled by visions of a dark future.,"563,069",Director:Denis Villeneuve
The Blacklist,2013– ,43,8.0,0,"Crime,Drama,Mystery","A new FBI profiler, Elizabeth Keen, has her entire life uprooted when a mysterious criminal, Raymond Reddington, who has eluded capture for decades, turns himself in and insists on speaking only to her.","238,176",
Gaslit,2022,0,6.8,0,"Biography,Drama,History",A modern take on the 1970s political Watergate scandal centering on untold stories and forgotten characters of the time.,"1,115",
The Wilds,2020– ,60,7.2,0,"Adventure,Drama,Mystery",A group of teens must survive after a plane crash leaves them stranded on a deserted island. The girls tell their stories to investigators who slowly piece together what happened to them.,"16,437",
Law & Order: Special Victims Unit,1999– ,60,8.1,0,"Crime,Drama,Mystery","This series follows the Special Victims Unit, a specially trained squad of detectives in the N.Y.P.D., who investigate sexually related crimes.","100,323",
Supernatural,2005–2020,44,8.5,0,"Drama,Fantasy,Horror","Two brothers follow their father's footsteps as hunters, fighting evil supernatural beings of many kinds, including monsters, demons and gods that roam the earth.","428,618",
The Boys,2019– ,60,8.7,0,"Action,Crime,Drama",A group of vigilantes set out to take down corrupt superheroes who abuse their superpowers.,"362,639",
Top Gun,1986,110,6.9,50,"Action,Drama","As students at the United States Navy's elite fighter weapons school compete to be best in the class, one daring young pilot learns a few things from a civilian instructor that are not taught in the classroom.","329,572",Director:Tony Scott
Vikings,2013–2020,44,8.5,0,"Action,Adventure,Drama","Vikings transports us to the brutal and mysterious world of Ragnar Lothbrok, a Viking warrior and farmer who yearns to explore - and raid - the distant shores across the ocean.","508,462",
Shingeki no Kyojin,2013–2023,24,9.0,0,"Animation,Action,Adventure","After his hometown is destroyed and his mother is killed, young Eren Jaeger vows to cleanse the earth of the giant humanoid Titans that have brought humanity to the brink of extinction.","345,126",
Julia,2022– ,0,8.4,0,"Biography,Drama","Inspired by Julia Child's extraordinary life and her show The French Chef, which essentially invented food television.","4,620",
That '90s Show,,30,0,0,"Comedy,Drama,Romance","Now it's 1995, Leia Forman is visiting her grandparents for the summer where she bonds with a new generation of Point Place, WI, kids under the watchful eye of Kitty and the stern glare of Red.",0,
Grace,2021– ,90,7.2,0,"Crime,Drama,Mystery","Brighton-based Detective Superintendent Roy Grace, a hard-working police officer who has given his life to the job.","3,009",
WandaVision,2021,350,8.0,0,"Action,Comedy,Drama","Blends the style of classic sitcoms with the MCU, in which Wanda Maximoff and Vision - two super-powered beings living their ideal suburban lives - begin to suspect that everything is not as it seems.","284,770",
Criminal Minds,2005–2020,42,8.1,0,"Crime,Drama,Mystery","The cases of the F.B.I. Behavioral Analysis Unit (B.A.U.), an elite group of profilers who analyze the nation's most dangerous serial killers and individual heinous crimes in an effort to anticipate their next moves before they strike again.","189,170",
Atlanta,2016–2023,30,8.6,0,"Comedy,Drama,Music","Based in Atlanta, Earn and his cousin Alfred try to make their way in the world through the rap scene. Along the way they come face to face with social and economic issues touching on race, relationships, poverty, status, and parenthood.","65,988",
Downton Abbey,2010–2015,58,8.7,0,"Drama,Romance",A chronicle of the lives of the British aristocratic Crawley family and their servants in the early twentieth century.,"197,777",
The Sopranos,1999–2007,55,9.2,0,"Crime,Drama","New Jersey mob boss Tony Soprano deals with personal and professional issues in his home and business life that affect his mental state, leading him to seek professional psychiatric counseling.","372,328",
The Outfit,2022,105,7.1,69,"Crime,Drama,Mystery",An expert cutter must outwit a dangerous group of mobsters in order to survive a fateful night.,"17,430",Director:Graham Moore
1883,2021– ,60,8.8,0,"Drama,Western",Follows the Dutton family on a journey west through the Great Plains toward the last bastion of uncolonised America.,"50,976",
The Flash,2014– ,43,7.6,0,"Action,Adventure,Drama","After being struck by lightning, Barry Allen wakes up from his coma to discover he's been given the power of super speed, becoming the Flash, fighting crime in Central City.","336,916",
Clark,2022,0,7.5,0,"Action,Comedy,Crime","This is the incredible story behind Sweden's most notorious gangster, Clark Olofsson, whose infamous crimes gave rise to the term ""Stockholm Syndrome"".","2,134",
Ted Lasso,2020– ,30,8.8,0,"Comedy,Drama,Sport","American college football coach Ted Lasso heads to London to manage AFC Richmond, a struggling English Premier League football team.","179,080",
Being Mortal,2023,0,0,0,"Comedy,Drama","Based on the book ""Being Mortal: Medicine and What Matters in the End"" by surgeon Atul Gawande. A 2014 non-fiction book.",0,Director:Aziz Ansari
Modern Family,2009–2020,22,8.5,0,"Comedy,Drama,Romance",Three different but related families face trials and tribulations in their own uniquely comedic ways.,"409,402",
The Survivor,2021,129,6.8,71,"Biography,Drama,Sport","After World War II, Harry Haft is a boxer who fought against his peers in concentration camps. Haunted by memories, he tries to use fighting legends as a way to find his love.","1,467",Director:Barry Levinson
Succession,2018– ,60,8.8,0,Drama,"The Roy family is known for controlling the biggest media and entertainment company in the world. However, their world changes when their father steps down from the company.","126,107",
Silverton Siege,2022,100,6.1,0,"Action,Crime,Drama","Follows three young freedom fighters who seek refuge in a South African bank in Silverton, and take the bank and its customers hostage and would only release them in exchange for the release of Nelson Mandela.","2,150",Director:Mandla Dube
Doctor Who,2005– ,45,8.6,0,"Adventure,Drama,Sci-Fi",The further adventures in time and space of the alien adventurer known as the Doctor and their companions from planet Earth.,"218,156",
Billy the Kid,2022– ,0,6.8,0,"Adventure,Drama,Romance","An epic romantic adventure based on the life of Billy the Kid, from his humble Irish roots and his early days as a cowboy and gunslinger in the American frontier, to his pivotal role in the Lincoln County War and beyond.",859,
The Dropout,2022,403,7.5,0,"Biography,Drama",TV series that chronicles Theranos founder Elizabeth Holmes' attempt to revolutionize the healthcare industry after dropping out of college and starting a technology company.,"13,164",
RRR (Rise Roar Revolt),2022,187,8.4,87,"Action,Drama",A fictitious story about two legendary revolutionaries and their journey away from home before they started fighting for their country in 1920's.,"63,258",Director:S.S. Rajamouli
The Danish Girl,2015,119,7.1,66,"Biography,Drama,Romance",A fictitious love story loosely inspired by the lives of Danish artists Lili Elbe and Gerda Wegener. Lili and Gerda's marriage and work evolve as they navigate Lili's groundbreaking journey as a transgender pioneer.,"181,214",Director:Tom Hooper
CODA,2021,111,8.0,74,"Comedy,Drama,Music","As a CODA (Child of Deaf Adults) Ruby is the only hearing person in her deaf family. When the family's fishing business is threatened, Ruby finds herself torn between pursuing her passion at Berklee College of Music and her fear of abandoning her parents.","106,969",Director:Sian Heder
The Handmaid's Tale,2017– ,60,8.4,0,"Drama,Sci-Fi,Thriller","Set in a dystopian future, a woman is forced to live as a concubine under a fundamentalist theocratic dictatorship.","216,264",
The First Lady,2022– ,60,5.9,0,"Biography,Drama,History","In the East Wing of the White House, many of history's most impactful and world-changing decisions have been hidden from view, made by America's charismatic, complex and dynamic first ladies.","1,513",
Chicago Fire,2012– ,43,8.0,0,"Action,Drama","The story of firefighters and paramedics in the city of Chicago, both on a personal and professional level.","54,661",
9-1-1,2018– ,43,7.8,0,"Action,Drama,Thriller","Explores the high-pressure experiences of the first responders who are thrust into the most frightening, shocking, and heart-stopping situations.","31,588",
Inventing Anna,2022,65,6.8,0,Drama,"A journalist with a lot to prove investigates the case of Anna Delvey, the Instagram-legendary German heiress who stole the hearts of New York's social scene - and stole their money as well.","54,155",
Pálpito,2022– ,45,6.3,0,"Drama,Thriller","Simón's wife was killed to extract her heart and transplant it to Camila, the wife of a rich man. In search of revenge, he dives into the dangerous world of organ trafficking.","1,114",
The Wire,2002–2008,59,9.3,0,"Crime,Drama,Thriller","The Baltimore drug scene, as seen through the eyes of drug dealers and law enforcement.","325,124",
Fear the Walking Dead,2015– ,44,6.8,0,"Drama,Horror,Sci-Fi","A Walking Dead spinoff set in Los Angeles, California. Follows two families who must band together to survive the undead apocalypse.","126,593",
Reacher,2022– ,49,8.1,0,"Action,Crime,Drama",Jack Reacher was arrested for murder and now the police need his help. Based on the books by Lee Child.,"95,772",
Gangubai Kathiawadi,2022,152,7.0,0,"Biography,Crime,Drama",A woman becomes a powerful underworld figure.,"43,949",Director:Sanjay Leela Bhansali
Law & Order,1990– ,45,7.8,0,"Crime,Drama,Mystery","Follows a crime (usually a murder), usually adapted from current headlines, from two separate vantage points, the police investigation and the prosecution in court.","37,281",
Killing Eve,2018–2022,42,8.2,0,"Action,Adventure,Drama","After a series of events, the lives of a security operative and an assassin become inextricably linked.","113,001",
9-1-1: Lone Star,2020– ,43,6.9,0,"Action,Drama,Thriller","A New York firefighter relocates to Austin, Texas with his son, where he works to save people's lives while trying to solve his own personal problems.","13,260",
Undone,2019– ,23,8.2,0,"Animation,Drama,Fantasy",A woman discovers she has a new relationship with time after surviving a car accident that almost killed her.,"18,397",
Mystery Incorporated,2022– ,0,7.4,0,"Crime,Drama,Mystery","Following the mysterious circumstances of his parents' deaths, Fred Jones teams up with three of his classmates (and a dog) to seek the truth behind it. Along the way, they must encounter ghosts, vampires, and the occult.",282,
Mayans M.C.,2018– ,60,7.5,0,"Crime,Drama,Thriller","Set in a post-Jax Teller world, ""Mayans MC"" sees EZ Reyes, a former golden boy now fresh out of prison, as a prospect in the Mayan MC charter on the California-Mexico border who must carve out his new outlaw identity.","16,783",
Westworld,2016– ,62,8.6,0,"Drama,Mystery,Sci-Fi","At the intersection of the near future and the reimagined past, waits a world in which every human appetite can be indulged without consequence.","474,773",
Black Mirror,2011–2019,60,8.8,0,"Drama,Mystery,Sci-Fi","An anthology series exploring a twisted, high-tech multiverse where humanity's greatest innovations and darkest instincts collide.","515,634",
Suits,2011–2019,44,8.5,0,"Comedy,Drama","On the run from a drug deal gone bad, brilliant college dropout Mike Ross finds himself working with Harvey Specter, one of New York City's best lawyers.","395,634",
The Good Doctor,2017– ,41,8.1,0,Drama,"Shaun Murphy, a young surgeon with autism and Savant syndrome, is recruited into the surgical unit of a prestigious hospital.","88,506",
DI Ray,2022– ,0,6.2,0,"Crime,Drama,Mystery",Newly promoted DI Rachita Ray takes on a case that forces her to face a lifelong personal conflict.,502,
Nightmare Alley,2021,150,7.1,70,"Crime,Drama,Thriller",A grifter working his way up from low-ranking carnival worker to lauded psychic medium matches wits with a psychiatrist bent on exposing him.,"119,835",Director:Guillermo del Toro
Sex Education,2019– ,45,8.4,0,"Comedy,Drama",A teenage boy with a sex therapist mother teams up with a high school classmate to set up an underground sex therapy clinic at school.,"259,337",
The Girl from Plainville,2022,0,6.4,0,"Biography,Crime,Drama","Inspired by the true story of Michelle Carter's unprecedented ""texting-suicide"" case. Explores Carter's relationship with Conrad Roy III and the events that led to his death and, later, her conviction of involuntary manslaughter.","3,071",
Pachinko,2022– ,55,8.5,0,Drama,"Based on the New York Times bestseller, this sweeping saga chronicles the hopes and dreams of a Korean immigrant family across four generations as they leave their homeland in an indomitable quest to survive and thrive.","4,855",
One Piece: Wan pîsu,1999– ,24,8.8,0,"Animation,Action,Adventure","Follows the adventures of Monkey D. Luffy and his pirate crew in order to find the greatest treasure ever left by the legendary Pirate, Gold Roger. The famous mystery treasure named ""One Piece"".","112,564",
Firestarter,2022,94,0,0,"Drama,Horror,Sci-Fi",A young girl tries to understand how she mysteriously gained the power to set things on fire with her mind.,0,Director:Keith Thomas
Superman & Lois,2021– ,42,7.8,0,"Action,Adventure,Drama","The world's most famous superhero and comic books' most famous journalist face the pressures and complexities that come with balancing work, justice and parenthood in today's society.","29,099",
Avengers: Endgame,2019,181,8.4,78,"Action,Adventure,Drama","After the devastating events of Avengers: Infinity War (2018), the universe is in ruins. With the help of remaining allies, the Avengers assemble once more in order to reverse Thanos' actions and restore balance to the universe.","1,049,674","Directors:Anthony Russo, Joe Russo"
The Endgame,2022– ,43,6.6,0,"Crime,Drama","A sexy and twisted heist show on how far some people will go for love, justice and the most valuable commodity in the world: truth.","4,364",
Spy x Family,2022– ,25,9.0,0,"Animation,Action,Comedy","A spy on an undercover mission gets married and adopts a child as part of his cover. His wife and daughter have secrets of their own, and all three must strive to keep together.","5,965",
Licorice Pizza,2021,133,7.3,90,"Comedy,Drama,Romance","The story of Alana Kane and Gary Valentine growing up, running around and going through the treacherous navigation of first love in the San Fernando Valley, 1973.","80,042",Director:Paul Thomas Anderson
Deep Water,2022,115,5.4,53,"Drama,Mystery,Thriller",A well-to-do husband who allows his wife to have affairs in order to avoid a divorce becomes a prime suspect in the disappearance of her lovers.,"34,511",Director:Adrian Lyne
Made for Love,2021– ,30,6.8,0,"Comedy,Drama,Sci-Fi","A young woman, on the run after 10 years in a suffocating marriage to a tech billionaire, suddenly realizes that her husband has implanted a revolutionary monitoring device in her brain that allows him to track her every move.","8,909",
