Movie,Production Year,Watchtime,Rating,Metascore,Genres,Description,Votes,Director
Along for the Ride,2022,106,6.0,55,"Drama,Romance","The summer before college Auden meets the mysterious Eli, a fellow insomniac. While the seaside town of Colby sleeps, the two embark on a nightly quest to help Auden experience the fun, carefree teen life she never knew she wanted.","1,503",Director:Sofia Alvarez
SEAL Team,2017– ,43,7.7,0,"Action,Drama,War","The lives of the elite Navy SEALs as they train, plan and execute the most dangerous, high-stakes missions the United States of America can ask.","23,742",
Roar,2022– ,0,5.3,0,"Comedy,Drama","An insightful, poignant, and sometimes hilarious portrait of what it means to be a woman today. Featuring a unique blend of magical realism, familiar domestic and professional scenarios, and futuristic worlds.","1,615",
The Righteous Gemstones,2019– ,36,8.1,0,"Comedy,Drama","Follows a world-famous televangelist family with a long tradition of deviance, greed, and charitable work.","30,207",
Dark,2017–2020,60,8.7,0,"Crime,Drama,Mystery","A family saga with a supernatural twist, set in a German town where the disappearance of two young children exposes the relationships among four families.","354,496",
Orange Is the New Black,2013–2019,59,8.1,0,"Comedy,Crime,Drama","Convicted of a decade old crime of transporting drug money to an ex-girlfriend, normally law-abiding Piper Chapman is sentenced to a year and a half behind bars to face the reality of how life-changing prison can really be.","295,609",
How I Met Your Father,2022– ,24,5.3,0,"Comedy,Drama","Sophie and her close-knit group of friends are in the midst of figuring out who they are, what they want out of life, and how to fall in love in the age of dating apps and limitless options.","11,861",
Gotham,2014–2019,42,7.8,0,"Action,Crime,Drama",The story behind Detective James Gordon's rise to prominence in Gotham City in the years before Batman's arrival.,"226,092",
Agents of S.H.I.E.L.D.,2013–2020,45,7.5,0,"Action,Adventure,Drama","The missions of the Strategic Homeland Intervention, Enforcement and Logistics Division.","213,663",
Buffy the Vampire Slayer,1997–2003,44,8.3,0,"Action,Drama,Fantasy","A young woman, destined to slay vampires, demons and other infernal creatures, deals with her life fighting evil, with the help of her friends.","142,880",
Pam & Tommy,2022,340,7.3,0,"Biography,Drama,Romance","Follows the story of Pamela Anderson and Tommy Lee's relationship, going back to their whirlwind romance that started with them marrying after only knowing each other for 96 hours in 1995.","26,791",
Pulp Fiction,1994,154,8.9,94,"Crime,Drama","The lives of two mob hitmen, a boxer, a gangster and his wife, and a pair of diner bandits intertwine in four tales of violence and redemption.","1,982,617",Director:Quentin Tarantino
21 Jump Street,1987–1991,60,7.2,0,"Crime,Drama,Mystery",The cases of an undercover police unit composed of young-looking officers specializing in youth crime.,"12,314",
A League of Their Own,1992,128,7.3,69,"Comedy,Drama,Sport",Two sisters join the first female professional baseball league and struggle to help it succeed amidst their own growing rivalry.,"104,279",Director:Penny Marshall
FBI,2018– ,60,6.9,0,"Action,Crime,Drama",Procedural drama about the inner workings of the New York office of the Federal Bureau of Investigation.,"16,247",
Downton Abbey,2019,122,7.4,64,"Drama,Romance","The continuing story of the Crawley family, wealthy owners of a large estate in the English countryside in the early twentieth century.","52,484",Director:Michael Engler
The Last Duel,2021,152,7.4,67,"Action,Drama,History",King Charles VI declares that Knight Jean de Carrouges settle his dispute with his squire by challenging him to a duel.,"138,594",Director:Ridley Scott
Belfast,2021,98,7.3,75,"Biography,Drama",A young boy and his working-class Belfast family experience the tumultuous late 1960s.,"57,759",Director:Kenneth Branagh
The Batman: Deleted Arkham Scene,2022 Video,5,8.3,0,"Short,Crime,Drama","In a deleted scene from The Batman (2022), Batman consults an old acquaintance and Arkham inmate about The Riddler's crime spree.","9,735",Director:Matt Reeves
The Wheel of Time,2021– ,60,7.1,0,"Action,Adventure,Drama","Set in a high fantasy world where magic exists, but only some can access it, a woman named Moiraine crosses paths with five young men and women. This sparks a dangerous, world-spanning journey. Based on the book series by Robert Jordan.","94,332",
Hacks,2021– ,30,8.2,0,"Comedy,Drama","Explores a dark mentorship that forms between Deborah Vance, a legendary Las Vegas comedian, and an entitled, outcast 25-year-old.","19,912",
Loin du périph,2022,119,5.7,43,"Action,Comedy,Crime","Diakité and Monge as police officers who are the complete opposite, and get paired together to uncover an unexpectedly big criminal case.","1,850",Director:Louis Leterrier
Taboo,2017– ,59,8.4,0,"Drama,Mystery,Thriller","Adventurer James Keziah Delaney returns to London during the War of 1812 to rebuild his late father's shipping empire. However, both the government and his biggest competitor want his inheritance at any cost--even murder.","133,251",
Liar,2017–2020,45,7.1,0,"Crime,Drama,Thriller",British psychological thriller in which schoolteacher Laura Nielson accuses renowned surgeon Andrew Earlham of rape.,"9,185",
Jack Ryan,2018– ,60,8.0,0,"Action,Drama,Thriller",Up-and-coming CIA analyst Jack Ryan is thrust into a dangerous field assignment as he uncovers a pattern in terrorist communication that launches him into the center of a dangerous gambit.,"111,069",
You,2018– ,45,7.7,0,"Crime,Drama,Romance","A dangerously charming, intensely obsessive young man goes to extreme measures to insert himself into the lives of those he is transfixed by.","225,969",
Knives Out,2019,130,7.9,82,"Comedy,Crime,Drama","A detective investigates the death of the patriarch of an eccentric, combative family.","589,364",Director:Rian Johnson
Star Trek: Deep Space Nine,1993–1999,45,8.1,0,"Action,Adventure,Drama","In the vicinity of the liberated planet of Bajor, the Federation space station Deep Space Nine guards the opening of a stable wormhole to the far side of the galaxy.","61,137",
Crimes of the Future,2022,107,0,0,"Drama,Horror,Sci-Fi","A deep dive into the not-so-distant future in which humankind is learning to adapt to its synthetic surroundings. This evolution moves humans beyond their natural state and into a metamorphosis, which alters their biological makeup.",0,Director:David Cronenberg
The Stand,2020–2021,510,5.5,0,"Adventure,Drama,Fantasy","After the world is in ruins, due to a man-made plague, a battle of Biblical proportions ensues between the survivors.","24,673",
Heat,1995,170,8.3,76,"Action,Crime,Drama",A group of high-end professional thieves start to feel the heat from the LAPD when they unknowingly leave a clue at their latest heist.,"633,651",Director:Michael Mann
The 100,2014–2020,43,7.6,0,"Drama,Mystery,Sci-Fi","Set ninety-seven years after a nuclear war has destroyed civilization, when a spaceship housing humanity's lone survivors sends one hundred juvenile delinquents back to Earth, in hopes of possibly re-populating the planet.","242,236",
Mr. Robot,2015–2019,49,8.6,0,"Crime,Drama,Thriller","Elliot, a brilliant but highly unstable young cyber-security engineer and vigilante hacker, becomes a key figure in a complex game of global dominance when he and his shadowy allies try to take down the corrupt corporation he works for.","373,870",
Blow,2001,124,7.5,52,"Biography,Crime,Drama","The story of how George Jung, along with the Medellín Cartel headed by Pablo Escobar, established the American cocaine market in the 1970s in the United States.","255,567",Director:Ted Demme
Scrubs,2001–2010,22,8.4,0,"Comedy,Drama","In the unreal world of Sacred Heart Hospital, intern John ""J.D."" Dorian learns the ways of medicine, friendship and life.","251,165",
1917,2019,119,8.2,78,"Action,Drama,War","April 6th, 1917. As an infantry battalion assembles to wage war deep in enemy territory, two soldiers are assigned to race against time and deliver a message that will stop 1,600 men from walking straight into a deadly trap.","549,260",Director:Sam Mendes
The Morning Show,I 2019– ,60,8.3,0,Drama,"An inside look at the lives of the people who help America wake up in the morning, exploring the unique challenges faced by the men and women who carry out this daily televised ritual.","94,822",
Schindler's List,1993,195,9.0,94,"Biography,Drama,History","In German-occupied Poland during World War II, industrialist Oskar Schindler gradually becomes concerned for his Jewish workforce after witnessing their persecution by the Nazis.","1,315,733",Director:Steven Spielberg
Gisaengchung,2019,132,8.5,96,"Comedy,Drama,Thriller",Greed and class discrimination threaten the newly formed symbiotic relationship between the wealthy Park family and the destitute Kim clan.,"742,170",Director:Bong Joon Ho
Bull,2016–2022,60,7.0,0,"Comedy,Crime,Drama","Brilliant, brash, and charming, Dr. Bull is the ultimate puppet master as he combines psychology, human intuition, and high-tech data to learn what makes jurors, attorneys, witnesses, and the accused tick.","19,036",
True Blood,2008–2014,55,7.9,0,"Drama,Fantasy,Mystery","Telepathic waitress Sookie Stackhouse encounters a strange new supernatural world when she meets the mysterious Bill Compton, a southern Louisiana gentleman and vampire.","241,460",
Prisoners,2013,153,8.1,70,"Crime,Drama,Mystery","When Keller Dover's daughter and her friend go missing, he takes matters into his own hands as the police pursue multiple leads and the pressure mounts.","679,612",Director:Denis Villeneuve
Old,2021,108,5.8,55,"Drama,Horror,Mystery","A vacationing family discovers that the secluded beach where they're relaxing for a few hours is somehow causing them to age rapidly, reducing their entire lives into a single day.","95,705",Director:M. Night Shyamalan
The Split,2018–2022,60,7.7,0,Drama,"The Defoes, a family of female divorce lawyers, are forced to face their past following the return of their estranged father after a 30 year absence.","6,268",
Mindhunter,2017–2019,60,8.6,0,"Crime,Drama,Mystery","Set in the late 1970s, two FBI agents are tasked with interviewing serial killers to solve open cases.","268,781",
Band of Brothers,2001– ,594,9.4,0,"Drama,History,War","The story of Easy Company of the U.S. Army 101st Airborne Division and their mission in World War II Europe, from Operation Overlord to V-J Day.","440,672",
Emergency,2022,105,7.3,71,"Comedy,Drama","Ready for a night of legendary partying, three college students must weigh the pros and cons of calling the police when faced with an unexpected situation.",256,Director:Carey Williams
A Very British Scandal,2021,177,7.0,0,"Drama,History",The story of events surrounding the notorious divorce of the Duke and Duchess of Argyll during the 1960s.,"4,475",
"Murder, She Wrote",1984–1996,50,7.1,0,"Crime,Drama,Mystery","Professional writer and amateur sleuth Jessica Fletcher uses her intellect, charm, and persistence to get to the bottom of every crime she encounters.","23,435",
The Lord of the Rings: The Fellowship of the Ring,2001,178,8.8,92,"Action,Adventure,Drama",A meek Hobbit from the Shire and eight companions set out on a journey to destroy the powerful One Ring and save Middle-earth from the Dark Lord Sauron.,"1,797,915",Director:Peter Jackson
Dopesick,2021,492,8.6,0,Drama,"The series takes viewers to the epicenter of America's struggle with opioid addiction, from the boardrooms of Purdue Pharma, to a distressed Virginia mining community, to the hallways of the DEA.","45,905",
Arrow,2012–2020,42,7.5,0,"Action,Adventure,Crime","Spoiled billionaire playboy Oliver Queen is missing and presumed dead when his yacht is lost at sea. He returns five years later a changed man, determined to clean up the city as a hooded vigilante armed with a bow.","425,730",
Black Mass,2015,123,6.9,68,"Biography,Crime,Drama","The true story of Whitey Bulger, the brother of a state senator and the most infamous violent criminal in the history of South Boston, who became an FBI informant to take down a Mafia family invading his turf.","178,584",Director:Scott Cooper
Batman Begins,2005,140,8.2,70,"Action,Crime,Drama","After training with his mentor, Batman begins his fight to free crime-ridden Gotham City from corruption.","1,426,547",Director:Christopher Nolan
Last Night in Soho,2021,116,7.1,65,"Drama,Horror,Mystery",An aspiring fashion designer is mysteriously able to enter the 1960s where she encounters a dazzling wannabe singer. But the glamour is not all it appears to be and the dreams of the past start to crack and splinter into something darker.,"102,569",Director:Edgar Wright
Stargate SG-1,1997–2007,44,8.4,0,"Action,Adventure,Drama","A secret military team, SG-1, is formed to explore other planets through the recently discovered Stargates.","91,277",
The Fall of the House of Usher,,0,0,0,"Drama,Horror","An unnamed narrator approaches the house of Usher on a ""dull, dark, and soundless day."" This house the estate of his boyhood friend, Roderick Usher is gloomy and mysterious.",0,
CSI: Crime Scene Investigation,2000–2015,60,7.7,0,"Crime,Drama,Mystery",Series following an elite team of police forensic evidence investigation experts as they work their cases in Las Vegas.,"82,888",
Saving Private Ryan,1998,169,8.6,91,"Drama,War","Following the Normandy Landings, a group of U.S. soldiers go behind enemy lines to retrieve a paratrooper whose brothers have been killed in action.","1,345,956",Director:Steven Spielberg
Inglourious Basterds,2009,153,8.3,69,"Adventure,Drama,War","In Nazi-occupied France during World War II, a plan to assassinate Nazi leaders by a group of Jewish U.S. soldiers coincides with a theatre owner's vengeful plans for the same.","1,393,659",Director:Quentin Tarantino
Taxi Driver,1976,114,8.3,94,"Crime,Drama","A mentally unstable veteran works as a nighttime taxi driver in New York City, where the perceived decadence and sleaze fuels his urge for violent action.","796,384",Director:Martin Scorsese
That Dirty Black Bag,2022– ,50,7.1,0,"Drama,Western","Two men face off in a savage, deserted world.","1,419",
Fringe,2008–2013,46,8.5,0,"Drama,Mystery,Sci-Fi",An F.B.I. agent is forced to work with an institutionalized scientist and his son in order to rationalize a brewing storm of unexplained phenomena.,"236,570",
Titans,I 2018– ,45,7.6,0,"Action,Adventure,Crime",A team of young superheroes combat evil and other perils.,"95,600",
Se7en,1995,127,8.6,65,"Crime,Drama,Mystery","Two detectives, a rookie and a veteran, hunt a serial killer who uses the seven deadly sins as his motives.","1,585,943",Director:David Fincher
The Dark Knight Rises,2012,164,8.4,78,"Action,Crime,Drama","Eight years after the Joker's reign of anarchy, Batman, with the help of the enigmatic Catwoman, is forced from his exile to save Gotham City from the brutal guerrilla terrorist Bane.","1,651,943",Director:Christopher Nolan
The Sinner,2017–2021,45,7.9,0,"Crime,Drama,Mystery",Anthology series that examines how and why ordinary people commit brutal crimes.,"117,060",
Soupçons,2004–2018,629,7.9,0,"Documentary,Crime,Drama",The high-profile murder trial of American novelist Michael Peterson following the death of his wife in 2001.,"22,318",
A Quiet Place Part II,2020,97,7.2,71,"Drama,Horror,Sci-Fi","Following the events at home, the Abbott family now face the terrors of the outside world. Forced to venture into the unknown, they realize the creatures that hunt by sound are not the only threats lurking beyond the sand path.","207,484",Director:John Krasinski
Amsterdam,2022,0,0,0,"Drama,History","Set in the '30s, it follows three friends who witness a murder, become suspects themselves, and uncover one of the most outrageous plots in American history.",0,Director:David O. Russell
Hawaii Five-0,2010–2020,42,7.4,0,"Action,Crime,Drama","When Steve McGarrett returns home to Oahu to find his father's killer, the Governor offers him the chance to run his own task force: Five-0.","72,332",
Smallville,2001–2011,60,7.5,0,"Action,Adventure,Drama","A young Clark Kent struggles to find his place in the world as he learns to harness his alien powers for good and deals with the typical troubles of teenage life in Smallville, Kansas.","125,024",
Justified,2010–2015,44,8.6,0,"Action,Crime,Drama","U.S. Marshal Raylan Givens is reassigned from Miami to his childhood home in the poor, rural coal mining towns of eastern Kentucky.","97,429",
The Orville,2017– ,44,8.0,0,"Adventure,Comedy,Drama",An exploratory ship from Earth faces intergalactic challenges 400 years in the future.,"69,082",
Gone Girl,2014,149,8.1,79,"Drama,Mystery,Thriller","With his wife's disappearance having become the focus of an intense media circus, a man sees the spotlight turned on him when it's suspected that he may not be innocent.","950,898",Director:David Fincher
Ex Machina,2014,108,7.7,78,"Drama,Sci-Fi,Thriller",A young programmer is selected to participate in a ground-breaking experiment in synthetic intelligence by evaluating the human qualities of a highly advanced humanoid A.I.,"526,643",Director:Alex Garland
The Green Knight,2021,130,6.6,85,"Adventure,Drama,Fantasy",A fantasy retelling of the medieval story of Sir Gawain and the Green Knight.,"90,955",Director:David Lowery
The Summer I Turned Pretty,2022– ,0,0,0,"Drama,Romance","A love triangle between one girl and two brothers. A story about first love, first heartbreak, and the magic of that one perfect summer.",0,
Poirot,1989–2013,100,8.6,0,"Crime,Drama,Mystery","The cases of eccentric, but sharp, Belgian detective Hercule Poirot.","43,997",
King Richard,2021,144,7.5,76,"Biography,Drama,Sport",A look at how tennis superstars Venus and Serena Williams became who they are after the coaching from their father Richard Williams.,"91,039",Director:Reinaldo Marcus Green
Tombstone,1993,130,7.8,50,"Biography,Drama,History","A successful lawman's plans to retire anonymously in Tombstone, Arizona are disrupted by the kind of outlaws he was famous for eliminating.","144,091","Directors:George P. Cosmatos, Kevin Jarre"
Yakamoz S-245,2022– ,45,6.1,0,"Action,Adventure,Drama","After disaster strikes Earth, a marine biologist on a submarine research mission must fight to survive with the crew as a conspiracy comes to light.","4,444",
Line of Duty,2012–2021,60,8.7,0,"Crime,Drama,Mystery","Drama series following the investigations of AC-12, a controversial police anti-corruption unit.","55,786",
The Owl House,2020– ,22,8.1,0,"Animation,Action,Adventure","Accidentally sent to the world of the Boiling Isles before a trip to summer camp, a teenage human named Luz longs to become a witch, with the rebellious Eda and pint-sized demon King at her aid.","9,029",
Perry Mason,1957–1966,60,8.3,0,"Crime,Drama,Mystery","The cases of a master criminal defense attorney, handling the most difficult of cases in the aid of the innocent.","8,853",
Black Sails,2014–2017,56,8.2,0,"Action,Adventure,Drama","Follows Captain Flint and his pirates twenty years prior to Robert Louis Stevenson's classic novel ""Treasure Island.""","102,062",
Homeland,2011–2020,55,8.3,0,"Crime,Drama,Mystery",A bipolar CIA operative becomes convinced a prisoner of war has been turned by al-Qaeda and is planning to carry out a terrorist attack on American soil.,"335,023",
BoJack Horseman,2014–2020,25,8.8,0,"Animation,Comedy,Drama","BoJack Horseman was the star of the hit television show ""Horsin' Around"" in the '80s and '90s, but now he's washed up, living in Hollywood, complaining about everything, and wearing colorful sweaters.","143,603",
Only Murders in the Building,2021– ,30,8.1,0,"Comedy,Crime,Drama",Three strangers who share an obsession with true crime suddenly find themselves caught up in one.,"66,696",
"Love, Death & Robots",2019– ,15,8.4,0,"Animation,Short,Action","A collection of animated short stories that span various genres including science fiction, fantasy, horror and comedy.","135,461",
Pleasure,2021,109,6.3,74,Drama,"Bella Cherry arrives in Los Angeles with dreams of becoming an adult film star, but she soon learns that fame won't come easy as she harnesses her ambition and cunning to rise to the top of this mesmerizing and singular world.","8,724",Director:Ninja Thyberg
The Equalizer,2021– ,43,5.0,0,"Action,Crime,Drama",An enigmatic figure who uses her extensive skills to help those with nowhere else to turn.,"11,752",
"The Thief, His Wife and the Canoe",2022– ,0,7.2,0,"Crime,Drama",Four-part drama based on the extraordinary story of how prison officer John Darwin faked his own death to claim life insurance and avoid bankruptcy - unbeknownst to his two sons.,"1,687",
Station 19,2018– ,60,6.7,0,"Action,Drama,Romance","This spinoff of the critically acclaimed show Grey's Anatomy follows the lives of the men and women of firehouse station 19 in Seattle, Washington.","13,878",
Minamata,2020,115,7.3,55,Drama,War photographer W. Eugene Smith travels back to Japan where he documents the devastating effect of mercury poisoning in coastal communities.,"17,571",Director:Andrew Levitas
Normal People,2020,339,8.4,0,"Drama,Romance","Follows Marianne and Connell, from different backgrounds but the same small town in Ireland, as they weave in and out of each other's romantic lives.","59,039",
Gladiator,2000,155,8.5,67,"Action,Adventure,Drama",A former Roman General sets out to exact vengeance against the corrupt emperor who murdered his family and sent him into slavery.,"1,453,228",Director:Ridley Scott
Prison Break,2005–2017,44,8.3,0,"Action,Crime,Drama","Due to a political conspiracy, an innocent man is sent to death row and his only hope is his brother, who makes it his mission to deliberately get himself sent to the same prison in order to break the both of them out, from the inside.","517,275",
The Green Mile,1999,189,8.6,61,"Crime,Drama,Fantasy","The lives of guards on Death Row are affected by one of their charges: a black man accused of child murder and rape, yet who has a mysterious gift.","1,256,854",Director:Frank Darabont
Dunkirk,2017,106,7.8,94,"Action,Drama,History","Allied soldiers from Belgium, the British Commonwealth and Empire, and France are surrounded by the German Army and evacuated during a fierce battle in World War II.","631,981",Director:Christopher Nolan
Manifest,2018– ,43,7.1,0,"Drama,Mystery,Sci-Fi","A commercial airliner suddenly reappears after being missing for five years. As those aboard reintegrate into society, they experience guiding voices and visions of events yet to occur, and soon a deeper mystery unfolds.","50,151",
The Departed,2006,151,8.5,85,"Crime,Drama,Thriller",An undercover cop and a mole in the police attempt to identify each other while infiltrating an Irish gang in South Boston.,"1,285,261",Director:Martin Scorsese
Snowfall,2017– ,44,8.2,0,"Crime,Drama",A look at the early days of the crack cocaine epidemic in Los Angeles during the beginning of the 1980s.,"17,011",
Little Women,2019,135,7.8,91,"Drama,Romance","Jo March reflects back and forth on her life, telling the beloved story of the March sisters - four young women, each determined to live life on her own terms.","191,229",Director:Greta Gerwig
Walker,2021– ,42,5.9,0,"Action,Crime,Drama","A widowed father returns to Austin after one year, attempting to reconnect with his children, navigate clashes with his family, and find common ground with his new partner, while growing increasingly suspicious of his wife's death.","10,467",
The Waltons,1972–1981,60,7.6,0,"Drama,Family,Romance",The life and trials of a 1930s and 1940s Virginia mountain family through financial depression and World War II.,"7,391",
Léon,1994,110,8.5,64,"Action,Crime,Drama","12-year-old Mathilda is reluctantly taken in by Léon, a professional assassin, after her family is murdered. An unusual relationship forms as she becomes his protégée and learns the assassin's trade.","1,126,102",Director:Luc Besson
The Missing,2014–2016,60,8.2,0,"Crime,Drama,Mystery",Tony and Emily Hughes' vacation turns into a nightmare when their 5-year-old son Oliver disappears from a large celebrating crowd in Northern France.,"25,958",
Signora Volpe,2022– ,0,6.8,0,Drama,"Sylvia, a disillusioned British spy turned detective starts a new life in the beautiful heart of Italy. She soon finds out trouble follows her wherever she goes.",236,
Narcos,2015–2017,49,8.8,0,"Biography,Crime,Drama","A chronicled look at the criminal exploits of Colombian drug lord Pablo Escobar, as well as the many other drug kingpins who plagued the country through the years.","404,526",
Hacksaw Ridge,2016,139,8.1,71,"Biography,Drama,History","World War II American Army Medic Desmond T. Doss, who served during the Battle of Okinawa, refuses to kill people and becomes the first man in American history to receive the Medal of Honor without firing a shot.","501,509",Director:Mel Gibson
Call Me by Your Name,2017,132,7.8,93,"Drama,Romance","In 1980s Italy, romance blossoms between a seventeen-year-old student and the older man hired as his father's research assistant.","257,773",Director:Luca Guadagnino
Midnight Mass,2021,450,7.7,0,"Drama,Fantasy,Horror","An isolated island community experiences miraculous events - and frightening omens - after the arrival of a charismatic, mysterious young priest.","102,287",
Where the Crawdads Sing,2022,0,0,0,"Drama,Mystery",A woman who raised herself in the marshes of the deep South becomes a suspect in the murder of a man she was once involved with.,0,Director:Olivia Newman
