Movie,Production Year,Watchtime,Rating,Metascore,Genres,Description,Votes,Director
Ojing-eo geim,2021– ,55,8.0,0,"Action,Drama,Mystery","Hundreds of cash-strapped players accept a strange invitation to compete in children's games. Inside, a tempting prize awaits with deadly high stakes. A survival game that has a whopping 45.6 billion-won prize at stake.","416,802",
Better Things,2016–2022,22,7.8,0,"Comedy,Drama",An actress raises her three daughters while juggling the pressures of working in Hollywood and being a single parent.,"15,115",
Bohemian Rhapsody,2018,134,7.9,49,"Biography,Drama,Music","The story of the legendary British rock band Queen and lead singer Freddie Mercury, leading up to their famous performance at Live Aid (1985).","516,625",Director:Bryan Singer
Never Back Down,2008,113,6.5,39,"Action,Drama,Sport",A frustrated and conflicted teenager arrives at a new high school to discover an underground fight club and meet a classmate who begins to coerce him into fighting.,"100,689",Director:Jeff Wadlow
Hereditary,2018,127,7.3,87,"Drama,Horror,Mystery",A grieving family is haunted by tragic and disturbing occurrences.,"292,046",Director:Ari Aster
The White Lotus,2021–2022,60,7.6,0,"Comedy,Drama","Set in a tropical resort, it follows the exploits of various guests and employees over the span of a week.","57,257",
Whiplash,2014,106,8.5,88,"Drama,Music",A promising young drummer enrolls at a cut-throat music conservatory where his dreams of greatness are mentored by an instructor who will stop at nothing to realize a student's potential.,"808,035",Director:Damien Chazelle
No Country for Old Men,2007,122,8.2,92,"Crime,Drama,Thriller",Violence and mayhem ensue after a hunter stumbles upon a drug deal gone wrong and more than two million dollars in cash near the Rio Grande.,"941,097","Directors:Ethan Coen, Joel Coen"
The Great,2020– ,45,8.2,0,"Biography,Comedy,Drama","A royal woman living in rural Russia during the 18th century is forced to choose between her own personal happiness and the future of Russia, when she marries an Emperor.","38,974",
Teen Wolf,2011–2017,41,7.7,0,"Action,Drama,Fantasy",An average high school student and his best friend get caught up in some trouble causing him to receive a werewolf bite. As a result they find themselves in the middle of all sorts of dramas in Beacon Hills.,"142,731",
Lolita,1997,137,6.8,46,"Drama,Romance","An English professor falls for a minor, and has to face the consequences of his actions.","57,805",Director:Adrian Lyne
Django Unchained,2012,165,8.4,81,"Drama,Western","With the help of a German bounty-hunter, a freed slave sets out to rescue his wife from a brutal plantation-owner in Mississippi.","1,494,421",Director:Quentin Tarantino
The Devil All the Time,2020,138,7.1,55,"Crime,Drama,Thriller",Sinister characters converge around a young man devoted to protecting those he loves in a postwar backwoods town teeming with corruption and brutality.,"127,584",Director:Antonio Campos
Black Panther: Wakanda Forever,2022,0,0,0,"Action,Adventure,Drama",A sequel that will continue to explore the world of Wakanda and all the characters introduced in the 2018 film.,0,Director:Ryan Coogler
The Good Place,2016–2020,22,8.2,0,"Comedy,Drama,Fantasy",Four people and their otherworldly frienemy struggle in the afterlife to define what it means to be good.,"148,593",
The Punisher,2017–2019,53,8.5,0,"Action,Crime,Drama","After the murder of his family, Marine veteran Frank Castle becomes the vigilante known as ""The Punisher,"" with only one goal in mind: to avenge them.","220,253",
Crazy Rich Asians,2018,120,6.9,74,"Comedy,Drama,Romance","This contemporary romantic comedy, based on a global bestseller, follows native New Yorker Rachel Chu to Singapore to meet her boyfriend's family.","166,209",Director:Jon M. Chu
M*A*S*H,1972–1983,25,8.4,0,"Comedy,Drama,War",The staff of an Army hospital in the Korean War find that laughter is the best way to deal with their situation.,"55,936",
Columbo,1971–2003,100,8.3,0,"Crime,Drama,Mystery",Los Angeles homicide detective Lieutenant Columbo uses his humble ways and ingenuous demeanor to winkle out even the most well-concealed of crimes.,"33,969",
The Silence of the Lambs,1991,118,8.6,85,"Crime,Drama,Thriller","A young F.B.I. cadet must receive the help of an incarcerated and manipulative cannibal killer to help catch another serial killer, a madman who skins his victims.","1,384,519",Director:Jonathan Demme
Pride & Prejudice,2005,129,7.8,82,"Drama,Romance","Sparks fly when spirited Elizabeth Bennet meets single, rich, and proud Mr. Darcy. But Mr. Darcy reluctantly finds himself falling in love with a woman beneath his class. Can each overcome their own pride and prejudice?","287,520",Director:Joe Wright
Murdoch Mysteries,2008– ,48,8.2,0,"Crime,Drama,Mystery","In the 1890s, William Murdoch uses radical forensic techniques for the time, including fingerprinting and trace evidence, to solve some of the city's most gruesome murders.","13,726",
Senior Year,2022,111,0,0,"Comedy,Drama","A cheerleading stunt gone wrong landed her in a 20-year coma. Now she's 37, newly awake and ready to live out her high school dream: becoming prom queen.",0,Director:Alex Hardcastle
Lolita,1962,153,7.5,79,"Crime,Drama,Romance",A middle-aged college professor becomes infatuated with a fourteen-year-old nymphet.,"99,777",Director:Stanley Kubrick
Monk,2002–2009,44,8.0,0,"Comedy,Crime,Drama","The series follows Adrian Monk, a brilliant former San Francisco detective, who now consults the police as a private consultant who battles with an obsessive-compulsive disorder.","73,379",
L'événement,2021,100,7.4,85,Drama,"An adaptation of Annie Ernaux's eponymous novel, looking back on her experience with abortion when it was still illegal in France in the 1960s.","2,680",Director:Audrey Diwan
Waiting for the Barbarians,2019,112,5.9,52,Drama,"At an isolated frontier outpost, a colonial magistrate suffers a crisis of conscience when an army colonel arrives looking to interrogate the locals about an impending uprising, using cruel tactics that horrify the magistrate.","10,912",Director:Ciro Guerra
Goodfellas,1990,145,8.7,90,"Biography,Crime,Drama","The story of Henry Hill and his life in the mob, covering his relationship with his wife Karen Hill and his mob partners Jimmy Conway and Tommy DeVito in the Italian-American crime syndicate.","1,115,023",Director:Martin Scorsese
Sex/Life,2021– ,45,5.4,0,"Comedy,Drama,Romance",A suburban mother of two takes a fantasy-charged trip down memory lane that sets her very married present on a collision course with her wild-child past.,"19,679",
After,I 2019,105,5.2,30,"Drama,Romance",A young woman falls for a guy with a dark secret and the two embark on a rocky relationship. Based on the novel by Anna Todd.,"52,188",Director:Jenny Gage
The Imitation Game,2014,114,8.0,71,"Biography,Drama,Thriller","During World War II, the English mathematical genius Alan Turing tries to crack the German Enigma code with help from fellow mathematicians while attempting to come to terms with his troubled private life.","748,702",Director:Morten Tyldum
Shadow and Bone,2021– ,60,7.6,0,"Action,Adventure,Drama",Dark forces conspire against orphan mapmaker Alina Starkov when she unleashes an extraordinary power that could change the fate of her war-torn world.,"77,790",
Requiem for a Dream,2000,102,8.3,68,Drama,The drug-induced utopias of four Coney Island people are shattered when their addictions run deep.,"820,556",Director:Darren Aronofsky
24,2001–2010,44,8.4,0,"Action,Crime,Drama",Jack Bauer races against the clock to subvert terrorist plots and save his nation from ultimate disaster.,"183,208",
Law & Order: Organized Crime,2021– ,42,7.6,0,"Crime,Drama,Mystery",Elliot Stabler returns to the NYPD to battle organized crime after a devastating personal loss.,"6,370",
Pretty Little Liars,2010–2017,44,7.4,0,"Drama,Mystery,Romance","Four friends band together against an anonymous foe who threatens to reveal their darkest secrets, while also investigating the disappearance of their best friend.","163,147",
Logan,2017,137,8.1,77,"Action,Drama,Sci-Fi","In a future where mutants are nearly extinct, an elderly and weary Logan leads a quiet life. But when Laura, a mutant child pursued by scientists, comes to him for help, he must get her to safety.","728,913",Director:James Mangold
The Originals,2013–2018,45,8.3,0,"Drama,Fantasy,Horror",A family of power-hungry thousand-year-old vampires look to take back the city that they built and dominate all those who have done them wrong.,"131,584",
The Queen's Gambit,2020,395,8.6,0,Drama,"Orphaned at the tender age of nine, prodigious introvert Beth Harmon discovers and masters the game of chess in 1960s USA. But child stardom comes at a price.","406,308",
You Won't Be Alone,2022,108,6.4,79,"Drama,Horror","In an isolated mountain village in 19th century Macedonia, a young girl is kidnapped and then transformed into a witch by an ancient spirit.","2,109",Director:Goran Stolevski
The O.C.,2003–2007,44,7.5,0,"Comedy,Drama,Romance","A troubled youth becomes embroiled in the lives of a close-knit group of people in the wealthy, upper-class neighborhood of Newport Beach, Orange County, California.","87,658",
Father Brown,2013– ,52,7.7,0,"Crime,Drama,Mystery",Series inspired by the stories of GK Chesterton; a Catholic priest has a knack for solving mysteries in his English village.,"11,188",
Twilight,I 2008,122,5.3,56,"Drama,Fantasy,Romance","When Bella Swan moves to a small town in the Pacific Northwest, she falls in love with Edward Cullen, a mysterious classmate who reveals himself to be a 108-year-old vampire.","454,143",Director:Catherine Hardwicke
Dexter: New Blood,2021–2022,529,8.2,0,"Crime,Drama,Mystery","Set 10 years after Dexter Morgan went missing in the eye of Hurricane Laura, he is now living under an assumed name in Upstate New York, Iron Lake, far from his original home in Miami.","80,371",
The Blue Lagoon,1980,104,5.8,31,"Adventure,Drama,Romance","In the Victorian period, two children are shipwrecked on a tropical island in the South Pacific. With no adults to guide them, the two make a simple life together, unaware that sexual maturity will eventually intervene.","69,047",Director:Randal Kleiser
Resident Alien,2021– ,44,8.1,0,"Comedy,Drama,Mystery",A crash-landed alien takes on the identity of a small-town Colorado doctor and slowly begins to wrestle with the moral dilemma of his secret mission on Earth.,"35,239",
Spartacus: Blood and Sand,2010–2013,55,8.5,0,"Action,Adventure,Biography","The life of Spartacus, the gladiator who lead a rebellion against the Romans. From his time as an ally of the Romans, to his betrayal and becoming a gladiator, to the rebellion he leads and its ultimate outcome.","237,148",
Inside No. 9,2014– ,30,8.5,0,"Comedy,Crime,Drama","Anthology series which mixes dark humor with genres like crime, horror or drama. The show invites viewers into some very different No.9s, where the ordinary and mundane rub shoulders with the extraordinary and macabre.","16,078",
Apocalypse Now,1979,147,8.5,94,"Drama,Mystery,War",A U.S. Army officer serving in Vietnam is tasked with assassinating a renegade Special Forces Colonel who sees himself as a god.,"650,770",Director:Francis Ford Coppola
Invincible,2021– ,50,8.7,0,"Animation,Action,Adventure",An adult animated series based on the Skybound/Image comic about a teenager whose father is the most powerful superhero on the planet.,"114,260",
Banshee,2013–2016,60,8.4,0,"Action,Crime,Drama","An ex-con assumes the identity of a murdered sheriff in the small town of Banshee, Pennsylvania, where he has some unfinished business.","98,435",
His Dark Materials,2019–2022,60,7.8,0,"Adventure,Drama,Family",A young girl is destined to liberate her world from the grip of the Magisterium which represses people's ties to magic and their animal spirits known as daemons.,"61,755",
The Greatest Showman,2017,105,7.5,48,"Biography,Drama,Musical",Celebrates the birth of show business and tells of a visionary who rose from nothing to create a spectacle that became a worldwide sensation.,"271,895",Director:Michael Gracey
Edward Scissorhands,1990,105,7.9,74,"Drama,Fantasy,Romance","An artificial man, who was incompletely constructed and has scissors for hands, leads a solitary life. Then one day, a suburban lady meets him and introduces him to her world.","477,475",Director:Tim Burton
Outer Banks,2020– ,50,7.5,0,"Action,Crime,Drama",A group of teenagers from the wrong side of the tracks stumble upon a treasure map that unearths a long buried secret.,"43,390",
Big Little Lies,2017–2019,60,8.5,0,"Crime,Drama,Mystery","The apparently perfect lives of upper-class mothers, at a prestigious elementary school, unravel to the point of murder when a single mother moves to their quaint Californian beach town.","188,966",
Boiling Point,I 2021,92,7.5,73,"Drama,Thriller",Enter the relentless pressure of a restaurant kitchen as a head chef wrangles his team on the busiest day of the year.,"16,806",Director:Philip Barantini
