Movie,Production Year,Watchtime,Rating,Metascore,Genres,Description,Votes,Director
Kung Fu Panda 3,2016,95,7.1,66,"Animation,Action,Adventure","Continuing his ""legendary adventures of awesomeness"", Po must face two hugely epic, but different threats: one supernatural and the other a little closer to home.","152,818","Directors:Alessandro Carloni, Jennifer Yuh Nelson"
Harry Potter and the Deathly Hallows: Part 1,2010,146,7.7,65,"Adventure,Family,Fantasy","As Harry, Ron, and Hermione race against time and evil to destroy the Horcruxes, they uncover the existence of the three most powerful objects in the wizarding world: the Deathly Hallows.","531,066",Director:David Yates
Toy Story,1995,81,8.3,95,"Animation,Adventure,Comedy",A cowboy doll is profoundly threatened and jealous when a new spaceman figure supplants him as top toy in a boy's room.,"963,098",Director:John Lasseter
Batman Unburied,2021 Podcast Series,0,8.5,0,"Short,Adventure,Crime","A psychological thriller which takes listeners on a ""new journey deep into the mind of Bruce Wayne."" Listeners are introduced to a Batman who is a forensic pathologist in his civilian life,...                See full summary »",78,
Lamb,2021,106,6.4,68,"Drama,Fantasy,Horror",A childless couple discovers a mysterious newborn on their farm in Iceland.,"22,154",Director:Valdimar Jóhannsson
Samurai Rabbit: The Usagi Chronicles,2022– ,25,6.5,0,"Animation,Action,Adventure","Teenage Rabbit Samurai Yuichi, a descendant of the great warrior Miyamoto Usagi, embarks on an epic quest to become a true samurai.",193,
Kimi no na wa.,2016,106,8.4,79,"Animation,Drama,Fantasy","Two strangers find themselves linked in a bizarre way. When a connection forms, will distance be the only thing to keep them apart?","250,033",Director:Makoto Shinkai
Night Sky,2022– ,0,0,0,"Adventure,Drama,Fantasy","Follows Franklin and Irene York, a couple who years ago discovered a chamber buried in their backyard which inexplicably leads to a strange, deserted planet.",0,
The Curious Case of Benjamin Button,2008,166,7.8,70,"Drama,Fantasy,Romance","Tells the story of Benjamin Button, a man who starts aging backwards with consequences.","634,950",Director:David Fincher
The Age of Adaline,2015,112,7.2,51,"Drama,Fantasy,Romance","A young woman, born at the turn of the 20th century, is rendered ageless after an accident. After many solitary years, she meets a man who complicates the eternal life she has settled into.","172,097",Director:Lee Toland Krieger
Hauru no ugoku shiro,2004,119,8.2,80,"Animation,Adventure,Family","When an unconfident young woman is cursed with an old body by a spiteful witch, her only chance of breaking the spell lies with a self-indulgent yet insecure young wizard and his companions in his legged, walking castle.","379,024",Director:Hayao Miyazaki
Sucker Punch,2011,110,6.0,33,"Action,Adventure,Fantasy",A young girl institutionalized by her abusive stepfather retreats to an alternative reality as a coping strategy and envisions a plan to help her escape.,"241,099",Director:Zack Snyder
Pan's Labyrinth,2006,118,8.2,98,"Drama,Fantasy,War","In the Falangist Spain of 1944, the bookish young stepdaughter of a sadistic army officer escapes into an eerie but captivating fantasy world.","656,000",Director:Guillermo del Toro
Thor: The Dark World,2013,112,6.8,54,"Action,Adventure,Fantasy","When the Dark Elves attempt to plunge the universe into darkness, Thor must embark on a perilous and personal journey that will reunite him with doctor Jane Foster.","657,853",Director:Alan Taylor
Rebel Moon,,0,0,0,"Adventure,Drama,Fantasy",The people of a galaxy sends a young woman to seek out warriors from other planets to help them from the tyrannical armies that are terrorizing their peaceful colony.,0,Director:Zack Snyder
Perfume: The Story of a Murderer,2006,147,7.5,56,"Crime,Drama,Fantasy","Jean-Baptiste Grenouille, born with a superior olfactory sense, creates the world's finest perfume. His work, however, takes a dark turn as he searches for the ultimate scent.","246,565",Director:Tom Tykwer
Scooby-Doo,2002,89,5.2,35,"Adventure,Comedy,Family","After an acrimonious break up, the Mystery Inc. gang are individually brought to an island resort to investigate strange goings on.","110,039",Director:Raja Gosnell
Palm Springs,2020,90,7.4,83,"Comedy,Fantasy,Mystery","Stuck in a time loop, two wedding guests develop a budding romance while living the same day over and over again.","148,882",Director:Max Barbakow
Ghost Whisperer,2005–2010,60,6.4,0,"Drama,Fantasy","A young woman, caught between the dead and the living, helps the dead resolve unfinished business with the living.","45,440",
It Chapter Two,2019,169,6.5,58,"Drama,Fantasy,Horror","Twenty-seven years after their first encounter with the terrifying Pennywise, the Losers Club have grown up and moved away, until a devastating phone call brings them back.","248,655",Director:Andy Muschietti
Star Wars: The Bad Batch,2021– ,0,7.9,0,"Animation,Action,Adventure",The 'Bad Batch' of elite and experimental clones make their way through an ever-changing galaxy in the immediate aftermath of the Clone Wars.,"27,402",
Rumble,2021,95,5.9,48,"Animation,Comedy,Family","In a world where monster wrestling is a global sport and monsters are superstar athletes, teenage Winnie seeks to follow in her father's footsteps by coaching a loveable underdog monster into a champion.","5,097",Director:Hamish Grieve
Suspiria,I 2018,152,6.7,64,"Drama,Fantasy,Horror","A darkness swirls at the center of a world-renowned dance company, one that will engulf the artistic director, an ambitious young dancer, and a grieving psychotherapist. Some will succumb to the nightmare. Others will finally wake up.","73,865",Director:Luca Guadagnino
Hercules,I 2014,98,6.0,47,"Action,Adventure,Fantasy","Having endured his legendary twelve labors, Hercules, the Greek demigod, has his life as a sword-for-hire tested when the King of Thrace and his daughter seek his aid in defeating a tyrannical warlord.","154,517",Director:Brett Ratner
Chaos Walking,2021,109,5.7,38,"Action,Adventure,Fantasy",Two unlikely companions embark on a perilous adventure through the badlands of an unexplored planet as they try to escape a dangerous and disorienting reality where all thoughts are seen and heard by everyone.,"43,803",Director:Doug Liman
Constantine,2005,121,7.0,50,"Action,Fantasy,Horror","Supernatural exorcist and demonologist John Constantine helps a policewoman prove her sister's death was not a suicide, but something more.","335,034",Director:Francis Lawrence
The Shape of Water,2017,123,7.3,87,"Drama,Fantasy,Romance","At a top secret research facility in the 1960s, a lonely janitor forms a unique relationship with an amphibious creature that is being held in captivity.","409,083",Director:Guillermo del Toro
Soul,2020,100,8.0,83,"Animation,Adventure,Comedy","After landing the gig of a lifetime, a New York jazz pianist suddenly finds himself trapped in a strange land between Earth and the afterlife.","308,840","Directors:Pete Docter, Kemp Powers"
Liar Liar,1997,86,6.9,70,"Comedy,Fantasy",A fast-track lawyer can't lie for 24 hours due to his son's birthday wish after he disappoints his son for the last time.,"302,803",Director:Tom Shadyac
13 Going on 30,2004,98,6.2,57,"Comedy,Fantasy,Romance","A girl makes a wish on her thirteenth birthday, and wakes up the next day as a thirty-year-old woman.","186,287",Director:Gary Winick
Yesterday,III 2019,116,6.8,55,"Comedy,Fantasy,Music",A struggling musician realizes he's the only person on Earth who can remember The Beatles after waking up in an alternate reality where they never existed.,"148,268",Director:Danny Boyle
The Magicians,2015–2020,60,7.6,0,"Drama,Fantasy,Mystery","After being recruited to a secretive academy, a group of students discover that the magic they read about as children is very real-and more dangerous than they ever imagined.","49,560",
Coraline,2009,100,7.7,80,"Animation,Drama,Family","An adventurous 11-year-old girl finds another world that is a strangely idealized version of her frustrating home, but it has sinister secrets.","219,335",Director:Henry Selick
Hotel Transylvania: Transformania,2022,87,6.0,46,"Animation,Adventure,Comedy","After one experiment, Johnny turns into a monster and everyone else becomes human. Now it has to be seen whether they will be able to reverse this experiment.","26,261","Directors:Derek Drymon, Jennifer Kluska"
The Gift,2000,112,6.7,62,"Drama,Fantasy,Horror",A fortune teller with extrasensory perception is asked to help find a young woman who has mysteriously disappeared.,"68,087",Director:Sam Raimi
Midnight in Paris,2011,94,7.7,81,"Comedy,Fantasy,Romance","While on a trip to Paris with his fiancée's family, a nostalgic screenwriter finds himself mysteriously going back to the 1920s every day at midnight.","416,169",Director:Woody Allen
How to Train Your Dragon,2010,98,8.1,75,"Animation,Action,Adventure","A hapless young Viking who aspires to hunt dragons becomes the unlikely friend of a young dragon himself, and learns there may be more to the creatures than he assumed.","719,680","Directors:Dean DeBlois, Chris Sanders"
Harley Quinn,2019– ,23,8.5,0,"Animation,Action,Adventure","The series focuses on a single Harley Quinn, who sets off to make it on her own in Gotham City.","23,385",
Bewitched,1964–1972,25,7.6,0,"Comedy,Family,Fantasy",A witch married to an ordinary man cannot resist using her magic powers to solve the problems her family faces.,"21,172",
The Legend of Tarzan,2016,110,6.2,44,"Action,Adventure,Drama","Tarzan, having acclimated to life in London, is called back to his former home in the jungle to investigate the activities at a mining encampment.","174,611",Director:David Yates
Pixels,2015,105,5.6,27,"Action,Comedy,Fantasy","When aliens misinterpret video feeds of classic arcade games as a declaration of war, they attack the Earth in the form of the video games.","141,618",Director:Chris Columbus
Percy Jackson and the Olympians,,60,0,0,"Action,Adventure,Drama",Disney + series based on Rick Riordan's 'Percy Jackson and the Olympians' novels.,0,
Clifford the Big Red Dog,2021,96,5.9,55,"Adventure,Comedy,Family",A young girl's love for a tiny puppy named Clifford makes the dog grow to an enormous size.,"11,527",Director:Walt Becker
Harry Potter and the Half-Blood Prince,2009,153,7.6,78,"Action,Adventure,Family","As Harry Potter begins his sixth year at Hogwarts, he discovers an old book marked as ""the property of the Half-Blood Prince"" and begins to learn more about Lord Voldemort's dark past.","527,759",Director:David Yates
The Secret Garden,1993,101,7.3,74,"Drama,Family,Fantasy","A young, recently-orphaned girl is sent to England after living in India all of her life. Once there, she begins to explore her new, seemingly-isolated surroundings, and its secrets.","41,068",Director:Agnieszka Holland
Boruto: Naruto Next Generations,2017– ,23,6.9,0,"Animation,Action,Adventure","Son of Naruto Uzumaki, Boruto, follows his father's footsteps along with his friends to become great ninja. Throughout all their adventures, Boruto is determined to make his mark in the ninja world and live outside of his father's shadow.","19,603",
Hercules,1997,93,7.3,74,"Animation,Adventure,Comedy",The son of Zeus and Hera is stripped of his immortality as an infant and must become a true hero in order to reclaim it.,"224,830","Directors:Ron Clements, John Musker"
Mandy,I 2018,121,6.5,81,"Action,Fantasy,Horror","The enchanted lives of a couple in a secluded forest are brutally shattered by a nightmarish hippie cult and their demon-biker henchmen, propelling a man into a spiraling, surreal rampage of vengeance.","75,649",Director:Panos Cosmatos
The Nevers,2021– ,58,7.4,0,"Action,Drama,Fantasy","An epic tale following a gang of Victorian women who find themselves with unusual abilities, relentless enemies, and a mission that might change the world.","21,839",
Paddington 2,2017,103,7.8,88,"Adventure,Comedy,Family","Paddington, now happily settled with the Brown family and a popular member of the local community, picks up a series of odd jobs to buy the perfect present for his Aunt Lucy's 100th birthday, only for the gift to be stolen.","73,296",Director:Paul King
Pirates of the Caribbean: Tales of the Code: Wedlocked,2011,10,6.7,0,"Short,Action,Adventure","In this short prequel to the first Pirates of the Caribbean movie, two feisty brides-to-be discover that they have something in common - the absent groom. Still, there are plenty of pirates who'd love to trade their goats for 'em.","2,728",Director:James Ward Byrkit
Shazam!,2019,132,7.0,71,"Action,Adventure,Comedy",A newly fostered young boy in search of his mother instead finds unexpected super powers and soon gains a powerful enemy.,"318,273",Director:David F. Sandberg
The Mask,1994,101,6.9,56,"Action,Comedy,Crime",Bank clerk Stanley Ipkiss is transformed into a manic superhero when he wears a mysterious mask.,"376,387",Director:Chuck Russell
Willy Wonka & the Chocolate Factory,1971,100,7.8,67,"Family,Fantasy,Musical",A poor but hopeful boy seeks one of the five coveted golden tickets that will send him on a tour of Willy Wonka's mysterious chocolate factory.,"196,380",Director:Mel Stuart
The Secret Life of Walter Mitty,2013,114,7.3,54,"Adventure,Comedy,Drama","When both he and a colleague are about to lose their job, Walter takes action by embarking on an adventure more extraordinary than anything he could have ever imagined.","311,879",Director:Ben Stiller
Tomorrow,2022– ,60,7.7,0,"Action,Comedy,Drama","Made half-human and half-spirit by accident, a young man is employed by a company of grim reapers in the underworld to carry out special missions.",611,
Dragon Ball Z,1989–2003,24,8.8,0,"Animation,Action,Adventure","With the help of the powerful Dragonballs, a team of fighters led by the saiyan warrior Goku defend the planet earth from extraterrestrial enemies.","125,731",
Labyrinth,1986,101,7.3,50,"Adventure,Family,Fantasy",Sixteen-year-old Sarah is given thirteen hours to solve a labyrinth and rescue her baby brother Toby when her wish for him to be taken away is granted by the Goblin King Jareth.,"134,143",Director:Jim Henson
Spider-Man: Across the Spider-Verse,2023,0,0,0,"Animation,Action,Adventure","Miles Morales returns for the next chapter of the Oscar®-winning Spider-Verse saga, an epic adventure that will transport Brooklyn's full-time, friendly neighborhood Spider-Man across the ...                See full summary »",0,"Directors:Joaquim Dos Santos, Kemp Powers, Justin K. Thompson"
Shazam! Fury of the Gods,2022,0,0,0,"Action,Adventure,Comedy",Sequel to the 2019 film 'Shazam!'. Plot details are not yet known.,0,Director:David F. Sandberg
Invasion,2021– ,60,5.9,0,"Drama,Fantasy,Sci-Fi",Earth is visited by an alien species that threatens humanity's existence. Events unfold in real time through the eyes of five ordinary people across the globe as they struggle to make sense of the chaos unraveling around them.,"25,259",
Gekijouban Jujutsu Kaisen 0,2021,105,7.9,72,"Animation,Action,Fantasy","Yuta Okkotsu, a high schooler who gains control of an extremely powerful Cursed Spirit and gets enrolled in the Tokyo Prefectural Jujutsu High School by Jujutsu Sorcerers to help him control his power and keep an eye on him.","7,145",Director:Seong-Hu Park
Godzilla: King of the Monsters,2019,132,6.0,48,"Action,Adventure,Fantasy","The crypto-zoological agency Monarch faces off against a battery of god-sized monsters, including the mighty Godzilla, who collides with Mothra, Rodan, and his ultimate nemesis, the three-headed King Ghidorah.","175,959",Director:Michael Dougherty
Clash of the Titans,2010,106,5.8,39,"Action,Adventure,Fantasy","Perseus, a demigod and the son of Zeus, battles the minions of Hades and the Underworld in order to stop them from conquering Olympus and Earth.","280,324",Director:Louis Leterrier
Big Fish,2003,125,8.0,58,"Adventure,Drama,Fantasy",A frustrated son tries to determine the fact from fiction in his dying father's life.,"435,753",Director:Tim Burton
Fate: The Winx Saga,2021– ,0,6.8,0,"Action,Adventure,Drama","A live-action adaptation of Nickelodeon's Winx Club (2004). It follows Bloom as she adjusts to life in the Otherworld, where she must learn to control her dangerous magical powers.","38,002",
Conan the Barbarian,1982,129,6.9,43,"Action,Adventure,Fantasy","A young boy, Conan, becomes a slave after his parents are killed and tribe destroyed by a savage warlord and sorcerer, Thulsa Doom. When he grows up he becomes a fearless, invincible fighter. Set free, he plots revenge against Thulsa Doom.","146,713",Director:John Milius
The Little Mermaid,2023,0,0,0,"Adventure,Family,Fantasy",A live-action remake of the animated Disney classic.,0,Director:Rob Marshall
A Bug's Life,1998,95,7.2,77,"Animation,Adventure,Comedy","A misfit ant, looking for ""warriors"" to save his colony from greedy grasshoppers, recruits a group of bugs that turn out to be an inept circus troupe.","286,471","Directors:John Lasseter, Andrew Stanton"
"Monsters, Inc.",2001,92,8.1,79,"Animation,Adventure,Comedy","In order to power the city, monsters have to scare children so that they scream. However, the children are toxic to the monsters, and after a child gets through, two monsters realize things may not be what they think.","882,756","Directors:Pete Docter, David Silverman, Lee Unkrich"
Untitled Super Mario Project,2023,0,0,0,"Animation,Adventure,Comedy","A plumber named Mario travels through an underground labyrinth with his brother, Luigi, trying to save a captured princess. Feature film adaptation of the popular video game.",0,"Directors:Aaron Horvath, Michael Jelenic"
Sabrina the Teenage Witch,1996–2003,22,6.7,0,"Comedy,Family,Fantasy","When a sixteen-year-old high school student finds out she's a witch, her two aunts offer guidance on how to control her newly-discovered magical powers.","38,385",
Warcraft,2016,123,6.7,32,"Action,Adventure,Fantasy","As an Orc horde invades the planet Azeroth using a magic portal, a few human heroes and dissenting Orcs must attempt to stop the true evil behind this war.","259,696",Director:Duncan Jones
Shadowhunters: The Mortal Instruments,2016–2019,42,6.4,0,"Action,Drama,Fantasy","After her mother disappears, Clary must venture into the dark world of demon hunting, and embrace her new role among the Shadowhunters.","61,028",
The OA,2016–2019,60,7.8,0,"Drama,Fantasy,Mystery","Having gone missing seven years ago, the previously blind Prairie returns home, now in her twenties with her sight restored. While many believe she is a miracle, others worry that she could be dangerous.","101,962",
Immortals,2011,110,6.0,46,"Action,Drama,Fantasy","Theseus is a mortal man chosen by Zeus to lead the fight against the ruthless King Hyperion, who is on a rampage across Greece to obtain a weapon that can destroy humanity.","167,248",Director:Tarsem Singh
The Old Guard,2020,125,6.6,70,"Action,Adventure,Fantasy",A covert team of immortal mercenaries is suddenly exposed and must now fight to keep their identity a secret just as an unexpected new member is discovered.,"157,144",Director:Gina Prince-Bythewood
King Arthur: Legend of the Sword,2017,126,6.7,41,"Action,Adventure,Drama","Robbed of his birthright, Arthur comes up the hard way in the back alleys of the city. But once he pulls the sword from the stone, he is forced to acknowledge his true legacy - whether he likes it or not.","212,464",Director:Guy Ritchie
Stargirl,2020– ,566,7.1,0,"Action,Adventure,Crime",Teenager Courtney Whitmore joins the Justice Society of America. Based on the character from DC Comics.,"16,657",
Kenpû Denki Berserk,1997–1998,23,8.7,0,"Animation,Action,Adventure","Guts is a skilled swordsman who joins forces with a mercenary group named 'The Band of the Hawk', lead by the charismatic Griffith, and fights with them as they battle their way into the royal court.","36,308",
Kung Fu Panda,2008,92,7.6,74,"Animation,Action,Adventure","To everyone's surprise, including his own, Po, an overweight, clumsy panda, is chosen as protector of the Valley of Peace. His suitability will soon be tested as the valley's arch-enemy is on his way.","455,861","Directors:Mark Osborne, John Stevenson"
Willow,1988,126,7.2,47,"Action,Adventure,Drama",A young farmer is chosen to undertake a perilous journey in order to protect a special baby from an evil queen.,"110,774",Director:Ron Howard
The Hobbit: The Desolation of Smaug,2013,161,7.8,66,"Adventure,Fantasy","The dwarves, along with Bilbo Baggins and Gandalf the Grey, continue their quest to reclaim Erebor, their homeland, from Smaug. Bilbo Baggins is in possession of a mysterious and magical ring.","642,750",Director:Peter Jackson
Castlevania,2017–2021,23,8.3,0,"Animation,Action,Adventure",A vampire hunter fights to save a besieged city from an army of otherworldly creatures controlled by Dracula.,"61,121",
Iron Fist,2017–2018,55,6.5,0,"Action,Adventure,Crime",A young man is bestowed with incredible martial arts skills and a mystical force known as the Iron Fist.,"127,137",
Bleach: Burîchi,2004–2012,24,8.2,0,"Animation,Action,Adventure","High school student Ichigo Kurosaki, who has the ability to see ghosts, gains soul reaper powers from Rukia Kuchiki and sets out to save the world from ""Hollows"".","51,733",
The Prince of Egypt,1998,99,7.1,64,"Animation,Adventure,Drama",Egyptian Prince Moses learns of his identity as a Hebrew and his destiny to become the chosen deliverer of his people.,"129,619","Directors:Brenda Chapman, Steve Hickner, Simon Wells"
One Punch Man: Wanpanman,2015–2019,24,8.7,0,"Animation,Action,Comedy","The story of Saitama, a hero that does it just for fun & can defeat his enemies with a single punch.","148,410",
Miracle Workers,2019– ,22,7.0,0,"Comedy,Drama,Fantasy","A comedy set in the offices of Heaven Inc. When God plans to destroy the Earth, two low-level angels must convince their boss to save humanity. They bet him they can pull off their most impossible miracle yet: help two humans fall in love.","13,824",
Somewhere in Time,1980,103,7.2,29,"Drama,Fantasy,Romance",A Chicago playwright uses self-hypnosis to travel back in time and meet the actress whose vintage portrait hangs in a grand hotel.,"29,173",Director:Jeannot Szwarc
Tangled,2010,100,7.7,71,"Animation,Adventure,Comedy","The magically long-haired Rapunzel has spent her entire life in a tower, but now that a runaway thief has stumbled upon her, she is about to discover the world for the first time, and who she really is.","440,133","Directors:Nathan Greno, Byron Howard"
Inside Job,2021– ,30,7.6,0,"Animation,Comedy,Fantasy","For employees of the Deep State, conspiracies aren't just theories, they're fact. And keeping them a secret is a full-time job.","15,129",
Aladdin,1992,90,8.0,86,"Animation,Adventure,Comedy",A kindhearted street urchin and a power-hungry Grand Vizier vie for a magic lamp that has the power to make their deepest wishes come true.,"402,880","Directors:Ron Clements, John Musker"
The Fairly OddParents,2001–2017,30,7.2,0,"Animation,Adventure,Comedy","After being tortured and humiliated by his babysitter, a ten year old boy is put under the care of two fairy godparents, who can grant him almost any wish, which leads to dire consequences.","38,948",
The Mummy,2017,111,5.4,34,"Action,Adventure,Fantasy","An ancient Egyptian princess is awakened from her crypt beneath the desert, bringing with her malevolence grown over millennia, and terrors that defy human comprehension.","183,958",Director:Alex Kurtzman
The Hobbit: The Battle of the Five Armies,2014,144,7.4,59,"Adventure,Fantasy",Bilbo and company are forced to engage in a war against an array of combatants and keep the Lonely Mountain from falling into the hands of a rising darkness.,"513,843",Director:Peter Jackson
The Twilight Saga: Breaking Dawn - Part 2,2012,115,5.5,52,"Adventure,Drama,Fantasy","After the birth of Renesmee/Nessie, the Cullens gather other vampire clans in order to protect the child from a false allegation that puts the family in front of the Volturi.","245,413",Director:Bill Condon
The Addams Family,1991,99,6.9,57,"Comedy,Fantasy",Con artists plan to fleece an eccentric family using an accomplice who claims to be their long-lost uncle.,"150,923",Director:Barry Sonnenfeld
Cinderella,I 2015,105,6.9,67,"Adventure,Drama,Family","When her father unexpectedly dies, young Ella finds herself at the mercy of her cruel stepmother and her scheming stepsisters. Never one to give up hope, Ella's fortunes begin to change after meeting a dashing stranger.","174,285",Director:Kenneth Branagh
The Lovely Bones,2009,135,6.6,42,"Drama,Fantasy,Thriller",Centers on a young girl who has been murdered and watches over her family - and her killer - from purgatory. She must weigh her desire for vengeance against her desire for her family to heal.,"167,878",Director:Peter Jackson
Chilling Adventures of Sabrina,2018–2020,60,7.4,0,"Drama,Fantasy,Horror","As her 16th birthday nears, Sabrina must choose between the witch world of her family and the human world of her friends. Based on the Archie comic.","90,336",
The Mummy Returns,2001,130,6.4,48,"Action,Adventure,Fantasy","The mummified body of Imhotep is shipped to a museum in London, where he once again wakes and begins his campaign of rage and terror.","318,870",Director:Stephen Sommers
Meet Joe Black,1998,178,7.2,43,"Drama,Fantasy,Romance","Death, who takes the form of a young man, asks a media mogul to act as a guide to teach him about life on Earth, and in the process, he falls in love with his guide's daughter.","234,133",Director:Martin Brest
