Movie,Production Year,Watchtime,Rating,Metascore,Genres,Description,Votes,Director
Star Wars: Episode VI - Return of the Jedi,1983,131,8.3,58,"Action,Adventure,Fantasy","After a daring mission to rescue Han Solo from Jabba the Hutt, the Rebels dispatch to Endor to destroy the second Death Star. Meanwhile, Luke struggles to help Darth Vader back from the dark side without falling into the Emperor's trap.","1,021,125",Director:Richard Marquand
Station Eleven,2021–2022,507,7.6,0,"Adventure,Drama,Fantasy","A post apocalyptic saga spanning multiple timelines, telling the stories of survivors of a devastating flu as they attempt to rebuild and reimagine the world anew while holding on to the best of what's been lost.","21,149",
Star Wars: Episode VIII - The Last Jedi,2017,152,6.9,84,"Action,Adventure,Fantasy","The Star Wars saga continues as new heroes and galactic legends go on an epic adventure, unlocking mysteries of the Force and shocking revelations of the past.","611,444",Director:Rian Johnson
Harry Potter and the Goblet of Fire,2005,157,7.7,81,"Adventure,Family,Fantasy","Harry Potter finds himself competing in a hazardous tournament between rival schools of magic, but he is distracted by recurring nightmares.","607,348",Director:Mike Newell
The Leftovers,2014–2017,60,8.3,0,"Drama,Fantasy,Mystery","Three years after the disappearance of 2% of the global human population, a group of people in a small New York community try to continue their lives while coping with the tragedy of the unexplained nature of the event.","93,910",
De uskyldige,2021,117,7.0,74,"Drama,Fantasy,Horror","During the bright Nordic summer, a group of children reveal their dark and mysterious powers when the adults aren't looking. In this original and gripping supernatural thriller, playtime takes a dangerous turn.","5,649",Director:Eskil Vogt
Suicide Squad,2016,123,5.9,40,"Action,Adventure,Fantasy",A secret government agency recruits some of the most dangerous incarcerated super-villains to form a defensive task force. Their first mission: save the world from the apocalypse.,"672,101",Director:David Ayer
Ghostbusters,1984,105,7.8,71,"Action,Comedy,Fantasy","Three parapsychologists forced out of their university funding set up shop as a unique ghost removal service in New York City, attracting frightened yet skeptical customers.","404,382",Director:Ivan Reitman
The Sandman,2022– ,0,0,0,"Drama,Fantasy,Horror","Upon escaping after decades of imprisonment by a mortal wizard, Dream, the personification of dreams, sets about to reclaim his lost equipment.",0,
Ms. Marvel,2022– ,0,0,0,"Action,Adventure,Comedy",New Jersey raised Kamala Khan learns she has polymorphous powers.,0,
The Lord of the Rings: The Return of the King,2003,201,9.0,94,"Action,Adventure,Drama",Gandalf and Aragorn lead the World of Men against Sauron's army to draw his gaze from Frodo and Sam as they approach Mount Doom with the One Ring.,"1,776,622",Director:Peter Jackson
A Discovery of Witches,2018–2022,60,7.9,0,"Drama,Fantasy,Romance","Diana Bishop, historian and witch, accesses Ashmole 782 and knows she must solve its mysteries. She is offered help by the enigmatic Matthew Clairmont, but he's a vampire and witches should never trust vampires.","50,646",
Wonka,2023,0,0,0,"Adventure,Comedy,Family",The story will focus specifically on a young Willy Wonka and how he met the Oompa-Loompas on one of his earliest adventures.,0,Director:Paul King
Dr. Strange,1978 TV Movie,93,5.1,0,"Action,Fantasy",A psychiatrist becomes the new Sorcerer Supreme of the Earth in order to battle an evil Sorceress from the past.,"1,832",Director:Philip DeGuere Jr.
SpongeBob SquarePants,1999– ,23,8.2,0,"Animation,Comedy,Family","The misadventures of a talking sea sponge who works at a fast food restaurant, attends a boating school, and lives in an underwater pineapple.","94,714",
Dark Shadows,2012,113,6.2,55,"Comedy,Fantasy,Horror","An imprisoned vampire, Barnabas Collins, is set free and returns to his ancestral home, where his dysfunctional descendants are in need of his protection.","262,970",Director:Tim Burton
Swiss Army Man,2016,97,6.9,64,"Comedy,Drama,Fantasy","A hopeless man stranded on a deserted island befriends a dead body, and together they go on a surreal journey to get home.","116,760","Directors:Dan Kwan, Daniel Scheinert"
The Flash,2023,0,0,0,"Action,Adventure,Fantasy","The plot is unknown. Feature film based on the comic book superhero, The Flash.",0,Director:Andy Muschietti
Seventh Son,I 2014,102,5.5,30,"Action,Adventure,Fantasy","When Mother Malkin, the queen of evil witches, escapes the pit she was imprisoned in by professional monster hunter Spook decades ago and kills his apprentice, he recruits young Tom, the seventh son of the seventh son, to help him.","76,398",Director:Sergei Bodrov
Jungle Cruise,2021,127,6.6,50,"Action,Adventure,Comedy",Based on Disneyland's theme park ride where a small riverboat takes a group of travelers through a jungle filled with dangerous animals and reptiles but with a supernatural element.,"176,811",Director:Jaume Collet-Serra
Moana,I 2016,107,7.6,81,"Animation,Adventure,Comedy","In Ancient Polynesia, when a terrible curse incurred by the Demigod Maui reaches Moana's island, she answers the Ocean's call to seek out the Demigod to set things right.","320,591","Directors:Ron Clements, John Musker, Don Hall, Chris Williams"
Naruto: Shippûden,2007–2017,24,8.7,0,"Animation,Action,Adventure","Naruto Uzumaki, is a loud, hyperactive, adolescent ninja who constantly searches for approval and recognition, as well as to become Hokage, who is acknowledged as the leader and strongest of all ninja in the village.","115,855",
Star Wars: Rebels,2014–2018,22,8.0,0,"Animation,Action,Adventure",A brave and clever ragtag starship crew stands up against the evil Empire as it tightens its grip on the galaxy and hunts down the last of the Jedi Knights.,"40,129",
Harry Potter and the Deathly Hallows: Part 2,2011,130,8.1,85,"Adventure,Fantasy,Mystery","Harry, Ron, and Hermione search for Voldemort's remaining Horcruxes in their effort to destroy the Dark Lord as the final battle rages on at Hogwarts.","845,506",Director:David Yates
Jigeum Uri Hakgyoneun,2022– ,60,7.5,0,"Action,Drama,Fantasy",A high school becomes ground zero for a zombie virus outbreak. Trapped students must fight their way out or turn into one of the rabid infected.,"41,417",
Thor,2011,115,7.0,57,"Action,Adventure,Fantasy","The powerful but arrogant god Thor is cast out of Asgard to live amongst humans in Midgard (Earth), where he soon becomes one of their finest defenders.","817,410",Director:Kenneth Branagh
Naruto,2002–2007,24,8.4,0,"Animation,Action,Adventure","Naruto Uzumaki, a mischievous adolescent ninja, struggles as he searches for recognition and dreams of becoming the Hokage, the village's leader and strongest ninja.","93,969",
Boku no hîrô akademia,2016– ,24,8.4,0,"Animation,Action,Adventure",A superhero-loving boy without any powers is determined to enroll in a prestigious hero academy and learn what it really means to be a hero.,"56,168",
Oz the Great and Powerful,2013,130,6.3,44,"Adventure,Family,Fantasy",A small-time magician is swept away to an enchanted land and is forced into a power struggle between three witches.,"206,427",Director:Sam Raimi
Locke & Key,2020– ,48,7.4,0,"Drama,Fantasy,Horror","After their father is murdered under mysterious circumstances, the three Locke siblings and their mother move into their ancestral home, Keyhouse, which they discover is full of magical keys that may be connected to their father's death.","74,135",
Sen to Chihiro no kamikakushi,2001,125,8.6,96,"Animation,Adventure,Family","During her family's move to the suburbs, a sullen 10-year-old girl wanders into a world ruled by gods, witches, and spirits, and where humans are changed into beasts.","731,668",Director:Hayao Miyazaki
Hook,1991,142,6.8,52,"Adventure,Comedy,Family","When Captain James Hook kidnaps his children, an adult Peter Pan must return to Neverland and reclaim his youthful spirit in order to challenge his old enemy.","250,136",Director:Steven Spielberg
Dolittle,2020,101,5.6,26,"Adventure,Comedy,Family",A physician who can talk to animals embarks on an adventure to find a legendary island with a young apprentice and a crew of strange pets.,"62,316",Director:Stephen Gaghan
Grimm,2011–2017,45,7.8,0,"Crime,Drama,Fantasy",A homicide detective discovers he is a descendant of hunters who fight supernatural forces.,"117,299",
Beauty and the Beast,I 2017,129,7.1,65,"Adventure,Family,Fantasy","A selfish Prince is cursed to become a monster for the rest of his life, unless he learns to fall in love with a beautiful young woman he keeps prisoner.","300,886",Director:Bill Condon
Stardust,2007,127,7.6,66,"Adventure,Family,Fantasy","In a countryside town bordering on a magical land, a young man makes a promise to his beloved that he'll retrieve a fallen star by venturing into the magical realm.","269,238",Director:Matthew Vaughn
Aşk ve Canavarlar,I 2020,109,6.9,63,"Action,Adventure,Comedy","Seven years after he survived the monster apocalypse, lovably hapless Joel leaves his cozy underground bunker behind on a quest to reunite with his ex.","120,922",Director:Michael Matthews
Beauty and the Beast,1991,84,8.0,95,"Animation,Family,Fantasy",A prince cursed to spend his days as a hideous monster sets out to regain his humanity by earning a young woman's love.,"442,085","Directors:Gary Trousdale, Kirk Wise"
Amphibia,2019–2022,23,8.1,0,"Animation,Action,Adventure","Ordinary Anne Boonchuy, 13, finds a music box that sends her to Amphibia, a world full of frogs, toads, and giant insects. With help from Sprig, she must adjust to life in Amphibia and discover the first true friendship in her life.","4,679",
Shining Vale,2022– ,29,6.8,0,"Comedy,Fantasy,Horror","A family moves to a small town into a house in which terrible atrocities have taken place. But no one seems to notice except for Pat, who's convinced she's either depressed or possessed - turns out, the symptoms are exactly the same.","2,322",
Annarasumanara,2022– ,70,8.1,0,"Drama,Fantasy,Music","When she was little, Yun Ai dreamed of becoming a magician. But in reality, she's just a high school student who can't even afford new socks. After meeting a mysterious magician at a carnival, she decides to follow her dream.","1,052",
Jujutsu Kaisen,2020– ,24,8.6,0,"Animation,Action,Adventure",A boy swallows a cursed talisman - the finger of a demon - and becomes cursed himself. He enters a shaman's school to be able to locate the demon's other body parts and thus exorcise himself.,"48,975",
Hunter x Hunter,2011–2014,24,9.0,0,"Animation,Action,Adventure","Gon Freecss aspires to become a Hunter, an exceptional being capable of greatness. With his friends and his potential, he seeks for his father who left him when he was younger.","87,886",
Harry Potter and the Prisoner of Azkaban,2004,142,7.9,82,"Adventure,Family,Fantasy","Harry Potter, Ron and Hermione return to Hogwarts School of Witchcraft and Wizardry for their third year of study, where they delve into the mystery surrounding an escaped prisoner who poses a dangerous threat to the young wizard.","614,047",Director:Alfonso Cuarón
Doctor Sleep,2019,152,7.3,59,"Drama,Fantasy,Horror","Years following the events of The Shining (1980), a now-adult Dan Torrance must protect a young girl with similar powers from a cult known as The True Knot, who prey on children with powers to remain immortal.","182,827",Director:Mike Flanagan
The Hobbit: An Unexpected Journey,2012,169,7.8,58,"Adventure,Fantasy","A reluctant Hobbit, Bilbo Baggins, sets out to the Lonely Mountain with a spirited group of dwarves to reclaim their mountain home, and the gold within it from the dragon Smaug.","803,641",Director:Peter Jackson
Into the Woods,2014,125,5.9,69,"Adventure,Comedy,Drama",A witch tasks a childless baker and his wife with procuring magical items from classic fairy tales to reverse the curse put on their family tree.,"139,752",Director:Rob Marshall
Scott Pilgrim vs. the World,2010,112,7.5,69,"Action,Comedy,Fantasy","In a magically realistic version of Toronto, a young man must defeat his new girlfriend's seven evil exes one by one in order to win her heart.","415,556",Director:Edgar Wright
Ash vs Evil Dead,2015–2018,30,8.4,0,"Action,Comedy,Fantasy","Ash has spent the last thirty years avoiding responsibility, maturity, and the terrors of the Evil Dead until a Deadite plague threatens to destroy all of mankind and Ash becomes mankind's only hope.","71,016",
Wonder Woman,2017,141,7.4,76,"Action,Adventure,Fantasy","When a pilot crashes and tells of conflict in the outside world, Diana, an Amazonian warrior in training, leaves home to fight a war, discovering her full powers and true destiny.","637,342",Director:Patty Jenkins
Alice in Wonderland,I 2010,108,6.4,53,"Adventure,Family,Fantasy","Nineteen-year-old Alice returns to the magical world from her childhood adventure, where she reunites with her old friends and learns of her true destiny: to end the Red Queen's reign of terror.","406,762",Director:Tim Burton
Wonder Woman 1984,2020,151,5.4,60,"Action,Adventure,Fantasy","Diana must contend with a work colleague and businessman, whose desire for extreme wealth sends the world down a path of destruction, after an ancient artifact that grants wishes goes missing.","254,305",Director:Patty Jenkins
"The Chronicles of Narnia: The Lion, the Witch and the Wardrobe",2005,143,6.9,75,"Adventure,Family,Fantasy",Four kids travel through a wardrobe to the land of Narnia and learn of their destiny to free it with the guidance of a mystical lion.,"390,438",Director:Andrew Adamson
Sonic Prime,2022– ,22,0,0,"Animation,Action,Adventure",Sonic in a high-octane adventure where the fate of a strange new multiverse rests in his gloved hands.,0,
Reign,2013–2017,42,7.4,0,"Drama,Fantasy","Mary, Queen of Scots, faces political and sexual intrigue in the treacherous world of the French court.","48,620",
The Outsider,2020,60,7.7,0,"Crime,Drama,Fantasy",Investigators are confounded over an unspeakable crime that's been committed.,"78,060",
Harry Potter and the Chamber of Secrets,2002,161,7.4,63,"Adventure,Family,Fantasy",An ancient prophecy seems to be coming true when a mysterious presence begins stalking the corridors of a school of magic and leaving its victims paralyzed.,"614,809",Director:Chris Columbus
The Twilight Zone,1959–1964,51,9.1,0,"Drama,Fantasy,Horror","Ordinary people find themselves in extraordinarily astounding situations, which they each try to solve in a remarkable manner.","80,598",
Dracula,1992,128,7.4,57,"Drama,Fantasy,Horror",The centuries old vampire Count Dracula comes to England to seduce his barrister Jonathan Harker's fiancée Mina Murray and inflict havoc in the foreign land.,"212,209",Director:Francis Ford Coppola
Petite maman,2021,73,7.4,93,"Drama,Fantasy",Nelly has just lost her grandmother and is helping her parents clean out her mother's childhood home. She explores the house and the surrounding woods. One day she meets a girl her same age building a treehouse.,"8,272",Director:Céline Sciamma
Ryû to sobakasu no hime,2021,121,7.2,83,"Animation,Adventure,Drama","Suzu is a shy high school student living in a rural village. For years, she has only been a shadow of herself. But when she enters ""U"", a massive virtual world, she escapes into her online persona as Belle, a globally-beloved singer.","7,363",Director:Mamoru Hosoda
About Time,I 2013,123,7.8,55,"Comedy,Drama,Fantasy","At the age of 21, Tim discovers he can travel in time and change what happens and has happened in his own life. His decision to make his world a better place by getting a girlfriend turns out not to be as easy as you might think.","337,328",Director:Richard Curtis
Jumanji: Welcome to the Jungle,2017,119,6.9,58,"Action,Adventure,Comedy","Four teenagers are sucked into a magical video game, and the only way they can escape is to work together to finish the game.","365,066",Director:Jake Kasdan
Ratatouille,2007,111,8.1,96,"Animation,Adventure,Comedy",A rat who can cook makes an unusual alliance with a young kitchen worker at a famous Paris restaurant.,"702,829","Directors:Brad Bird, Jan Pinkava"
American Gods,2017–2021,60,7.7,0,"Drama,Fantasy,Mystery","A recently released ex-convict named Shadow meets a mysterious man who calls himself ""Wednesday"" and who knows more than he first seems to about Shadow's life and past.","84,312",
Mortal Kombat,2021,110,6.1,44,"Action,Adventure,Fantasy",MMA fighter Cole Young seeks out Earth's greatest champions in order to stand against the enemies of Outworld in a high stakes battle for the universe.,"165,719",Director:Simon McQuoid
Shrek,2001,90,7.9,84,"Animation,Adventure,Comedy","A mean lord exiles fairytale creatures to the swamp of a grumpy ogre, who must go on a quest and rescue a princess for the lord in order to get his land back.","659,440","Directors:Andrew Adamson, Vicky Jenson"
Adventure Time,2010–2018,11,8.6,0,"Animation,Action,Adventure","A 12-year-old boy and his best friend, wise 28-year-old dog with magical powers, go on a series of surreal adventures with each other in a remote future.","89,955",
Harry Potter and the Order of the Phoenix,2007,138,7.5,71,"Action,Adventure,Family","With their warning about Lord Voldemort's return scoffed at, Harry and Dumbledore are targeted by the Wizard authorities as an authoritarian bureaucrat slowly seizes power at Hogwarts.","563,758",Director:David Yates
Death Note: Desu nôto,2006–2007,24,9.0,0,"Animation,Crime,Drama",An intelligent high school student goes on a secret crusade to eliminate criminals from the world after discovering a notebook capable of killing anyone whose name is written into it.,"302,116",
Batman Returns,1992,126,7.1,68,"Action,Crime,Fantasy","While Batman deals with a deformed man calling himself the Penguin wreaking havoc across Gotham with the help of a cruel businessman, a female employee of the latter becomes the Catwoman with her own vendetta.","299,737",Director:Tim Burton
Luca,2021,95,7.4,71,"Animation,Adventure,Comedy","On the Italian Riviera, an unlikely but strong friendship grows between a human being and a sea monster disguised as a human.","149,164",Director:Enrico Casarosa
Black Clover,2017–2021,24,8.3,0,"Animation,Action,Adventure","Asta and Yuno were abandoned together at the same church and have been inseparable since. As children, they promised that they would compete against each other to see who would become the next Emperor Magus.","19,982",
Angel,1999–2004,44,7.9,0,"Action,Drama,Fantasy","The vampire Angel, cursed with a soul, moves to Los Angeles and aids people with supernatural-related problems while questing for his own redemption.","69,428",
The Legend of Vox Machina,2022– ,30,8.4,0,"Animation,Action,Adventure","In a desperate attempt to pay off a mounting bar tab, a band of misfits end up on a quest to save the realm of Exandria from dark, magical forces.","19,060",
Carnival Row,2019– ,56,7.8,0,"Crime,Drama,Fantasy","A human detective and a fairy rekindle a dangerous affair in a Victorian fantasy world, where the city's uneasy peace collapses when a string of murders reveals an unimaginable monster.","59,049",
Miraculous: Tales of Ladybug & Cat Noir,2015– ,20,7.6,0,"Animation,Action,Adventure","Marinette and Adrien, two normal teens, transform into superheroes Ladybug and Cat Noir when an evil threatens their city.","10,636",
Good Omens,2019–2022,328,8.0,0,"Comedy,Fantasy","A tale of the bungling of Armageddon features an angel, a demon, an eleven-year-old Antichrist, and a doom-saying witch.","72,667",
Merlin,2008–2012,45,7.9,0,"Adventure,Drama,Fantasy","These are the brand new adventures of Merlin, the legendary sorcerer as a young man, when he was just a servant to young Prince Arthur on the royal court of Camelot, who has soon become his best friend, and turned Arthur into a great king and a legend.","80,147",
The Marvels,2023,0,0,0,"Action,Adventure,Fantasy",Sequel of the 2019 title 'Captain Marvel'.,0,Director:Nia DaCosta
Heroes,II 2006–2010,45,7.6,0,"Drama,Fantasy,Sci-Fi",Common people discover that they have super powers. Their lives intertwine as a devastating event must be prevented.,"238,357",
Evil Dead Rise,2022,120,0,0,"Fantasy,Horror,Thriller","A twisted tale of two estranged sisters whose reunion is cut short by the rise of flesh-possessing demons, thrusting them into a primal battle for survival as they face the most nightmarish version of family imaginable.",0,Director:Lee Cronin
JoJo no kimyô-na bôken,2012– ,30,8.4,0,"Animation,Action,Adventure","The story of the Joestar family, who are possessed with intense psychic strength, and the adventures each member encounters throughout their lives.","20,170",
Batman,1966–1968,25,7.5,0,"Action,Adventure,Comedy",The Caped Crusader and his young ward battle evildoers in Gotham City.,"21,976",
Field of Dreams,1989,107,7.5,57,"Drama,Family,Fantasy","Iowa farmer Ray Kinsella is inspired by a voice he can't ignore to pursue a dream he can hardly believe. Supported by his wife, Ray begins the quest by turning his ordinary cornfield into a place where dreams can come true.","117,271",Director:Phil Alden Robinson
Raya and the Last Dragon,2021,107,7.3,75,"Animation,Action,Adventure","In a realm known as Kumandra, a re-imagined Earth inhabited by an ancient civilization, a warrior named Raya is determined to find the last dragon.","142,211","Directors:Don Hall, Carlos López Estrada, Paul Briggs, John Ripa"
Charmed,2018– ,43,4.5,0,"Drama,Fantasy,Mystery","Follows the lives of three sisters who, after the tragic death of their mother, discover they are powerful witches.","16,091",
Fantastic Four,I 2005,106,5.7,40,"Action,Adventure,Fantasy","A group of astronauts gain superpowers after a cosmic radiation exposure and must use them to oppose the plans of their enemy, Doctor Victor Von Doom.","325,678",Director:Tim Story
The Lord of the Rings: The Two Towers,2002,179,8.8,87,"Action,Adventure,Drama","While Frodo and Sam edge closer to Mordor with the help of the shifty Gollum, the divided fellowship makes a stand against Sauron's new ally, Saruman, and his hordes of Isengard.","1,604,593",Director:Peter Jackson
Hagane no renkinjutsushi,2009–2012,24,9.1,0,"Animation,Action,Adventure",Two brothers search for a Philosopher's Stone after an attempt to revive their deceased mother goes awry and leaves them in damaged physical forms.,"156,540",
Sleepy Hollow,1999,105,7.3,65,"Fantasy,Horror,Mystery","Ichabod Crane is sent to Sleepy Hollow to investigate the decapitations of three people, with the culprit being the legendary apparition, The Headless Horseman.","352,616",Director:Tim Burton
Coco,I 2017,105,8.4,81,"Animation,Adventure,Comedy","Aspiring musician Miguel, confronted with his family's ancestral ban on music, enters the Land of the Dead to find his great-great-grandfather, a legendary singer.","476,579","Directors:Lee Unkrich, Adrian Molina"
Aladdin,2019,128,6.9,53,"Adventure,Comedy,Family",A kind-hearted street urchin and a power-hungry Grand Vizier vie for a magic lamp that has the power to make their deepest wishes come true.,"257,268",Director:Guy Ritchie
Valerian and the City of a Thousand Planets,2017,136,6.4,51,"Action,Adventure,Fantasy","A dark force threatens Alpha, a vast metropolis and home to species from a thousand planets. Special operatives Valerian and Laureline must race to identify the marauding menace and safeguard not just Alpha, but the future of the universe.","177,989",Director:Luc Besson
Frozen,I 2013,102,7.4,75,"Animation,Adventure,Comedy","When the newly crowned Queen Elsa accidentally uses her power to turn things into ice to curse her home in infinite winter, her sister Anna teams up with a mountain man, his playful reindeer, and a snowman to change the weather condition.","610,998","Directors:Chris Buck, Jennifer Lee"
Inside Out,I 2015,95,8.2,94,"Animation,Adventure,Comedy","After young Riley is uprooted from her Midwest life and moved to San Francisco, her emotions - Joy, Fear, Anger, Disgust and Sadness - conflict on how best to navigate a new city, house, and school.","687,399","Directors:Pete Docter, Ronnie Del Carmen"
Gravity Falls,2012–2016,23,8.9,0,"Animation,Action,Adventure","Twin siblings Dipper and Mabel Pines spend the summer at their great-uncle's tourist trap in the enigmatic Gravity Falls, Oregon.","97,534",
The Wizard of Oz,1939,102,8.1,92,"Adventure,Family,Fantasy","Young Dorothy Gale and her dog are swept away by a tornado from their Kansas farm to the magical Land of Oz, and embark on a quest with three new friends to see the Wizard, who can return her to her home and fulfill the others' wishes.","389,749","Directors:Victor Fleming, George Cukor, Mervyn LeRoy, Norman Taurog, Richard Thorpe, King Vidor"
The King's Daughter,2022,90,5.0,31,"Action,Adventure,Family","King Louis XIV's quest for immortality leads him to capture and steal a mermaid's life force, a move that is further complicated by his illegitimate daughter's discovery of the creature.","3,147",Director:Sean McNamara
Percy Jackson & the Olympians: The Lightning Thief,2010,118,5.8,47,"Adventure,Family,Fantasy",A teenager discovers he's the descendant of a Greek god and sets out on an adventure to settle an on-going battle between the gods.,"186,670",Director:Chris Columbus
Matilda,1996,98,6.9,72,"Comedy,Family,Fantasy","A girl gifted with a keen intellect and psychic powers uses both to deal with her crude, distant family and free her kind teacher from their sadistic headmistress.","146,402",Director:Danny DeVito
