Movie,Production Year,Watchtime,Rating,Metascore,Genres,Description,Votes,Director
The Lord of the Rings: The Rings of Power,2022– ,0,0,0,"Action,Adventure,Drama","Epic drama set thousands of years before the events of J.R.R. Tolkien's 'The Hobbit' and 'The Lord of the Rings' follows an ensemble cast of characters, both familiar and new, as they confront the long-feared re-emergence of evil to Middle-earth.",0,
Hawkeye,2021,60,7.6,0,"Action,Adventure,Crime","Series based on the Marvel Comics superhero Hawkeye, centering on the adventures of Young Avenger, Kate Bishop, who took on the role after the original Avenger, Clint Barton.","153,700",
Zack Snyder's Justice League,2021,242,8.0,54,"Action,Adventure,Fantasy","Determined to ensure Superman's ultimate sacrifice was not in vain, Bruce Wayne aligns forces with Diana Prince with plans to recruit a team of metahumans to protect the world from an approaching threat of catastrophic proportions.","376,801",Director:Zack Snyder
Jurassic Park,1993,127,8.2,68,"Action,Adventure,Sci-Fi",A pragmatic paleontologist touring an almost complete theme park on an island in Central America is tasked with protecting a couple of kids after a power failure causes the park's cloned dinosaurs to run loose.,"945,069",Director:Steven Spielberg
Avengers: Infinity War,2018,149,8.4,68,"Action,Adventure,Sci-Fi",The Avengers and their allies must be willing to sacrifice all in an attempt to defeat the powerful Thanos before his blitz of devastation and ruin puts an end to the universe.,"1,012,432","Directors:Anthony Russo, Joe Russo"
War of the Worlds,2005,116,6.5,73,"Action,Adventure,Sci-Fi",An alien invasion threatens the future of humanity. The catastrophic nightmare is depicted through the eyes of one American family fighting for survival.,"439,703",Director:Steven Spielberg
Pirates of the Caribbean: Dead Man's Chest,2006,151,7.3,53,"Action,Adventure,Fantasy","Jack Sparrow races to recover the heart of Davy Jones to avoid enslaving his soul to Jones' service, as other friends and foes seek the heart for their own agenda as well.","697,517",Director:Gore Verbinski
Heropanti 2,2022,145,6.1,0,"Action,Romance",Heropanti 2 is about a guy who helps people at night. Whether that be saving someone from a robbery or kidnapping this guy is always there. The Indian government finds out about this and ...                See full summary »,"22,098",Director:Ahmed Khan
Inception,2010,148,8.8,74,"Action,Adventure,Sci-Fi","A thief who steals corporate secrets through the use of dream-sharing technology is given the inverse task of planting an idea into the mind of a C.E.O., but his tragic past may doom the project and his team to disaster.","2,268,497",Director:Christopher Nolan
Star Wars: Episode I - The Phantom Menace,1999,136,6.5,51,"Action,Adventure,Fantasy","Two Jedi escape a hostile blockade to find allies and come across a young boy who may bring balance to the Force, but the long dormant Sith resurface to claim their original glory.","780,432",Director:George Lucas
Inhumans,2017,43,4.9,0,"Action,Adventure,Sci-Fi",An isolated community of superhumans fight to protect themselves.,"25,456",
Batwoman,2019–2022,45,3.3,0,"Action,Adventure,Crime",Batwoman seeks justice for Gotham City.,"42,741",
DC League of Super-Pets,2022,0,0,0,"Animation,Action,Adventure","Krypto the Super-Dog and Superman are inseparable best friends, sharing the same superpowers and fighting crime side by side in Metropolis. However, Krypto must master his own powers for a rescue mission when Superman is kidnapped.",0,"Directors:Jared Stern, Sam Levine"
La casa de papel,2017–2021,70,8.2,0,"Action,Crime,Drama",An unusual group of robbers attempt to carry out the most perfect robbery in Spanish history - stealing 2.4 billion euros from the Royal Mint of Spain.,"455,326",
Corrective Measures,2022,106,4.4,0,"Action,Sci-Fi,Thriller","Set in the world's most dangerous maximum-security penitentiary, home to the most treacherous criminals, tensions among the inmates and staff heighten, leading to anarchy that engulfs the prison and order is turned upside down.",348,Director:Sean Patrick O'Reilly
How It Ends,2018,113,5.0,36,"Action,Drama,Mystery","In the midst of an apocalypse, a man struggles to reach his pregnant wife, who is thousands of miles away.","52,199",Director:David M. Rosenthal
Snake Eyes: G.I. Joe Origins,2021,121,5.3,43,"Action,Adventure,Crime",A G.I. Joe spin-off centered around the character of Snake Eyes.,"35,188",Director:Robert Schwentke
Snowpiercer,2020– ,60,6.9,0,"Action,Drama,Sci-Fi","Seven years after the world has become a frozen wasteland, the remnants of humanity inhabit a perpetually-moving train that circles the globe, where class warfare, social injustice and the politics of survival play out.","51,958",
SEAL Team,2017– ,43,7.7,0,"Action,Drama,War","The lives of the elite Navy SEALs as they train, plan and execute the most dangerous, high-stakes missions the United States of America can ask.","23,742",
Cehennem Melekleri 4,,0,0,0,"Action,Adventure,Thriller",The plot is unknown.,0,Director:Scott Waugh
Tenet,2020,150,7.3,69,"Action,Adventure,Sci-Fi","Armed with only one word, Tenet, and fighting for the survival of the entire world, a Protagonist journeys through a twilight world of international espionage on a mission that will unfold in something beyond real time.","467,266",Director:Christopher Nolan
NCIS: Hawai'i,2021– ,43,6.1,0,"Action,Crime,Mystery",Follow a team of Naval criminal investigators who operate on the Hawaiian islands.,"4,512",
Gotham,2014–2019,42,7.8,0,"Action,Crime,Drama",The story behind Detective James Gordon's rise to prominence in Gotham City in the years before Batman's arrival.,"226,092",
Agents of S.H.I.E.L.D.,2013–2020,45,7.5,0,"Action,Adventure,Drama","The missions of the Strategic Homeland Intervention, Enforcement and Logistics Division.","213,663",
Buffy the Vampire Slayer,1997–2003,44,8.3,0,"Action,Drama,Fantasy","A young woman, destined to slay vampires, demons and other infernal creatures, deals with her life fighting evil, with the help of her friends.","142,880",
F9,2021,143,5.2,58,"Action,Crime,Thriller",Dom and the crew must take on an international terrorist who turns out to be Dom and Mia's estranged brother.,"122,684",Director:Justin Lin
FBI,2018– ,60,6.9,0,"Action,Crime,Drama",Procedural drama about the inner workings of the New York office of the Federal Bureau of Investigation.,"16,247",
The Last Duel,2021,152,7.4,67,"Action,Drama,History",King Charles VI declares that Knight Jean de Carrouges settle his dispute with his squire by challenging him to a duel.,"138,594",Director:Ridley Scott
Guardians of the Galaxy,2014,121,8.0,76,"Action,Adventure,Comedy",A group of intergalactic criminals must pull together to stop a fanatical warrior with plans to purge the universe.,"1,139,469",Director:James Gunn
The Wheel of Time,2021– ,60,7.1,0,"Action,Adventure,Drama","Set in a high fantasy world where magic exists, but only some can access it, a woman named Moiraine crosses paths with five young men and women. This sparks a dangerous, world-spanning journey. Based on the book series by Robert Jordan.","94,332",
Thor: Ragnarok,2017,130,7.9,74,"Action,Adventure,Comedy","Imprisoned on the planet Sakaar, Thor must race against time to return to Asgard and stop Ragnarök, the destruction of his world, at the hands of the powerful and ruthless villain Hela.","697,327",Director:Taika Waititi
Loin du périph,2022,119,5.7,43,"Action,Comedy,Crime","Diakité and Monge as police officers who are the complete opposite, and get paired together to uncover an unexpectedly big criminal case.","1,850",Director:Louis Leterrier
Star Wars: Episode IX - The Rise of Skywalker,2019,141,6.5,53,"Action,Adventure,Fantasy","In the riveting conclusion of the landmark Skywalker saga, new legends will be born-and the final battle for freedom is yet to come.","429,351",Director:J.J. Abrams
Jack Ryan,2018– ,60,8.0,0,"Action,Drama,Thriller",Up-and-coming CIA analyst Jack Ryan is thrust into a dangerous field assignment as he uncovers a pattern in terrorist communication that launches him into the center of a dangerous gambit.,"111,069",
Pirates of the Caribbean: On Stranger Tides,2011,137,6.6,45,"Action,Adventure,Fantasy","Jack Sparrow and Barbossa embark on a quest to find the elusive fountain of youth, only to discover that Blackbeard and his daughter are after it too.","513,733",Director:Rob Marshall
Star Trek: Deep Space Nine,1993–1999,45,8.1,0,"Action,Adventure,Drama","In the vicinity of the liberated planet of Bajor, the Federation space station Deep Space Nine guards the opening of a stable wormhole to the far side of the galaxy.","61,137",
Rogue One,2016,133,7.8,65,"Action,Adventure,Sci-Fi","In a time of conflict, a group of unlikely heroes band together on a mission to steal the plans to the Death Star, the Empire's ultimate weapon of destruction.","605,525",Director:Gareth Edwards
Blacklight,2022,104,4.7,27,"Action,Thriller","Travis Block is a government operative coming to terms with his shadowy past. When he discovers a plot targeting U.S. citizens, Block finds himself in the crosshairs of the FBI director he once helped protect.","10,967",Director:Mark Williams
Star Trek,1966–1969,50,8.4,0,"Action,Adventure,Sci-Fi","In the 23rd Century, Captain James T. Kirk and the crew of the U.S.S. Enterprise explore the galaxy and defend the United Federation of Planets.","81,269",
Heat,1995,170,8.3,76,"Action,Crime,Drama",A group of high-end professional thieves start to feel the heat from the LAPD when they unknowingly leave a clue at their latest heist.,"633,651",Director:Michael Mann
1917,2019,119,8.2,78,"Action,Drama,War","April 6th, 1917. As an infantry battalion assembles to wage war deep in enemy territory, two soldiers are assigned to race against time and deliver a message that will stop 1,600 men from walking straight into a deadly trap.","549,260",Director:Sam Mendes
Spider-Man: Homecoming,2017,133,7.4,73,"Action,Adventure,Sci-Fi","Peter Parker balances his life as an ordinary high school student in Queens with his superhero alter-ego Spider-Man, and finds himself on the trail of a new menace prowling the skies of New York City.","627,628",Director:Jon Watts
Pirates of the Caribbean: At World's End,2007,169,7.1,50,"Action,Adventure,Fantasy","Captain Barbossa, Will Turner and Elizabeth Swann must sail off the edge of the map, navigate treachery and betrayal, find Jack Sparrow, and make their final alliances for one last decisive battle.","633,756",Director:Gore Verbinski
The Lord of the Rings: The Fellowship of the Ring,2001,178,8.8,92,"Action,Adventure,Drama",A meek Hobbit from the Shire and eight companions set out on a journey to destroy the powerful One Ring and save Middle-earth from the Dark Lord Sauron.,"1,797,915",Director:Peter Jackson
Arrow,2012–2020,42,7.5,0,"Action,Adventure,Crime","Spoiled billionaire playboy Oliver Queen is missing and presumed dead when his yacht is lost at sea. He returns five years later a changed man, determined to clean up the city as a hooded vigilante armed with a bow.","425,730",
Batman Begins,2005,140,8.2,70,"Action,Crime,Drama","After training with his mentor, Batman begins his fight to free crime-ridden Gotham City from corruption.","1,426,547",Director:Christopher Nolan
Stargate SG-1,1997–2007,44,8.4,0,"Action,Adventure,Drama","A secret military team, SG-1, is formed to explore other planets through the recently discovered Stargates.","91,277",
Independence Day,1996,145,7.0,59,"Action,Adventure,Sci-Fi","The aliens are coming and their goal is to invade and destroy Earth. Fighting superior technology, mankind's best weapon is the will to survive.","562,790",Director:Roland Emmerich
Titans,I 2018– ,45,7.6,0,"Action,Adventure,Crime",A team of young superheroes combat evil and other perils.,"95,600",
The Dark Knight Rises,2012,164,8.4,78,"Action,Crime,Drama","Eight years after the Joker's reign of anarchy, Batman, with the help of the enigmatic Catwoman, is forced from his exile to save Gotham City from the brutal guerrilla terrorist Bane.","1,651,943",Director:Christopher Nolan
Hawaii Five-0,2010–2020,42,7.4,0,"Action,Crime,Drama","When Steve McGarrett returns home to Oahu to find his father's killer, the Governor offers him the chance to run his own task force: Five-0.","72,332",
Smallville,2001–2011,60,7.5,0,"Action,Adventure,Drama","A young Clark Kent struggles to find his place in the world as he learns to harness his alien powers for good and deals with the typical troubles of teenage life in Smallville, Kansas.","125,024",
Batman v Superman: Dawn of Justice Ultimate Edition,2016,182,7.3,0,"Action,Adventure,Sci-Fi",Batman is manipulated by Lex Luthor to fear Superman. Superman´s existence is meanwhile dividing the world and he is framed for murder during an international crisis. The heroes clash and force the neutral Wonder Woman to reemerge.,"36,505",
Justified,2010–2015,44,8.6,0,"Action,Crime,Drama","U.S. Marshal Raylan Givens is reassigned from Miami to his childhood home in the poor, rural coal mining towns of eastern Kentucky.","97,429",
Mission: Impossible - Dead Reckoning - Part One,2023,0,0,0,"Action,Adventure,Thriller",Seventh entry in the long-running Mission: Impossible series.,0,Director:Christopher McQuarrie
Black Widow,2021,134,6.7,67,"Action,Adventure,Sci-Fi",Natasha Romanoff confronts the darker parts of her ledger when a dangerous conspiracy with ties to her past arises.,"350,900",Director:Cate Shortland
Yakamoz S-245,2022– ,45,6.1,0,"Action,Adventure,Drama","After disaster strikes Earth, a marine biologist on a submarine research mission must fight to survive with the crew as a conspiracy comes to light.","4,444",
The Owl House,2020– ,22,8.1,0,"Animation,Action,Adventure","Accidentally sent to the world of the Boiling Isles before a trip to summer camp, a teenage human named Luz longs to become a witch, with the rebellious Eda and pint-sized demon King at her aid.","9,029",
Black Sails,2014–2017,56,8.2,0,"Action,Adventure,Drama","Follows Captain Flint and his pirates twenty years prior to Robert Louis Stevenson's classic novel ""Treasure Island.""","102,062",
"Love, Death & Robots",2019– ,15,8.4,0,"Animation,Short,Action","A collection of animated short stories that span various genres including science fiction, fantasy, horror and comedy.","135,461",
The Equalizer,2021– ,43,5.0,0,"Action,Crime,Drama",An enigmatic figure who uses her extensive skills to help those with nowhere else to turn.,"11,752",
Gods of Egypt,2016,127,5.4,25,"Action,Adventure,Fantasy","Mortal hero Bek teams with the god Horus in an alliance against Set, the merciless god of darkness, who has usurped Egypt's throne, plunging the once peaceful and prosperous empire into chaos and conflict.","115,317",Director:Alex Proyas
Station 19,2018– ,60,6.7,0,"Action,Drama,Romance","This spinoff of the critically acclaimed show Grey's Anatomy follows the lives of the men and women of firehouse station 19 in Seattle, Washington.","13,878",
Captain Marvel,2019,123,6.8,64,"Action,Adventure,Sci-Fi",Carol Danvers becomes one of the universe's most powerful heroes when Earth is caught in the middle of a galactic war between two alien races.,"532,458","Directors:Anna Boden, Ryan Fleck"
Gladiator,2000,155,8.5,67,"Action,Adventure,Drama",A former Roman General sets out to exact vengeance against the corrupt emperor who murdered his family and sent him into slavery.,"1,453,228",Director:Ridley Scott
Prison Break,2005–2017,44,8.3,0,"Action,Crime,Drama","Due to a political conspiracy, an innocent man is sent to death row and his only hope is his brother, who makes it his mission to deliberately get himself sent to the same prison in order to break the both of them out, from the inside.","517,275",
Deadpool,2016,108,8.0,65,"Action,Adventure,Comedy","A wisecracking mercenary gets experimented on and becomes immortal but ugly, and sets out to track down the man who ruined his looks.","996,141",Director:Tim Miller
Dunkirk,2017,106,7.8,94,"Action,Drama,History","Allied soldiers from Belgium, the British Commonwealth and Empire, and France are surrounded by the German Army and evacuated during a fierce battle in World War II.","631,981",Director:Christopher Nolan
Operation Fortune: Ruse de guerre,2022,114,7.4,0,"Action,Comedy,Thriller",Special agent Orson Fortune and his team of operatives recruit one of Hollywood's biggest movie stars to help them on an undercover mission when the sale of a deadly new weapons technology threatens to disrupt the world order.,227,Director:Guy Ritchie
Walker,2021– ,42,5.9,0,"Action,Crime,Drama","A widowed father returns to Austin after one year, attempting to reconnect with his children, navigate clashes with his family, and find common ground with his new partner, while growing increasingly suspicious of his wife's death.","10,467",
Drive Angry,2011,104,5.4,44,"Action,Fantasy,Thriller",A vengeful father escapes from hell and chases after the men who killed his daughter and kidnapped his granddaughter.,"98,494",Director:Patrick Lussier
Léon,1994,110,8.5,64,"Action,Crime,Drama","12-year-old Mathilda is reluctantly taken in by Léon, a professional assassin, after her family is murdered. An unusual relationship forms as she becomes his protégée and learns the assassin's trade.","1,126,102",Director:Luc Besson
Aliens,1986,137,8.4,84,"Action,Adventure,Sci-Fi","Fifty-seven years after surviving an apocalyptic attack aboard her space vessel by merciless space creatures, Officer Ripley awakens from hyper-sleep and tries to warn anyone who will listen about the predators.","699,286",Director:James Cameron
The Hunger Games,2012,142,7.2,68,"Action,Adventure,Sci-Fi",Katniss Everdeen voluntarily takes her younger sister's place in the Hunger Games: a televised competition in which two teenagers from each of the twelve Districts of Panem are chosen at random to fight to the death.,"898,003",Director:Gary Ross
X-Men: Apocalypse,2016,144,6.9,52,"Action,Adventure,Sci-Fi","In the 1980s the X-Men must defeat an ancient all-powerful mutant, En Sabah Nur, who intends to thrive through bringing destruction to the world.","424,263",Director:Bryan Singer
Ojing-eo geim,2021– ,55,8.0,0,"Action,Drama,Mystery","Hundreds of cash-strapped players accept a strange invitation to compete in children's games. Inside, a tempting prize awaits with deadly high stakes. A survival game that has a whopping 45.6 billion-won prize at stake.","416,802",
Jackass Forever,2022,96,7.0,74,"Documentary,Action,Comedy","After 11 years, the Jackass crew is back for another crusade.","32,736",Director:Jeff Tremaine
Never Back Down,2008,113,6.5,39,"Action,Drama,Sport",A frustrated and conflicted teenager arrives at a new high school to discover an underground fight club and meet a classmate who begins to coerce him into fighting.,"100,689",Director:Jeff Wadlow
Rambo: Last Blood,2019,89,6.1,26,"Action,Thriller",Rambo must confront his past and unearth his ruthless combat skills to exact revenge in a final mission.,"95,020",Director:Adrian Grunberg
Spider-Man: Far from Home,2019,129,7.4,69,"Action,Adventure,Sci-Fi","Following the events of Avengers: Endgame (2019), Spider-Man must step up to take on new threats in a world that has changed forever.","461,736",Director:Jon Watts
Teen Wolf,2011–2017,41,7.7,0,"Action,Drama,Fantasy",An average high school student and his best friend get caught up in some trouble causing him to receive a werewolf bite. As a result they find themselves in the middle of all sorts of dramas in Beacon Hills.,"142,731",
Star Trek: Voyager,1995–2001,44,7.8,0,"Action,Adventure,Sci-Fi","Pulled to the far side of the galaxy, where the Federation is seventy-five years away at maximum warp speed, a Starfleet ship must cooperate with Maquis rebels to find a way home.","67,256",
3 from Hell,2019,115,5.4,50,"Action,Horror","After barely surviving prison, the demented Firefly clan go on the run, unleashing a whole new wave of murder, madness and mayhem.","14,536",Director:Rob Zombie
Black Panther: Wakanda Forever,2022,0,0,0,"Action,Adventure,Drama",A sequel that will continue to explore the world of Wakanda and all the characters introduced in the 2018 film.,0,Director:Ryan Coogler
Captain America: Civil War,2016,147,7.8,75,"Action,Adventure,Sci-Fi",Political involvement in the Avengers' affairs causes a rift between Captain America and Iron Man.,"753,335","Directors:Anthony Russo, Joe Russo"
Spider-Man: Into the Spider-Verse,2018,117,8.4,87,"Animation,Action,Adventure","Teen Miles Morales becomes the Spider-Man of his universe, and must join with five spider-powered individuals from other dimensions to stop a threat for all realities.","489,277","Directors:Bob Persichetti, Peter Ramsey, Rodney Rothman"
The Punisher,2017–2019,53,8.5,0,"Action,Crime,Drama","After the murder of his family, Marine veteran Frank Castle becomes the vigilante known as ""The Punisher,"" with only one goal in mind: to avenge them.","220,253",
Mad Max: Fury Road,2015,120,8.1,90,"Action,Adventure,Sci-Fi","In a post-apocalyptic wasteland, a woman rebels against a tyrannical ruler in search for her homeland with the aid of a group of female prisoners, a psychotic worshiper, and a drifter named Max.","968,700",Director:George Miller
Venom,2018,112,6.6,35,"Action,Adventure,Sci-Fi","A failed reporter is bonded to an alien entity, one of many symbiotes who have invaded Earth. But the being takes a liking to Earth and decides to protect it.","465,402",Director:Ruben Fleischer
Avatar: The Last Airbender,2005–2008,23,9.3,0,"Animation,Action,Adventure","In a war-torn world of elemental magic, a young boy reawakens to undertake a dangerous mystic quest to fulfill his destiny as the Avatar, and bring peace to the world.","297,306",
Shadow and Bone,2021– ,60,7.6,0,"Action,Adventure,Drama",Dark forces conspire against orphan mapmaker Alina Starkov when she unleashes an extraordinary power that could change the fate of her war-torn world.,"77,790",
24,2001–2010,44,8.4,0,"Action,Crime,Drama",Jack Bauer races against the clock to subvert terrorist plots and save his nation from ultimate disaster.,"183,208",
Logan,2017,137,8.1,77,"Action,Drama,Sci-Fi","In a future where mutants are nearly extinct, an elderly and weary Logan leads a quiet life. But when Laura, a mutant child pursued by scientists, comes to him for help, he must get her to safety.","728,913",Director:James Mangold
Dune,1984,137,6.3,41,"Action,Adventure,Sci-Fi",A Duke's son leads desert warriors against the galactic emperor and his father's evil nemesis to free their desert world from the emperor's rule.,"159,795",Director:David Lynch
Red Notice,2021,118,6.3,37,"Action,Comedy,Thriller",An Interpol agent tracks the world's most wanted art thief.,"255,406",Director:Rawson Marshall Thurber
Star Wars: Episode III - Revenge of the Sith,2005,140,7.6,68,"Action,Adventure,Fantasy","Three years into the Clone Wars, the Jedi rescue Palpatine from Count Dooku. As Obi-Wan pursues a new threat, Anakin acts as a double agent between the Jedi Council and Palpatine and is lured into a sinister plan to rule the galaxy.","763,614",Director:George Lucas
Spartacus: Blood and Sand,2010–2013,55,8.5,0,"Action,Adventure,Biography","The life of Spartacus, the gladiator who lead a rebellion against the Romans. From his time as an ally of the Romans, to his betrayal and becoming a gladiator, to the rebellion he leads and its ultimate outcome.","237,148",
Invincible,2021– ,50,8.7,0,"Animation,Action,Adventure",An adult animated series based on the Skybound/Image comic about a teenager whose father is the most powerful superhero on the planet.,"114,260",
Banshee,2013–2016,60,8.4,0,"Action,Crime,Drama","An ex-con assumes the identity of a murdered sheriff in the small town of Banshee, Pennsylvania, where he has some unfinished business.","98,435",
Terminator 2: Judgment Day,1991,137,8.6,75,"Action,Sci-Fi","A cyborg, identical to the one who failed to kill Sarah Connor, must now protect her ten-year-old son John from a more advanced and powerful cyborg.","1,067,683",Director:James Cameron
Star Wars: Episode VII - The Force Awakens,2015,138,7.8,80,"Action,Adventure,Sci-Fi","As a new threat to the galaxy rises, Rey, a desert scavenger, and Finn, an ex-stormtrooper, must join Han Solo and Chewbacca to search for the one hope of restoring peace.","908,875",Director:J.J. Abrams
Outer Banks,2020– ,50,7.5,0,"Action,Crime,Drama",A group of teenagers from the wrong side of the tracks stumble upon a treasure map that unearths a long buried secret.,"43,390",
Bullet Train,2022,0,0,0,"Action,Thriller",Five assassins aboard a fast moving bullet train find out their missions have something in common.,0,Director:David Leitch
Iron Man,2008,126,7.9,79,"Action,Adventure,Sci-Fi","After being held captive in an Afghan cave, billionaire engineer Tony Stark creates a unique weaponized suit of armor to fight evil.","1,026,398",Director:Jon Favreau
The Matrix,1999,136,8.7,73,"Action,Sci-Fi","When a beautiful stranger leads computer hacker Neo to a forbidding underworld, he discovers the shocking truth--the life he knows is the elaborate deception of an evil cyber-intelligence.","1,857,867","Directors:Lana Wachowski, Lilly Wachowski"
Guardians of the Galaxy Vol. 2,2017,136,7.6,67,"Action,Adventure,Comedy","The Guardians struggle to keep together as a team while dealing with their personal family issues, notably Star-Lord's encounter with his father the ambitious celestial being Ego.","649,615",Director:James Gunn
